### ISSUE TITLE
Swarm container reject incomming connection from port 20 for an FTP client in active mode

### ISSUE THREAD

**Issue by ldebat** [docker/docker#31787]
**Description**

The goal is to run a java FTP client in active mode inside a container on a Swarm environment.
The FTP client in active mode open a socket for data connection (on an exposed port: 21030), to get the response of a LIST command for instance.
The FTP server tries to establish connection from source port 20 but is rejected at network level.

In the test environment, the FTP server is vsftpd. When the option connect_from_port_20 is set to NO, the FTP server uses a random source port and the communication works fine.

This issue has been found on docker v1.12.3 on a RHEL 7.2 host and reproduced on docker v17.03.0-ce on a CentOS 7.3 host. The base image is a CentOS 6.8 with java-1.6.0-openjdk.x86_64 installed

**Steps to reproduce the issue:**
1. Have an FTP server that accept active mode
2. Run a container from CentOS 6.8 image
`docker run -ti centos:6.8 bash`
3. Install JDK
`yum install -y java-1.6.0-openjdk.x86_64`
4. Leave the container and create the container image
`docker commit $(docker ps -qa) centos_jdk:6.8`
5. Copy the joined FtpClient.jar in $HOME directory
This is a small low level FTP client used for test and written in java. It is based on org.apache.commons.net.ftp.FTPClient java API. The jar file and the corresponding sources are joined to this issue.
6. Start the Swarm service
`docker service create -p 21030:21030 -p 21031:21031 --mount type=bind,source=$HOME,destination=/home_host -t centos_jdk:6.8 bash`
7. Exec a bash on the the container
`docker exec -ti $(docker ps -q) bash`
8. Get the eth0 IP address, used to configure the FTP client internal bind address
`ifconfig eth0 | grep "inet addr"`
9. Get the host IP address exposed to the FTP server, used to configure the external FTP client IP
9. Launch the FtpClient tool
`cd /home_host/`
`java -jar FtpClient.jar`
10. Configure the connection
If configuration is correct, the client should be connected to the command port of the server
11. Launch LIST command

**Describe the results you received:**
The FTP server failed to establish connection

**Describe the results you expected:**
The LIST command should return the files list of the current FTP directory

**Additional information you deem important (e.g. issue happens only occasionally):**
Here some network captures

In the following, the Docker host is x.x.x.217 and the FTP server is x.x.x.211

In a simple container (launched with docker run) the connection is well established and the listing is sent.
```
  0.098526 x.x.x.211 -> x.x.x.217 TCP ftp-data > 21030 [SYN] Seq=0 Win=14600 Len=0 MSS=1460 TSV=2449485623 TSER=0 WS=7
  0.098691 x.x.x.217 -> x.x.x.211 TCP 21030 > ftp-data [SYN, ACK] Seq=0 Ack=1 Win=14600 Len=0 MSS=1460 WS=7
...
  0.099199 x.x.x.211 -> x.x.x.217 FTP-DATA FTP Data: 1334 bytes
  0.099320 x.x.x.211 -> x.x.x.217 TCP ftp-data > 21030 [FIN, ACK] Seq=1335 Ack=1 Win=14720 Len=0
```

In a container launched by a Swarm service (docker service create) the TCP packet is reset and no trace of dropped packet found
```
  0.230802 x.x.x.211 -> x.x.x.217 TCP ftp-data > 21030 [SYN] Seq=0 Win=14600 Len=0 MSS=1460 TSV=2449553354 TSER=0 WS=7
  0.260654 x.x.x.217 -> x.x.x.211 TCP 21030 > ftp-data [RST, ACK] Seq=1 Ack=1 Win=0 Len=0
```

**Output of `docker version`:**

```
Client:
 Version:      17.03.0-ce
 API version:  1.26
 Go version:   go1.7.5
 Git commit:   3a232c8
 Built:        Tue Feb 28 08:10:07 2017
 OS/Arch:      linux/amd64

Server:
 Version:      17.03.0-ce
 API version:  1.26 (minimum version 1.12)
 Go version:   go1.7.5
 Git commit:   3a232c8
 Built:        Tue Feb 28 08:10:07 2017
 OS/Arch:      linux/amd64
 Experimental: false
```

**Output of `docker info`:**

```
Containers: 1
 Running: 1
 Paused: 0
 Stopped: 0
Images: 2
Server Version: 17.03.0-ce
Storage Driver: overlay
 Backing Filesystem: xfs
 Supports d_type: true
Logging Driver: json-file
Cgroup Driver: cgroupfs
Plugins:
 Volume: local
 Network: bridge host macvlan null overlay
Swarm: active
 NodeID: ij93zz3h4g4fam9ib55bqm8st
 Is Manager: true
 ClusterID: gjg3lppnkr6cs50yj3e2prgjb
 Managers: 1
 Nodes: 1
 Orchestration:
  Task History Retention Limit: 5
 Raft:
  Snapshot Interval: 10000
  Number of Old Snapshots to Retain: 0
  Heartbeat Tick: 1
  Election Tick: 3
 Dispatcher:
  Heartbeat Period: 5 seconds
 CA Configuration:
  Expiry Duration: 3 months
 Node Address: 10.29.156.219
 Manager Addresses:
  10.29.156.219:2377
Runtimes: runc
Default Runtime: runc
Init Binary: docker-init
containerd version: 977c511eda0925a723debdc94d09459af49d082a
runc version: a01dafd48bc1c7cc12bdb01206f9fea7dd6feb70
init version: 949e6fa
Security Options:
 seccomp
  Profile: default
Kernel Version: 3.10.0-514.el7.x86_64
Operating System: CentOS Linux 7 (Core)
OSType: linux
Architecture: x86_64
CPUs: 4
Total Memory: 3.702 GiB
Name: sds-docker219.corp.capgemini.com
ID: SM2K:TH27:UTQQ:LOEA:EFA7:WJ5W:M6PY:OIGA:QYT7:RX6V:AQQ5:QFBC
Docker Root Dir: /var/lib/docker
Debug Mode (client): false
Debug Mode (server): true
 File Descriptors: 40
 Goroutines: 137
 System Time: 2017-03-13T17:32:05.79351146+01:00
 EventsListeners: 1
Registry: https://index.docker.io/v1/
Experimental: false
Insecure Registries:
 127.0.0.0/8
Live Restore Enabled: false
```

**Additional environment details (AWS, VirtualBox, physical, etc.):**
The host OS is a CentOS 7.3 on a VmWare virtual machine

**Comment by ldebat** [comment]
I can't join the jar file, so this is the java file for the FTP client.
It have to be linked with commons-io-2.4 and commons-net-3.3 to be compiled.
[FtpClient.java.txt](https://github.com/docker/docker/files/838991/FtpClient.java.txt)

**Comment by aboch** [comment]
I think in this mode the server needs to know the real IP of the client.

Does it work if you start the service in `host` publish mode ?
`--publish mode=host,target=21030,published=21030 --publish mode=host,target=21031,published=21031`

**Comment by ldebat** [comment]
It works in host publish mode in docker 17.03, thank you
Is there any way to make it work in docker 1.12.3 as the host publish mode is not recognized in this version ?

**Comment by aboch** [comment]
> This solution works in docker v17.03 but not in v1.12.3.

> Is there any way to make it work in docker 1.12.3 as the host publish mode is not recognized in this version ?

I am afraid no, if you want to use docker service for that.
The host mode thing is available starting 1.13.0

**Comment by ldebat** [comment]
Any clue on the port 20 as source port problem ?
