### ISSUE TITLE
Swarm mode scaling to 1 replica doesn't route traffic correctly.

### ISSUE THREAD

**Issue by xylomo** [docker/docker#31785]
**Description**

I am trying to use Docker Swarm Mode (all nodes running 17.03-ce, Ubuntu 14.04). I have 2 nodes: 1 Manager, 1 worker. I ran `ufw disable` on both nodes, so firewall shouldn't be an issue.

When creating services via the `docker service create` command, the nodes balance traffic correctly when I set the replica to something more than 1. However, when I scale the service back down to 1, the nodes that do not have containers running do not route traffic to the node running the 1 container properly. 
 
According to the [docs](https://docs.docker.com/engine/swarm/ingress/), swarm mode should be using an ingress network that will automatically route traffic even if a node is not running any containers.

I have included the output on both nodes of various commands. In the output below the traffic is able to reach the worker node, but not the manager node. I find this weird because it looks like the manager node is listening on port 80, but its not being redirected.

**Steps to reproduce the issue:**
1. docker network create --driver=overlay sample
2. docker service create --name hello --network sample --publish 80:80 --replicas 2 dockercloud/hello-world
3. Traffic works fine on 2 nodes.
4. docker service scale hello=1
5. Traffic is only able to receive from the node running the container on the specified port.

**Describe the results you received:**

Traffic does not route properly after service has been scaled to 1.

**Describe the results you expected:**

Traffic to be routed properly after being scaled to 1.

**Additional information you deem important (e.g. issue happens only occasionally):**

**Output of `docker version`:**

```
Client:
 Version:      17.03.0-ce
 API version:  1.26
 Go version:   go1.7.5
 Git commit:   3a232c8
 Built:        Tue Feb 28 07:57:58 2017
 OS/Arch:      linux/amd64

Server:
 Version:      17.03.0-ce
 API version:  1.26 (minimum version 1.12)
 Go version:   go1.7.5
 Git commit:   3a232c8
 Built:        Tue Feb 28 07:57:58 2017
 OS/Arch:      linux/amd64
 Experimental: false
```

**Output of `docker info`:**

```
Containers: 1
 Running: 1
 Paused: 0
 Stopped: 0
Images: 5
Server Version: 17.03.0-ce
Storage Driver: aufs
 Root Dir: /data/docker/aufs
 Backing Filesystem: extfs
 Dirs: 35
 Dirperm1 Supported: true
Logging Driver: json-file
Cgroup Driver: cgroupfs
Plugins:
 Volume: local
 Network: bridge host macvlan null overlay
Swarm: active
 NodeID: wo61ouqdawc7eti9kvitedk8t
 Is Manager: false
 Node Address: x.x.x.x
 Manager Addresses:
  x.x.x.x:2377
Runtimes: runc
Default Runtime: runc
Init Binary: docker-init
containerd version: 977c511eda0925a723debdc94d09459af49d082a
runc version: a01dafd48bc1c7cc12bdb01206f9fea7dd6feb70
init version: 949e6fa
Security Options:
 apparmor
Kernel Version: 4.2.0-42-generic
Operating System: Ubuntu 14.04.4 LTS
OSType: linux
Architecture: x86_64
CPUs: 2
Total Memory: 2.768 GiB
Name: <host>
ID: PTH4:5J2O:3CZO:F3WI:WVHV:H2GH:IACJ:UTNP:YEIL:IHGS:EPUB:S57Y
Docker Root Dir: /data/docker
Debug Mode (client): false
Debug Mode (server): false
Registry: https://index.docker.io/v1/
WARNING: No swap limit support
Experimental: false
Insecure Registries:
 127.0.0.0/8
Live Restore Enabled: false
```

**Additional environment details (AWS, VirtualBox, physical, etc.):**

Netstat output:

*Manager*

```
# docker service inspect hello
...
"Endpoint": {
            "Spec": {
                "Mode": "vip",
                "Ports": [
                    {
                        "Protocol": "tcp",
                        "TargetPort": 80,
                        "PublishedPort": 80,
                        "PublishMode": "ingress"
                    }
                ]
            },
            "Ports": [
                {
                    "Protocol": "tcp",
                    "TargetPort": 80,
                    "PublishedPort": 80,
                    "PublishMode": "ingress"
                }
            ],
            "VirtualIPs": [
                {
                    "NetworkID": "omgayyn9454kewjjc2twxs0aq",
                    "Addr": "x.x.x.x/16"
                },
                {
                    "NetworkID": "5y80givk6kjpirdpn40bgfgzg",
                    "Addr": "x.x.x.x/24"
                }
            ]
        },
...
```

```
# netstat -tunap | grep LISTEN
tcp        0      0 0.0.0.0:2223            0.0.0.0:*               LISTEN      767/rpc.statd
tcp        0      0 0.0.0.0:111             0.0.0.0:*               LISTEN      761/rpcbind
tcp        0      0 0.0.0.0:22              0.0.0.0:*               LISTEN      1090/sshd
tcp        0      0 0.0.0.0:25              0.0.0.0:*               LISTEN      2024/master
tcp6       0      0 :::2377                 :::*                    LISTEN      905/dockerd
tcp6       0      0 :::7946                 :::*                    LISTEN      905/dockerd
tcp6       0      0 :::111                  :::*                    LISTEN      761/rpcbind
tcp6       0      0 :::80                   :::*                    LISTEN      905/dockerd
tcp6       0      0 :::22                   :::*                    LISTEN      1090/sshd
tcp6       0      0 :::25                   :::*                    LISTEN      2024/master
tcp6       0      0 :::40057                :::*                    LISTEN      767/rpc.statd
```

```
 iptables -t nat -L
Chain PREROUTING (policy ACCEPT)
target     prot opt source               destination
DOCKER-INGRESS  all  --  anywhere             anywhere             ADDRTYPE match dst-type LOCAL
DOCKER     all  --  anywhere             anywhere             ADDRTYPE match dst-type LOCAL

Chain INPUT (policy ACCEPT)
target     prot opt source               destination

Chain OUTPUT (policy ACCEPT)
target     prot opt source               destination
DOCKER-INGRESS  all  --  anywhere             anywhere             ADDRTYPE match dst-type LOCAL
DOCKER     all  --  anywhere            !loopback/8           ADDRTYPE match dst-type LOCAL

Chain POSTROUTING (policy ACCEPT)
target     prot opt source               destination
MASQUERADE  all  --  anywhere             anywhere             ADDRTYPE match src-type LOCAL
MASQUERADE  all  --  172.17.0.0/16        anywhere
MASQUERADE  all  --  172.19.0.0/16        anywhere

Chain DOCKER (2 references)
target     prot opt source               destination
RETURN     all  --  anywhere             anywhere
RETURN     all  --  anywhere             anywhere

Chain DOCKER-INGRESS (2 references)
target     prot opt source               destination
DNAT       tcp  --  anywhere             anywhere             tcp dpt:http to:172.19.0.2:80
RETURN     all  --  anywhere             anywhere

```

```
# docker service ps hello
ID            NAME     IMAGE                           NODE             DESIRED STATE  CURRENT STATE           ERROR  PORTS
ycy2c4637ed0  hello.1  dockercloud/hello-world:latest  <host>    Running        Running 20 minutes ago
```

*Worker*
```
netstat -tunap | grep LISTEN
tcp        0      0 0.0.0.0:111             0.0.0.0:*               LISTEN      660/rpcbind
tcp        0      0 0.0.0.0:33332           0.0.0.0:*               LISTEN      740/rpc.statd
tcp        0      0 0.0.0.0:22              0.0.0.0:*               LISTEN      1036/sshd
tcp        0      0 0.0.0.0:25              0.0.0.0:*               LISTEN      2026/master
tcp6       0      0 :::7946                 :::*                    LISTEN      904/dockerd
tcp6       0      0 :::111                  :::*                    LISTEN      660/rpcbind
tcp6       0      0 :::80                   :::*                    LISTEN      904/dockerd
tcp6       0      0 :::22                   :::*                    LISTEN      1036/sshd
tcp6       0      0 :::25                   :::*                    LISTEN      2026/master
tcp6       0      0 :::30533                :::*                    LISTEN      740/rpc.statd
```

```
iptables -t nat -L
Chain PREROUTING (policy ACCEPT)
target     prot opt source               destination
DOCKER-INGRESS  all  --  anywhere             anywhere             ADDRTYPE match dst-type LOCAL
DOCKER     all  --  anywhere             anywhere             ADDRTYPE match dst-type LOCAL

Chain INPUT (policy ACCEPT)
target     prot opt source               destination

Chain OUTPUT (policy ACCEPT)
target     prot opt source               destination
DOCKER-INGRESS  all  --  anywhere             anywhere             ADDRTYPE match dst-type LOCAL
DOCKER     all  --  anywhere            !loopback/8           ADDRTYPE match dst-type LOCAL

Chain POSTROUTING (policy ACCEPT)
target     prot opt source               destination
MASQUERADE  all  --  anywhere             anywhere             ADDRTYPE match src-type LOCAL
MASQUERADE  all  --  172.17.0.0/16        anywhere
MASQUERADE  all  --  172.19.0.0/16        anywhere

Chain DOCKER (2 references)
target     prot opt source               destination
RETURN     all  --  anywhere             anywhere
RETURN     all  --  anywhere             anywhere

Chain DOCKER-INGRESS (2 references)
target     prot opt source               destination
DNAT       tcp  --  anywhere             anywhere             tcp dpt:http to:172.19.0.2:80
RETURN     all  --  anywhere             anywhere

```

```
# docker ps
CONTAINER ID        IMAGE                                                                                             COMMAND                  CREATED             STATUS              PORTS               NAMES
6438dac02a6d        dockercloud/hello-world@sha256:629d6815beea1ec5172ce4b56ffa0e2c3fbe288a2e5abda3076aed08ee154e72   "/bin/sh -c 'php-f..."   23 minutes ago      Up 23 minutes       80/tcp              hello.1.ycy2c4637ed0cuxqsh75wda17
```

**Comment by aboch** [comment]
Thanks @xylomo for the report.
Can you please attach the daemon logs, if you still have them. Thanks

**Comment by xylomo** [comment]
Sorry, my organization won't allow me to post the logs because of the IPs and hostnames that are located in there. 

Is there something in particular that you are looking for? I can see it setting up the network on the worker:

```
time="2017-03-13T13:03:16.205007345-04:00" level=debug msg="Creating service for vip 10.255.0.4 fwMark 256 ingressPorts []*libnetwork.PortConfig{&libnetwork.PortConfig{Name: \"\",\nProtocol: 0,\nTargetPort: 0x50,\nPublishedPort: 0x50,\n}} in sbox ingress (ingress)"
INFO[0000] Firewalld running: false
time="2017-03-13T13:03:16.277853915-04:00" level=debug msg="Programming external connectivity on endpoint gateway_ingress-sbox (fccd07e9264a79d7a4cb1542b755512235a0f0d62a7f6b40b4fda40beab7ce7b)"
```

**Comment by aboch** [comment]
Do you see any obvious error/warnings in the daemon logs when scaling down the service?

You can replace any sensible info from the logs, before posting it.

**Comment by xylomo** [comment]
Okay, I am tailing the log file when I make a request to the node that does not have any running containers. This is the output:

```
time="2017-03-13T13:19:26.130764916-04:00" level=debug msg="Miss notification, l2 mac 02:42:0a:ff:00:03"
time="2017-03-13T13:19:26.767732055-04:00" level=debug msg="memberlist: Initiating push/pull sync with: <manager-ip>:7946"
time="2017-03-13T13:19:31.137987392-04:00" level=debug msg="Miss notification, l2 mac 02:42:0a:ff:00:05"
time="2017-03-13T13:19:45.165270082-04:00" level=debug msg="<worker>-cf41a0ccc591: Initiating bulk sync with nodes [<manager>-2220d2691ba1]"
time="2017-03-13T13:19:45.165360269-04:00" level=debug msg="<worker>-cf41a0ccc591: Initiating unsolicited bulk sync for networks [omgayyn9454kewjjc2twxs0aq] with node <manager>-2220d2691ba1"
time="2017-03-13T13:19:45.167381628-04:00" level=debug msg="memberlist: TCP connection from=<manager-ip>:36060"
time="2017-03-13T13:19:45.167803585-04:00" level=debug msg="<worker>-cf41a0ccc591: Bulk sync to node <manager>-2220d2691ba1 took 1.412808ms"
time="2017-03-13T13:19:46.262955572-04:00" level=debug msg="memberlist: TCP connection from=<manager-ip>:36062"
```

**Comment by aboch** [comment]
Thanks.
If you can find them, I would like to see the logs printed as a result of the `docker service scale <name>=1`

**Comment by xylomo** [comment]
Sure, here you go:

```
time="2017-03-13T13:28:38.950894543-04:00" level=debug msg="Calling GET /_ping"
time="2017-03-13T13:28:38.951615983-04:00" level=debug msg="Calling GET /v1.26/services/hello"
time="2017-03-13T13:28:38.954599508-04:00" level=debug msg="Calling POST /v1.26/services/wc9jggth8ryx6usn7jls4k5oe/update?version=447"
time="2017-03-13T13:28:38.954791649-04:00" level=debug msg="form data: {\"EndpointSpec\":{\"Mode\":\"vip\",\"Ports\":[{\"Protocol\":\"tcp\",\"PublishMode\":\"ingress\",\"PublishedPort\":80,\"TargetPort\":80}]},\"Mode\":{\"Replicated\":{\"Replicas\":1}},\"Name\":\"hello\",\"Networks\":[{\"Target\":\"hello\"}],\"TaskTemplate\":{\"ContainerSpec\":{\"DNSConfig\":{},\"Image\":\"dockercloud/hello-world:latest@sha256:629d6815beea1ec5172ce4b56ffa0e2c3fbe288a2e5abda3076aed08ee154e72\"},\"ForceUpdate\":0,\"Networks\":[{\"Target\":\"5y80givk6kjpirdpn40bgfgzg\"}],\"Placement\":{},\"Resources\":{\"Limits\":{},\"Reservations\":{}},\"RestartPolicy\":{\"Condition\":\"any\",\"MaxAttempts\":0}},\"UpdateConfig\":{\"FailureAction\":\"pause\",\"MaxFailureRatio\":0,\"Parallelism\":1}}"
time="2017-03-13T13:28:38.955588789-04:00" level=debug msg="updating service using supplied digest reference dockercloud/hello-world:latest@sha256:629d6815beea1ec5172ce4b56ffa0e2c3fbe288a2e5abda3076aed08ee154e72"
time="2017-03-13T13:28:38.958969591-04:00" level=debug msg="Service wc9jggth8ryx6usn7jls4k5oe was scaled down from 2 to 1 instances"
time="2017-03-13T13:28:38.961783348-04:00" level=debug msg="ReleaseAddress(GlobalDefault/10.255.0.0/16, 10.255.0.5)"
time="2017-03-13T13:28:38.961983763-04:00" level=debug msg="ReleaseAddress(GlobalDefault/10.0.0.0/24, 10.0.0.3)"
time="2017-03-13T13:28:39.066244632-04:00" level=warning msg="cannot find target task in store" method="(*Dispatcher).UpdateTaskStatus" node.id=wo61ouqdawc7eti9kvitedk8t node.session=075c75xc4eky0laedpacwdss4 task.id=sa76vcfh27v6a3n5fttu9avgs
time="2017-03-13T13:28:39.104673874-04:00" level=error msg="task unavailable" method="(*Dispatcher).processUpdates" module=dispatcher task.id=sa76vcfh27v6a3n5fttu9avgs
time="2017-03-13T13:28:39.366032947-04:00" level=debug msg="miss notification for dest IP, 10.0.0.3"
time="2017-03-13T13:28:39.366036766-04:00" level=debug msg="checkEncryption(5y80giv, <worker-ip>, 0, false)"
time="2017-03-13T13:28:39.566390352-04:00" level=debug msg="miss notification for dest IP, 10.255.0.5"
time="2017-03-13T13:28:39.566395594-04:00" level=debug msg="checkEncryption(omgayyn, <worker-ip>, 0, false)"
time="2017-03-13T13:28:45.165860349-04:00" level=debug msg="memberlist: TCP connection from=<worker-ip>:19592"
time="2017-03-13T13:28:45.166195090-04:00" level=debug msg="<manager>-2220d2691ba1: Initiating  bulk sync for networks [omgayyn9454kewjjc2twxs0aq] with node <worker>-cf41a0ccc591"
time="2017-03-13T13:28:46.297719990-04:00" level=debug msg="memberlist: Initiating push/pull sync with: <worker-ip>:7946"
time="2017-03-13T13:28:52.998287861-04:00" level=debug msg="<manager>-2220d2691ba1: Initiating bulk sync with nodes [<worker>-cf41a0ccc591]"
time="2017-03-13T13:28:52.998360869-04:00" level=debug msg="<manager>-2220d2691ba1: Initiating unsolicited bulk sync for networks [omgayyn9454kewjjc2twxs0aq] with node <worker>-cf41a0ccc591"
```

**Comment by aboch** [comment]
I cannot see anything wrong from the logs, neither I can reproduce.

We need to do more debugging, check if the tx or rx path is broken.
Can you see if the request that fails reaches the container on the other node ?

You can capture on each host with, when you run the request you know will fail: 
```
 sudo tcpdump -n -v -i any 'port 4789 or port 80'
```

then please replace the host IP in the capture with `worker-IP` and `manager-IP` for example, and attach it here.

Thanks.

**Comment by xylomo** [comment]
Worker:

```
tcpdump: listening on any, link-type LINUX_SLL (Linux cooked), capture size 65535 bytes
14:18:38.076279 IP (tos 0x20, ttl 122, id 7687, offset 0, flags [DF], proto TCP (6), length 52)
    <client-IP>.65371 > <manager-IP>.80: Flags [S], cksum 0x370f (correct), seq 3348226136, win 8192, options [mss 1460,nop,wscale 8,nop,nop,sackOK], length 0
14:18:38.076312 IP (tos 0x20, ttl 121, id 7687, offset 0, flags [DF], proto TCP (6), length 52)
    <client-IP>.65371 > 172.19.0.2.80: Flags [S], cksum 0xdb41 (correct), seq 3348226136, win 8192, options [mss 1460,nop,wscale 8,nop,nop,sackOK], length 0
14:18:38.076316 IP (tos 0x20, ttl 121, id 7687, offset 0, flags [DF], proto TCP (6), length 52)
    <client-IP>.65371 > 172.19.0.2.80: Flags [S], cksum 0xdb41 (correct), seq 3348226136, win 8192, options [mss 1460,nop,wscale 8,nop,nop,sackOK], length 0
14:18:38.076362 IP (tos 0x0, ttl 64, id 31241, offset 0, flags [none], proto UDP (17), length 102)
    <manager-IP>.57844 > <manager-IP>.4789: VXLAN, flags [I] (0x08), vni 4096
IP (tos 0x20, ttl 121, id 7687, offset 0, flags [DF], proto TCP (6), length 52)
    10.255.0.3.65371 > 10.255.0.5.80: Flags [S], cksum 0x9174 (correct), seq 3348226136, win 8192, options [mss 1460,nop,wscale 8,nop,nop,sackOK], length 0
14:18:38.329479 IP (tos 0x20, ttl 122, id 7688, offset 0, flags [DF], proto TCP (6), length 52)
    <client-IP>.65372 > <manager-IP>.80: Flags [S], cksum 0x2536 (correct), seq 1052211979, win 8192, options [mss 1460,nop,wscale 8,nop,nop,sackOK], length 0
14:18:38.329518 IP (tos 0x20, ttl 121, id 7688, offset 0, flags [DF], proto TCP (6), length 52)
    <client-IP>.65372 > 172.19.0.2.80: Flags [S], cksum 0xc968 (correct), seq 1052211979, win 8192, options [mss 1460,nop,wscale 8,nop,nop,sackOK], length 0
14:18:38.329523 IP (tos 0x20, ttl 121, id 7688, offset 0, flags [DF], proto TCP (6), length 52)
    <client-IP>.65372 > 172.19.0.2.80: Flags [S], cksum 0xc968 (correct), seq 1052211979, win 8192, options [mss 1460,nop,wscale 8,nop,nop,sackOK], length 0
14:18:38.329573 IP (tos 0x0, ttl 64, id 31292, offset 0, flags [none], proto UDP (17), length 102)
    <manager-IP>.57296 > <manager-IP>.4789: VXLAN, flags [I] (0x08), vni 4096
IP (tos 0x20, ttl 121, id 7688, offset 0, flags [DF], proto TCP (6), length 52)
    10.255.0.3.65372 > 10.255.0.5.80: Flags [S], cksum 0x7f9b (correct), seq 1052211979, win 8192, options [mss 1460,nop,wscale 8,nop,nop,sackOK], length 0
14:18:44.078142 IP (tos 0x20, ttl 122, id 7690, offset 0, flags [DF], proto TCP (6), length 48)
    <client-IP>.65371 > <manager-IP>.80: Flags [S], cksum 0x4b1e (correct), seq 3348226136, win 8192, options [mss 1460,nop,nop,sackOK], length 0
14:18:44.078189 IP (tos 0x20, ttl 121, id 7690, offset 0, flags [DF], proto TCP (6), length 48)
    <client-IP>.65371 > 172.19.0.2.80: Flags [S], cksum 0xef50 (correct), seq 3348226136, win 8192, options [mss 1460,nop,nop,sackOK], length 0
14:18:44.078196 IP (tos 0x20, ttl 121, id 7690, offset 0, flags [DF], proto TCP (6), length 48)
    <client-IP>.65371 > 172.19.0.2.80: Flags [S], cksum 0xef50 (correct), seq 3348226136, win 8192, options [mss 1460,nop,nop,sackOK], length 0
14:18:44.078265 IP (tos 0x0, ttl 64, id 32123, offset 0, flags [none], proto UDP (17), length 98)
    <manager-IP>.57844 > <manager-IP>.4789: VXLAN, flags [I] (0x08), vni 4096
IP (tos 0x20, ttl 121, id 7690, offset 0, flags [DF], proto TCP (6), length 48)
    10.255.0.3.65371 > 10.255.0.5.80: Flags [S], cksum 0xa583 (correct), seq 3348226136, win 8192, options [mss 1460,nop,nop,sackOK], length 0
14:18:44.330562 IP (tos 0x20, ttl 122, id 7691, offset 0, flags [DF], proto TCP (6), length 48)
    <client-IP>.65372 > <manager-IP>.80: Flags [S], cksum 0x3945 (correct), seq 1052211979, win 8192, options [mss 1460,nop,nop,sackOK], length 0
14:18:44.330602 IP (tos 0x20, ttl 121, id 7691, offset 0, flags [DF], proto TCP (6), length 48)
    <client-IP>.65372 > 172.19.0.2.80: Flags [S], cksum 0xdd77 (correct), seq 1052211979, win 8192, options [mss 1460,nop,nop,sackOK], length 0
14:18:44.330607 IP (tos 0x20, ttl 121, id 7691, offset 0, flags [DF], proto TCP (6), length 48)
    <client-IP>.65372 > 172.19.0.2.80: Flags [S], cksum 0xdd77 (correct), seq 1052211979, win 8192, options [mss 1460,nop,nop,sackOK], length 0
14:18:44.330658 IP (tos 0x0, ttl 64, id 32145, offset 0, flags [none], proto UDP (17), length 98)
    <manager-IP>.57296 > <manager-IP>.4789: VXLAN, flags [I] (0x08), vni 4096
IP (tos 0x20, ttl 121, id 7691, offset 0, flags [DF], proto TCP (6), length 48)
    10.255.0.3.65372 > 10.255.0.5.80: Flags [S], cksum 0x93aa (correct), seq 1052211979, win 8192, options [mss 1460,nop,nop,sackOK], length 0
14:18:56.528436 IP (tos 0x20, ttl 122, id 7693, offset 0, flags [DF], proto TCP (6), length 52)
    <client-IP>.65373 > <manager-IP>.80: Flags [S], cksum 0x9d76 (correct), seq 1434708989, win 8192, options [mss 1460,nop,wscale 8,nop,nop,sackOK], length 0
14:18:56.528482 IP (tos 0x20, ttl 121, id 7693, offset 0, flags [DF], proto TCP (6), length 52)
    <client-IP>.65373 > 172.19.0.2.80: Flags [S], cksum 0x41a9 (correct), seq 1434708989, win 8192, options [mss 1460,nop,wscale 8,nop,nop,sackOK], length 0
14:18:56.528487 IP (tos 0x20, ttl 121, id 7693, offset 0, flags [DF], proto TCP (6), length 52)
    <client-IP>.65373 > 172.19.0.2.80: Flags [S], cksum 0x41a9 (correct), seq 1434708989, win 8192, options [mss 1460,nop,wscale 8,nop,nop,sackOK], length 0
14:18:56.528546 IP (tos 0x0, ttl 64, id 33878, offset 0, flags [none], proto UDP (17), length 102)
    <manager-IP>.47764 > <manager-IP>.4789: VXLAN, flags [I] (0x08), vni 4096
IP (tos 0x20, ttl 121, id 7693, offset 0, flags [DF], proto TCP (6), length 52)
    10.255.0.3.65373 > 10.255.0.5.80: Flags [S], cksum 0xf7db (correct), seq 1434708989, win 8192, options [mss 1460,nop,wscale 8,nop,nop,sackOK], length 0
14:18:56.779793 IP (tos 0x20, ttl 122, id 7694, offset 0, flags [DF], proto TCP (6), length 52)
    <client-IP>.65374 > <manager-IP>.80: Flags [S], cksum 0x778b (correct), seq 1299388920, win 8192, options [mss 1460,nop,wscale 8,nop,nop,sackOK], length 0
14:18:56.779840 IP (tos 0x20, ttl 121, id 7694, offset 0, flags [DF], proto TCP (6), length 52)
    <client-IP>.65374 > 172.19.0.2.80: Flags [S], cksum 0x1bbe (correct), seq 1299388920, win 8192, options [mss 1460,nop,wscale 8,nop,nop,sackOK], length 0
14:18:56.779845 IP (tos 0x20, ttl 121, id 7694, offset 0, flags [DF], proto TCP (6), length 52)
    <client-IP>.65374 > 172.19.0.2.80: Flags [S], cksum 0x1bbe (correct), seq 1299388920, win 8192, options [mss 1460,nop,wscale 8,nop,nop,sackOK], length 0
14:18:56.779926 IP (tos 0x0, ttl 64, id 33934, offset 0, flags [none], proto UDP (17), length 102)
    <manager-IP>.34748 > <manager-IP>.4789: VXLAN, flags [I] (0x08), vni 4096
IP (tos 0x20, ttl 121, id 7694, offset 0, flags [DF], proto TCP (6), length 52)
    10.255.0.3.65374 > 10.255.0.5.80: Flags [S], cksum 0xd1f0 (correct), seq 1299388920, win 8192, options [mss 1460,nop,wscale 8,nop,nop,sackOK], length 0
14:18:59.543987 IP (tos 0x20, ttl 122, id 7696, offset 0, flags [DF], proto TCP (6), length 52)
    <client-IP>.65373 > <manager-IP>.80: Flags [S], cksum 0x9d76 (correct), seq 1434708989, win 8192, options [mss 1460,nop,wscale 8,nop,nop,sackOK], length 0
14:18:59.544021 IP (tos 0x20, ttl 121, id 7696, offset 0, flags [DF], proto TCP (6), length 52)
    <client-IP>.65373 > 172.19.0.2.80: Flags [S], cksum 0x41a9 (correct), seq 1434708989, win 8192, options [mss 1460,nop,wscale 8,nop,nop,sackOK], length 0
14:18:59.544025 IP (tos 0x20, ttl 121, id 7696, offset 0, flags [DF], proto TCP (6), length 52)
    <client-IP>.65373 > 172.19.0.2.80: Flags [S], cksum 0x41a9 (correct), seq 1434708989, win 8192, options [mss 1460,nop,wscale 8,nop,nop,sackOK], length 0
14:18:59.544070 IP (tos 0x0, ttl 64, id 34297, offset 0, flags [none], proto UDP (17), length 102)
    <manager-IP>.47764 > <manager-IP>.4789: VXLAN, flags [I] (0x08), vni 4096
IP (tos 0x20, ttl 121, id 7696, offset 0, flags [DF], proto TCP (6), length 52)
    10.255.0.3.65373 > 10.255.0.5.80: Flags [S], cksum 0xf7db (correct), seq 1434708989, win 8192, options [mss 1460,nop,wscale 8,nop,nop,sackOK], length 0
14:18:59.792995 IP (tos 0x20, ttl 122, id 7697, offset 0, flags [DF], proto TCP (6), length 52)
    <client-IP>.65374 > <manager-IP>.80: Flags [S], cksum 0x778b (correct), seq 1299388920, win 8192, options [mss 1460,nop,wscale 8,nop,nop,sackOK], length 0
14:18:59.793034 IP (tos 0x20, ttl 121, id 7697, offset 0, flags [DF], proto TCP (6), length 52)
    <client-IP>.65374 > 172.19.0.2.80: Flags [S], cksum 0x1bbe (correct), seq 1299388920, win 8192, options [mss 1460,nop,wscale 8,nop,nop,sackOK], length 0
14:18:59.793039 IP (tos 0x20, ttl 121, id 7697, offset 0, flags [DF], proto TCP (6), length 52)
    <client-IP>.65374 > 172.19.0.2.80: Flags [S], cksum 0x1bbe (correct), seq 1299388920, win 8192, options [mss 1460,nop,wscale 8,nop,nop,sackOK], length 0
14:18:59.793100 IP (tos 0x0, ttl 64, id 34329, offset 0, flags [none], proto UDP (17), length 102)
    <manager-IP>.34748 > <manager-IP>.4789: VXLAN, flags [I] (0x08), vni 4096
IP (tos 0x20, ttl 121, id 7697, offset 0, flags [DF], proto TCP (6), length 52)
    10.255.0.3.65374 > 10.255.0.5.80: Flags [S], cksum 0xd1f0 (correct), seq 1299388920, win 8192, options [mss 1460,nop,wscale 8,nop,nop,sackOK], length 0
14:19:05.561264 IP (tos 0x20, ttl 122, id 7699, offset 0, flags [DF], proto TCP (6), length 48)
    <client-IP>.65373 > <manager-IP>.80: Flags [S], cksum 0xb185 (correct), seq 1434708989, win 8192, options [mss 1460,nop,nop,sackOK], length 0
14:19:05.561311 IP (tos 0x20, ttl 121, id 7699, offset 0, flags [DF], proto TCP (6), length 48)
    <client-IP>.65373 > 172.19.0.2.80: Flags [S], cksum 0x55b8 (correct), seq 1434708989, win 8192, options [mss 1460,nop,nop,sackOK], length 0
14:19:05.561318 IP (tos 0x20, ttl 121, id 7699, offset 0, flags [DF], proto TCP (6), length 48)
    <client-IP>.65373 > 172.19.0.2.80: Flags [S], cksum 0x55b8 (correct), seq 1434708989, win 8192, options [mss 1460,nop,nop,sackOK], length 0
14:19:05.561391 IP (tos 0x0, ttl 64, id 35051, offset 0, flags [none], proto UDP (17), length 98)
    <manager-IP>.47764 > <manager-IP>.4789: VXLAN, flags [I] (0x08), vni 4096
IP (tos 0x20, ttl 121, id 7699, offset 0, flags [DF], proto TCP (6), length 48)
    10.255.0.3.65373 > 10.255.0.5.80: Flags [S], cksum 0x0beb (correct), seq 1434708989, win 8192, options [mss 1460,nop,nop,sackOK], length 0
14:19:05.793511 IP (tos 0x20, ttl 122, id 7700, offset 0, flags [DF], proto TCP (6), length 48)
    <client-IP>.65374 > <manager-IP>.80: Flags [S], cksum 0x8b9a (correct), seq 1299388920, win 8192, options [mss 1460,nop,nop,sackOK], length 0
14:19:05.793547 IP (tos 0x20, ttl 121, id 7700, offset 0, flags [DF], proto TCP (6), length 48)
    <client-IP>.65374 > 172.19.0.2.80: Flags [S], cksum 0x2fcd (correct), seq 1299388920, win 8192, options [mss 1460,nop,nop,sackOK], length 0
14:19:05.793552 IP (tos 0x20, ttl 121, id 7700, offset 0, flags [DF], proto TCP (6), length 48)
    <client-IP>.65374 > 172.19.0.2.80: Flags [S], cksum 0x2fcd (correct), seq 1299388920, win 8192, options [mss 1460,nop,nop,sackOK], length 0
14:19:05.793602 IP (tos 0x0, ttl 64, id 35083, offset 0, flags [none], proto UDP (17), length 98)
    <manager-IP>.34748 > <manager-IP>.4789: VXLAN, flags [I] (0x08), vni 4096
IP (tos 0x20, ttl 121, id 7700, offset 0, flags [DF], proto TCP (6), length 48)
    10.255.0.3.65374 > 10.255.0.5.80: Flags [S], cksum 0xe5ff (correct), seq 1299388920, win 8192, options [mss 1460,nop,nop,sackOK], length 0
^C
40 packets captured
48 packets received by filter
0 packets dropped by kernel
```

Manager didn't capture anything:

```
tcpdump: listening on any, link-type LINUX_SLL (Linux cooked), capture size 65535 bytes
^C
0 packets captured
0 packets received by filter
0 packets dropped by kernel
```

**Comment by aboch** [comment]
Can you please double check your string substitutions ?

On the Worker reported capture I see:
```
<manager-IP>.57844 > <manager-IP>.4789: VXLAN, flags [I] (0x08), vni 4096
```

**Comment by xylomo** [comment]
Whoops, sorry:

```
tcpdump: listening on any, link-type LINUX_SLL (Linux cooked), capture size 65535 bytes
14:18:38.076279 IP (tos 0x20, ttl 122, id 7687, offset 0, flags [DF], proto TCP (6), length 52)
    <client-IP>.65371 > <worker-IP>.80: Flags [S], cksum 0x370f (correct), seq 3348226136, win 8192, options [mss 1460,nop,wscale 8,nop,nop,sackOK], length 0
14:18:38.076312 IP (tos 0x20, ttl 121, id 7687, offset 0, flags [DF], proto TCP (6), length 52)
    <client-IP>.65371 > 172.19.0.2.80: Flags [S], cksum 0xdb41 (correct), seq 3348226136, win 8192, options [mss 1460,nop,wscale 8,nop,nop,sackOK], length 0
14:18:38.076316 IP (tos 0x20, ttl 121, id 7687, offset 0, flags [DF], proto TCP (6), length 52)
    <client-IP>.65371 > 172.19.0.2.80: Flags [S], cksum 0xdb41 (correct), seq 3348226136, win 8192, options [mss 1460,nop,wscale 8,nop,nop,sackOK], length 0
14:18:38.076362 IP (tos 0x0, ttl 64, id 31241, offset 0, flags [none], proto UDP (17), length 102)
    <worker-IP>.57844 > <manager-IP>.4789: VXLAN, flags [I] (0x08), vni 4096
IP (tos 0x20, ttl 121, id 7687, offset 0, flags [DF], proto TCP (6), length 52)
    10.255.0.3.65371 > 10.255.0.5.80: Flags [S], cksum 0x9174 (correct), seq 3348226136, win 8192, options [mss 1460,nop,wscale 8,nop,nop,sackOK], length 0
14:18:38.329479 IP (tos 0x20, ttl 122, id 7688, offset 0, flags [DF], proto TCP (6), length 52)
    <client-IP>.65372 > <worker-IP>.80: Flags [S], cksum 0x2536 (correct), seq 1052211979, win 8192, options [mss 1460,nop,wscale 8,nop,nop,sackOK], length 0
14:18:38.329518 IP (tos 0x20, ttl 121, id 7688, offset 0, flags [DF], proto TCP (6), length 52)
    <client-IP>.65372 > 172.19.0.2.80: Flags [S], cksum 0xc968 (correct), seq 1052211979, win 8192, options [mss 1460,nop,wscale 8,nop,nop,sackOK], length 0
14:18:38.329523 IP (tos 0x20, ttl 121, id 7688, offset 0, flags [DF], proto TCP (6), length 52)
    <client-IP>.65372 > 172.19.0.2.80: Flags [S], cksum 0xc968 (correct), seq 1052211979, win 8192, options [mss 1460,nop,wscale 8,nop,nop,sackOK], length 0
14:18:38.329573 IP (tos 0x0, ttl 64, id 31292, offset 0, flags [none], proto UDP (17), length 102)
    <worker-IP>.57296 > <manager-IP>.4789: VXLAN, flags [I] (0x08), vni 4096
IP (tos 0x20, ttl 121, id 7688, offset 0, flags [DF], proto TCP (6), length 52)
    10.255.0.3.65372 > 10.255.0.5.80: Flags [S], cksum 0x7f9b (correct), seq 1052211979, win 8192, options [mss 1460,nop,wscale 8,nop,nop,sackOK], length 0
14:18:44.078142 IP (tos 0x20, ttl 122, id 7690, offset 0, flags [DF], proto TCP (6), length 48)
    <client-IP>.65371 > <worker-IP>.80: Flags [S], cksum 0x4b1e (correct), seq 3348226136, win 8192, options [mss 1460,nop,nop,sackOK], length 0
14:18:44.078189 IP (tos 0x20, ttl 121, id 7690, offset 0, flags [DF], proto TCP (6), length 48)
    <client-IP>.65371 > 172.19.0.2.80: Flags [S], cksum 0xef50 (correct), seq 3348226136, win 8192, options [mss 1460,nop,nop,sackOK], length 0
14:18:44.078196 IP (tos 0x20, ttl 121, id 7690, offset 0, flags [DF], proto TCP (6), length 48)
    <client-IP>.65371 > 172.19.0.2.80: Flags [S], cksum 0xef50 (correct), seq 3348226136, win 8192, options [mss 1460,nop,nop,sackOK], length 0
14:18:44.078265 IP (tos 0x0, ttl 64, id 32123, offset 0, flags [none], proto UDP (17), length 98)
    <worker-IP>.57844 > <manager-IP>.4789: VXLAN, flags [I] (0x08), vni 4096
IP (tos 0x20, ttl 121, id 7690, offset 0, flags [DF], proto TCP (6), length 48)
    10.255.0.3.65371 > 10.255.0.5.80: Flags [S], cksum 0xa583 (correct), seq 3348226136, win 8192, options [mss 1460,nop,nop,sackOK], length 0
14:18:44.330562 IP (tos 0x20, ttl 122, id 7691, offset 0, flags [DF], proto TCP (6), length 48)
    <client-IP>.65372 > <worker-IP>.80: Flags [S], cksum 0x3945 (correct), seq 1052211979, win 8192, options [mss 1460,nop,nop,sackOK], length 0
14:18:44.330602 IP (tos 0x20, ttl 121, id 7691, offset 0, flags [DF], proto TCP (6), length 48)
    <client-IP>.65372 > 172.19.0.2.80: Flags [S], cksum 0xdd77 (correct), seq 1052211979, win 8192, options [mss 1460,nop,nop,sackOK], length 0
14:18:44.330607 IP (tos 0x20, ttl 121, id 7691, offset 0, flags [DF], proto TCP (6), length 48)
    <client-IP>.65372 > 172.19.0.2.80: Flags [S], cksum 0xdd77 (correct), seq 1052211979, win 8192, options [mss 1460,nop,nop,sackOK], length 0
14:18:44.330658 IP (tos 0x0, ttl 64, id 32145, offset 0, flags [none], proto UDP (17), length 98)
    <worker-IP>.57296 > <manager-IP>.4789: VXLAN, flags [I] (0x08), vni 4096
IP (tos 0x20, ttl 121, id 7691, offset 0, flags [DF], proto TCP (6), length 48)
    10.255.0.3.65372 > 10.255.0.5.80: Flags [S], cksum 0x93aa (correct), seq 1052211979, win 8192, options [mss 1460,nop,nop,sackOK], length 0
14:18:56.528436 IP (tos 0x20, ttl 122, id 7693, offset 0, flags [DF], proto TCP (6), length 52)
    <client-IP>.65373 > <worker-IP>.80: Flags [S], cksum 0x9d76 (correct), seq 1434708989, win 8192, options [mss 1460,nop,wscale 8,nop,nop,sackOK], length 0
14:18:56.528482 IP (tos 0x20, ttl 121, id 7693, offset 0, flags [DF], proto TCP (6), length 52)
    <client-IP>.65373 > 172.19.0.2.80: Flags [S], cksum 0x41a9 (correct), seq 1434708989, win 8192, options [mss 1460,nop,wscale 8,nop,nop,sackOK], length 0
14:18:56.528487 IP (tos 0x20, ttl 121, id 7693, offset 0, flags [DF], proto TCP (6), length 52)
    <client-IP>.65373 > 172.19.0.2.80: Flags [S], cksum 0x41a9 (correct), seq 1434708989, win 8192, options [mss 1460,nop,wscale 8,nop,nop,sackOK], length 0
14:18:56.528546 IP (tos 0x0, ttl 64, id 33878, offset 0, flags [none], proto UDP (17), length 102)
    <worker-IP>.47764 > <manager-IP>.4789: VXLAN, flags [I] (0x08), vni 4096
IP (tos 0x20, ttl 121, id 7693, offset 0, flags [DF], proto TCP (6), length 52)
    10.255.0.3.65373 > 10.255.0.5.80: Flags [S], cksum 0xf7db (correct), seq 1434708989, win 8192, options [mss 1460,nop,wscale 8,nop,nop,sackOK], length 0
14:18:56.779793 IP (tos 0x20, ttl 122, id 7694, offset 0, flags [DF], proto TCP (6), length 52)
    <client-IP>.65374 > <worker-IP>.80: Flags [S], cksum 0x778b (correct), seq 1299388920, win 8192, options [mss 1460,nop,wscale 8,nop,nop,sackOK], length 0
14:18:56.779840 IP (tos 0x20, ttl 121, id 7694, offset 0, flags [DF], proto TCP (6), length 52)
    <client-IP>.65374 > 172.19.0.2.80: Flags [S], cksum 0x1bbe (correct), seq 1299388920, win 8192, options [mss 1460,nop,wscale 8,nop,nop,sackOK], length 0
14:18:56.779845 IP (tos 0x20, ttl 121, id 7694, offset 0, flags [DF], proto TCP (6), length 52)
    <client-IP>.65374 > 172.19.0.2.80: Flags [S], cksum 0x1bbe (correct), seq 1299388920, win 8192, options [mss 1460,nop,wscale 8,nop,nop,sackOK], length 0
14:18:56.779926 IP (tos 0x0, ttl 64, id 33934, offset 0, flags [none], proto UDP (17), length 102)
    <worker-IP>.34748 > <manager-IP>.4789: VXLAN, flags [I] (0x08), vni 4096
IP (tos 0x20, ttl 121, id 7694, offset 0, flags [DF], proto TCP (6), length 52)
    10.255.0.3.65374 > 10.255.0.5.80: Flags [S], cksum 0xd1f0 (correct), seq 1299388920, win 8192, options [mss 1460,nop,wscale 8,nop,nop,sackOK], length 0
14:18:59.543987 IP (tos 0x20, ttl 122, id 7696, offset 0, flags [DF], proto TCP (6), length 52)
    <client-IP>.65373 > <worker-IP>.80: Flags [S], cksum 0x9d76 (correct), seq 1434708989, win 8192, options [mss 1460,nop,wscale 8,nop,nop,sackOK], length 0
14:18:59.544021 IP (tos 0x20, ttl 121, id 7696, offset 0, flags [DF], proto TCP (6), length 52)
    <client-IP>.65373 > 172.19.0.2.80: Flags [S], cksum 0x41a9 (correct), seq 1434708989, win 8192, options [mss 1460,nop,wscale 8,nop,nop,sackOK], length 0
14:18:59.544025 IP (tos 0x20, ttl 121, id 7696, offset 0, flags [DF], proto TCP (6), length 52)
    <client-IP>.65373 > 172.19.0.2.80: Flags [S], cksum 0x41a9 (correct), seq 1434708989, win 8192, options [mss 1460,nop,wscale 8,nop,nop,sackOK], length 0
14:18:59.544070 IP (tos 0x0, ttl 64, id 34297, offset 0, flags [none], proto UDP (17), length 102)
    <worker-IP>.47764 > <manager-IP>.4789: VXLAN, flags [I] (0x08), vni 4096
IP (tos 0x20, ttl 121, id 7696, offset 0, flags [DF], proto TCP (6), length 52)
    10.255.0.3.65373 > 10.255.0.5.80: Flags [S], cksum 0xf7db (correct), seq 1434708989, win 8192, options [mss 1460,nop,wscale 8,nop,nop,sackOK], length 0
14:18:59.792995 IP (tos 0x20, ttl 122, id 7697, offset 0, flags [DF], proto TCP (6), length 52)
    <client-IP>.65374 > <worker-IP>.80: Flags [S], cksum 0x778b (correct), seq 1299388920, win 8192, options [mss 1460,nop,wscale 8,nop,nop,sackOK], length 0
14:18:59.793034 IP (tos 0x20, ttl 121, id 7697, offset 0, flags [DF], proto TCP (6), length 52)
    <client-IP>.65374 > 172.19.0.2.80: Flags [S], cksum 0x1bbe (correct), seq 1299388920, win 8192, options [mss 1460,nop,wscale 8,nop,nop,sackOK], length 0
14:18:59.793039 IP (tos 0x20, ttl 121, id 7697, offset 0, flags [DF], proto TCP (6), length 52)
    <client-IP>.65374 > 172.19.0.2.80: Flags [S], cksum 0x1bbe (correct), seq 1299388920, win 8192, options [mss 1460,nop,wscale 8,nop,nop,sackOK], length 0
14:18:59.793100 IP (tos 0x0, ttl 64, id 34329, offset 0, flags [none], proto UDP (17), length 102)
    <worker-IP>.34748 > <manager-IP>.4789: VXLAN, flags [I] (0x08), vni 4096
IP (tos 0x20, ttl 121, id 7697, offset 0, flags [DF], proto TCP (6), length 52)
    10.255.0.3.65374 > 10.255.0.5.80: Flags [S], cksum 0xd1f0 (correct), seq 1299388920, win 8192, options [mss 1460,nop,wscale 8,nop,nop,sackOK], length 0
14:19:05.561264 IP (tos 0x20, ttl 122, id 7699, offset 0, flags [DF], proto TCP (6), length 48)
    <client-IP>.65373 > <worker-IP>.80: Flags [S], cksum 0xb185 (correct), seq 1434708989, win 8192, options [mss 1460,nop,nop,sackOK], length 0
14:19:05.561311 IP (tos 0x20, ttl 121, id 7699, offset 0, flags [DF], proto TCP (6), length 48)
    <client-IP>.65373 > 172.19.0.2.80: Flags [S], cksum 0x55b8 (correct), seq 1434708989, win 8192, options [mss 1460,nop,nop,sackOK], length 0
14:19:05.561318 IP (tos 0x20, ttl 121, id 7699, offset 0, flags [DF], proto TCP (6), length 48)
    <client-IP>.65373 > 172.19.0.2.80: Flags [S], cksum 0x55b8 (correct), seq 1434708989, win 8192, options [mss 1460,nop,nop,sackOK], length 0
14:19:05.561391 IP (tos 0x0, ttl 64, id 35051, offset 0, flags [none], proto UDP (17), length 98)
    <worker-IP>.47764 > <manager-IP>.4789: VXLAN, flags [I] (0x08), vni 4096
IP (tos 0x20, ttl 121, id 7699, offset 0, flags [DF], proto TCP (6), length 48)
    10.255.0.3.65373 > 10.255.0.5.80: Flags [S], cksum 0x0beb (correct), seq 1434708989, win 8192, options [mss 1460,nop,nop,sackOK], length 0
14:19:05.793511 IP (tos 0x20, ttl 122, id 7700, offset 0, flags [DF], proto TCP (6), length 48)
    <client-IP>.65374 > <worker-IP>.80: Flags [S], cksum 0x8b9a (correct), seq 1299388920, win 8192, options [mss 1460,nop,nop,sackOK], length 0
14:19:05.793547 IP (tos 0x20, ttl 121, id 7700, offset 0, flags [DF], proto TCP (6), length 48)
    <client-IP>.65374 > 172.19.0.2.80: Flags [S], cksum 0x2fcd (correct), seq 1299388920, win 8192, options [mss 1460,nop,nop,sackOK], length 0
14:19:05.793552 IP (tos 0x20, ttl 121, id 7700, offset 0, flags [DF], proto TCP (6), length 48)
    <client-IP>.65374 > 172.19.0.2.80: Flags [S], cksum 0x2fcd (correct), seq 1299388920, win 8192, options [mss 1460,nop,nop,sackOK], length 0
14:19:05.793602 IP (tos 0x0, ttl 64, id 35083, offset 0, flags [none], proto UDP (17), length 98)
    <worker-IP>.34748 > <manager-IP>.4789: VXLAN, flags [I] (0x08), vni 4096
IP (tos 0x20, ttl 121, id 7700, offset 0, flags [DF], proto TCP (6), length 48)
    10.255.0.3.65374 > 10.255.0.5.80: Flags [S], cksum 0xe5ff (correct), seq 1299388920, win 8192, options [mss 1460,nop,nop,sackOK], length 0
^C
40 packets captured
48 packets received by filter
0 packets dropped by kernel

```

**Comment by aboch** [comment]
Ok, can you confirm `10.255.0.5` is IP address of the only service task, running on the manager ?

**Comment by xylomo** [comment]
Correct:
```
# docker ps
CONTAINER ID        IMAGE                                                                                             COMMAND                  CREATED             STATUS              PORTS               NAMES
559bd134f7cf        dockercloud/hello-world@sha256:629d6815beea1ec5172ce4b56ffa0e2c3fbe288a2e5abda3076aed08ee154e72   "/bin/sh -c 'php-f..."   39 minutes ago      Up 39 minutes       80/tcp              hello.1.7bmfr05wcbymisnygwf99tkhz

# docker inspect 55
...
           "Networks": {
                "hello": {
                    "IPAMConfig": {
                        "IPv4Address": "10.0.0.3"
                    },
                    "Links": null,
                    "Aliases": [
                        "559bd134f7cf"
                    ],
                    "NetworkID": "5y80givk6kjpirdpn40bgfgzg",
                    "EndpointID": "94350346508b7a470c855467d1a4f298282599e613ffaabe8c08daf4fa12b5d1",
                    "Gateway": "",
                    "IPAddress": "10.0.0.3",
                    "IPPrefixLen": 24,
                    "IPv6Gateway": "",
                    "GlobalIPv6Address": "",
                    "GlobalIPv6PrefixLen": 0,
                    "MacAddress": "02:42:0a:00:00:03"
                },
                "ingress": {
                    "IPAMConfig": {
                        "IPv4Address": "10.255.0.5"
                    },
                    "Links": null,
                    "Aliases": [
                        "559bd134f7cf"
                    ],
                    "NetworkID": "omgayyn9454kewjjc2twxs0aq",
                    "EndpointID": "2c7b9a89bb049bf821d81d421e90e07f32f38dac886e37b21eb9d5f5036528b3",
                    "Gateway": "",
                    "IPAddress": "10.255.0.5",
                    "IPPrefixLen": 16,
                    "IPv6Gateway": "",
                    "GlobalIPv6Address": "",
                    "GlobalIPv6PrefixLen": 0,
                    "MacAddress": "02:42:0a:ff:00:05"
                }
            }
...
```

**Comment by aboch** [comment]
hmm, I am surprised the vxlan packet leaving worker toward manager is not being captured in the manager.
Can you double check that is true ?

**Comment by xylomo** [comment]
Correct, just did another capture on the manager, and there was nothing in the log. It's weird.. as soon as I scale it to where both nodes have running containers, traffic is able to be served. 

But, I think that's just because instead of redirecting traffic to other nodes... the Docker swarm knows that its running containers on that node that needs to handle traffic, correct?

**Comment by aboch** [comment]
> But, I think that's just because instead of redirecting traffic to other nodes... the Docker swarm knows that its running containers on that node that needs to handle traffic, correct?

Not really. Even with a replica on each node, when you create a service publishing ports in vip mode (the default, what you are doing), the requests toward a docker node:\<published port\> will always be load balanced across all the service's tasks, regardless of where they are running.

From your capture, things are working, at least initially, as they should:
- the request toward worker:80 is being redirected toward the ingress sandbox (`172.19.0.2.80`) and from there (`10.255.0.3`) load balanced toward one of the service's tasks (10.255.0.5) on the routing mesh (`ingress` network)

The sync, encapsulated in the vlxan packet directed to the manager, is being redirected from worker node:

```
14:18:38.076362 IP (tos 0x0, ttl 64, id 31241, offset 0, flags [none], proto UDP (17), length 102)
    <worker-IP>.57844 > <manager-IP>.4789: VXLAN, flags [I] (0x08), vni 4096
IP (tos 0x20, ttl 121, id 7687, offset 0, flags [DF], proto TCP (6), length 52)
    10.255.0.3.65371 > 10.255.0.5.80: Flags [S], cksum 0x9174 (correct), seq 3348226136, win 8192, options [mss 1460,nop,wscale 8,nop,nop,sackOK], length 0
```

Try to find where that packet gets dropped.

**Comment by xylomo** [comment]
It's interesting that you had made that comment. These VMs are located are in different zones. I'm going to test having them in the same zone and then see if that would fix dropping the VXLAN packets.

**Comment by xylomo** [comment]
After creating VMs in the same zone, that seemed to do the trick and it works now. 

So qq, during testing I noticed that the overlay network that is associated with the service created with the swarm was on all the nodes when I initially created a scale of 5, but then when I changed it to 1, the network no longer appeared on the nodes that didn't have containers running on them. 

Is all of the traffic supposed to be flowing through the `ingress` network if there are no running containers? Or is the `hello` network I created on the swarm supposed to be on the worker?

**Comment by aboch** [comment]
Gad to hear it works now.

> the network no longer appeared on the nodes that didn't have containers running on them.

That is by designed. Swarm networks are dynamically created where the tasks are deployed.
And removed when the last task on that node is shutdown.

`ingress` network (the one providing the routing-mesh) dispatches all the traffic incoming to the docker host on the services' published ports.

A user created network, like your `hello`, is for east-west traffic between tasks, possibly belonging to different services, present on that network.

**Comment by jeromepin** [comment]
I think the version 17.06 still has this issue.

**Comment by lipingxue** [comment]
It seems that I hit the same issue in #35249, any update on this issue?

**Comment by whisper-bye** [comment]
+1
when I scale my-nginx=1, the routing mesh is not working at all, but scale my-nginx at least 2 instances, it works great.
centos 7
docker 17.12.0-ce
swarm cluster with 3 nodes

**Comment by DarthRevan00** [comment]
any update ? I have Docker version 18.03.0-ce, build 0520e24, and the issue still happens

**Comment by xavs** [comment]
I have the same issue even being in the same zone.
The manager is not getting the packets
```
IP 172.31.12.181.35963 > 172.31.0.170.4789: VXLAN, flags [I] (0x08), vni 4097
IP 10.0.0.2.52844 > 10.0.0.5.8080: Flags [S], seq 3828308530, win 28200, options [mss 1410,sackOK,TS val 713390616 ecr 0,nop,wscale 7], length 0```
Any ideas on how to track where the packets are being lost?
