### ISSUE TITLE
docker.io dns lookups on every invocation of docker

### ISSUE THREAD

**Issue by dustymabe** [docker/docker#14223]
Recently I was setting up docker in a completely *disconnected* environment and I noticed docker commands were running very slowly. Turns out every time you run docker it hits docker.io. I know we need to contact docker.io sometimes but it should really only happen when necessary and not when doing things like docker --help. 

Is anyone aware of this issue? 

```
[root@localhost ~]# tcpdump -n port 53 &
[1] 1056
[root@localhost ~]# tcpdump: verbose output suppressed, use -v or -vv for full protocol decode
listening on eth0, link-type EN10MB (Ethernet), capture size 262144 bytes

[root@localhost ~]# docker --version
04:22:17.423902 IP 192.168.122.131.60579 > 192.168.122.1.domain: 51848+ A? docker.io. (27)
04:22:17.424795 IP 192.168.122.131.60579 > 192.168.122.1.domain: 12077+ AAAA? docker.io. (27)
04:22:17.425219 IP 192.168.122.1.domain > 192.168.122.131.60579: 12077 0/0/0 (27)
04:22:17.516149 IP 192.168.122.1.domain > 192.168.122.131.60579: 51848 1/0/0 A 162.242.195.84 (43)
Docker version 1.6.0, build 9d26a07/1.6.0
```

**Comment by Evalle** [comment]
Hi, it's not working for me.
Docker version 1.7.0, build 0baf609,

**Comment by ankushagarwal** [comment]
@dustymabe, can you provide more information, following @GordonTheTurtle's instructions?

**Comment by dustymabe** [comment]
@ankushagarwal There is more info below. I am running this on a virtual machine (libvirt/kvm). I would not expect the docker to connect to docker.io anytime it doesn't need to.

```
[root@localhost ~]# docker version
Client version: 1.6.0
Client API version: 1.18
Go version (client): go1.4.2
Git commit (client): 9d26a07/1.6.0
OS/Arch (client): linux/amd64
Server version: 1.6.0
Server API version: 1.18
Go version (server): go1.4.2
Git commit (server): 9d26a07/1.6.0
OS/Arch (server): linux/amd64
```

```
[root@localhost ~]# docker info
Containers: 0
Images: 0
Storage Driver: devicemapper
 Pool Name: docker-8:1-11364-pool
 Pool Blocksize: 65.54 kB
 Backing Filesystem: extfs
 Data file: /dev/loop0
 Metadata file: /dev/loop1
 Data Space Used: 305.7 MB
 Data Space Total: 107.4 GB
 Data Space Available: 2.112 GB
 Metadata Space Used: 729.1 kB
 Metadata Space Total: 2.147 GB
 Metadata Space Available: 2.112 GB
 Udev Sync Supported: true
 Data loop file: /var/lib/docker/devicemapper/devicemapper/data
 Metadata loop file: /var/lib/docker/devicemapper/devicemapper/metadata
 Library Version: 1.02.93 (2015-01-30)
Execution Driver: native-0.2
Kernel Version: 4.0.4-301.fc22.x86_64
Operating System: Fedora 22 (Twenty Two)
CPUs: 2
Total Memory: 1.954 GiB
Name: localhost.localdomain.localdomain
ID: BWKS:A67W:R7Q6:O6OL:B7UX:UG5Y:PDRG:4NB3:IW7J:GOXO:MBXR:PQFE
```

```
[root@localhost ~]# uname -a
Linux localhost.localdomain.localdomain 4.0.4-301.fc22.x86_64 #1 SMP Thu May 21 13:10:33 UTC 2015 x86_64 x86_64 x86_64 GNU/Linux
```

**Comment by dustymabe** [comment]
@Evalle You seem to be right. Upgrading from docker-1.6.0-3.git9d26a07.fc22.x86_64 to docker-1.7.0-4.git5b82e1d.fc22.x86_64 seems to resolve the issue. Would be nice to trace down exactly what commit *fixed* this for future reference. 



docker-1.6.0-3.git9d26a07.fc22.x86_64

**Comment by cpuguy83** [comment]
Closing since this is resolved.
Also yes, quite weird.
