### ISSUE TITLE
UDP traffic forwarded to wrong container, sometimes to multiple containers

### ISSUE THREAD

**Issue by karalabe** [docker/docker#32001]
**Description**

I've noticed a strange network traffic routing problem between containers running on the same machine, where UDP traffic bound to one container ends up in the other. This only happens if the source UDP port is the same as the destination (bound to another container).

**Steps to reproduce the issue:**

0. Set up a machine with a NATed IP address with port 10101 forwarded from the external IP address to the internal IP address. This is a scenario you'll find in most home networks as well as cloud VM providers.

1. Create the following Dockerfile, which simply dumps UDP traffic arriving on port 10101.

```
FROM alpine:latest
RUN apk add --update tcpdump
EXPOSE 10101
CMD ["tcpdump", "-i", "eth0", "udp", "dst", "port", "10101"]
```

```
$ docker build --tag udptest .
```

2. Run two instances of the above image in two terminals, simply echoing UDP traffic, one bound to port 10101 on the host, whereas the second to port 10102 on the host.

```
$ docker run --name=HostA -it -p 10101:10101/udp udptest
$ docker run --name=HostB -it -p 10102:10101/udp udptest
```

3. You can verify that sending UDP packages to either of the listening addresses works as intended:

```
$ echo Ping | nc -u -w1 127.0.0.1 10101
HostA: 11:04:01.117166 IP 172.17.0.1.48744 > 30221cb4ba12.10101: UDP, length 5

$ echo Ping | nc -u -w1 127.0.0.1 10102
HostB: 11:04:07.278662 IP 172.17.0.1.47369 > 0f72cb6bc058.10101: UDP, length 5
```

4. Now open up a shell to your second container (HostB), which is bound on port 10102, and send from inside it a UDP traffic **to your external public IP address** to port 10101. It will work as intended:

```
$ docker exec -it HostB /bin/sh
$ echo Ping | nc -u -w1 your-external-ip 10101
HostB: 11:23:54.062903 IP 0f72cb6bc058.44244 > 52.169.42.101.10101: UDP, length 5
HostA: 11:14:06.155845 IP 172.17.0.1.47662 > 30221cb4ba12.10101: UDP, length 5
```

5. Repeat the same thing, but also specify the source port of the UDP traffic to 10101:

```
$ docker exec -it HostB /bin/sh
$ echo Ping | nc -u -w1 -p10101 your-external-ip 10101
HostB: 11:25:21.845300 IP 0f72cb6bc058.10101 > 52.169.42.101.10101: UDP, length 5
       11:25:21.845960 IP 52.169.42.101.10101 > 0f72cb6bc058.10101: UDP, length 5
HostA: <empty>
```

**Describe the results you received:**

The UDP package from HostB was looped back into HostB, even though it actually exited the network and should have popped back into HostA via the set up port bindings.

**Additional information you deem important (e.g. issue happens only occasionally):**

I managed to reproduce the above on multiple machines/VMs all the time. Something that only occasionally hit is if instead of the machine's external public IP, I specified the machines actual network address. The **the first UDP packet was delivered to both containers**, with subsequent ones only to the correct HostA.

**Output of `docker version`:**

```
Client:
 Version:      17.03.0-ce
 API version:  1.26
 Go version:   go1.7.5
 Git commit:   3a232c8
 Built:        Tue Feb 28 08:01:32 2017
 OS/Arch:      linux/amd64

Server:
 Version:      17.03.0-ce
 API version:  1.26 (minimum version 1.12)
 Go version:   go1.7.5
 Git commit:   3a232c8
 Built:        Tue Feb 28 08:01:32 2017
 OS/Arch:      linux/amd64
 Experimental: false
```

**Output of `docker info`:**

```
Containers: 4
 Running: 4
 Paused: 0
 Stopped: 0
Images: 18
Server Version: 17.03.0-ce
Storage Driver: aufs
 Root Dir: /var/lib/docker/aufs
 Backing Filesystem: extfs
 Dirs: 23
 Dirperm1 Supported: true
Logging Driver: json-file
Cgroup Driver: cgroupfs
Plugins: 
 Volume: local
 Network: bridge host macvlan null overlay
Swarm: inactive
Runtimes: runc
Default Runtime: runc
Init Binary: docker-init
containerd version: 977c511eda0925a723debdc94d09459af49d082a
runc version: a01dafd48bc1c7cc12bdb01206f9fea7dd6feb70
init version: 949e6fa
Security Options:
 apparmor
 seccomp
  Profile: default
Kernel Version: 4.4.0-66-generic
Operating System: Ubuntu 16.04.2 LTS
OSType: linux
Architecture: x86_64
CPUs: 2
Total Memory: 3.359 GiB
Name: bootnode
ID: 3CSM:DFB2:LQOE:MWT2:3EY5:GERK:7MUJ:BLY2:V7M2:RMHT:XMGC:6O7E
Docker Root Dir: /var/lib/docker
Debug Mode (client): false
Debug Mode (server): false
Registry: https://index.docker.io/v1/
WARNING: No swap limit support
Experimental: false
Insecure Registries:
 127.0.0.0/8
Live Restore Enabled: false

```

**Additional environment details (AWS, VirtualBox, physical, etc.):**

This appeared while running on an Azure VM, but I reproduced it locally on bare metal hardware too.

**Comment by thaJeztah** [comment]
ping @aboch ptal

**Comment by acehege** [comment]
I am seeing the same issue, but only on Kernel Version: 4.4.0-66-generic

4.2.0-35-generic does have the same issue ( Or rather, I cannot reproduce it )

**Comment by Legogris** [comment]
I think I'm seeing an instance of the same issue but even weirder, bear with me:

* dockerized traefik is running on physical host A, which is acting as ingress and egress gateway
* UDP P2P service us running on physical host B.
* I don't see the throughput and number of connections and throughput I would expect - but it's not abysmal, either. 

On host A, when enabling logging of martian packets, I get loads of these:
```
IPv4: martian source [external_ip] from [container_ip_on_host_b], on dev [host_a_internal_interface]
ll header: ...
```

Running with default bridge networking settings, routing works fine otherwise. Packets seem to be taking a weird route.
