### ISSUE TITLE
Some TCP SYN looks like missing in the load balancer(docker ingress) 

### ISSUE THREAD

**Issue by lnkisi** [docker/docker#31841]
## Description

I built a web server(Tomcat) in docker cluster. With growing of the concurrent requests, I found more and more requests(from Nginx outside of docker to Tomcat inside of docker) be responded with latency of 1 second. I tried to capture the network package and then found the latency is in the tcp handshake phase. It looks like Ingress-sbox missed some SYN package and then TCP retried after 1 second.
## Some check in network layer
I tried to test the network latency between Nginx and Docker cluster with icmp ping. The network latency from every Nginx instance to Docker cluster was very same and both less than 1 ms.
Then I counted the abnormal requests by every Nginx instance(6 instances with same weighted requests, different ip addr but in same available zone and subnet). I found the number of counts in 4 of the 6 instance was same in every single minutes, and I counted nothing abnormal in the other 2 instance at the same time.
I think the Tomcat server should not respond difference with different client in TCP layer.
### Addr in the Record

> Nginx Addr: 172.29.2.150
> Docker Server Addr: 172.29.4.44
> Ingress-sbox Addr: 172.18.0.2

### Captured Record
```
04:21:56.510013 IP 172.29.2.150.40034 > 172.29.4.44.11000: Flags [S], seq 2577681879, win 26883, options [mss 8961,nop,nop,sackOK,nop,wscale 7], length 0
04:21:56.510045 IP 172.29.2.150.40034 > 172.18.0.2.11000: Flags [S], seq 2577681879, win 26883, options [mss 8961,nop,nop,sackOK,nop,wscale 7], length 0
04:21:56.510048 IP 172.29.2.150.40034 > 172.18.0.2.11000: Flags [S], seq 2577681879, win 26883, options [mss 8961,nop,nop,sackOK,nop,wscale 7], length 0
04:21:57.509934 IP 172.29.2.150.40034 > 172.29.4.44.11000: Flags [S], seq 2577681879, win 26883, options [mss 8961,nop,nop,sackOK,nop,wscale 7], length 0
04:21:57.509951 IP 172.29.2.150.40034 > 172.18.0.2.11000: Flags [S], seq 2577681879, win 26883, options [mss 8961,nop,nop,sackOK,nop,wscale 7], length 0
04:21:57.509954 IP 172.29.2.150.40034 > 172.18.0.2.11000: Flags [S], seq 2577681879, win 26883, options [mss 8961,nop,nop,sackOK,nop,wscale 7], length 0
04:21:57.510277 IP 172.18.0.2.11000 > 172.29.2.150.40034: Flags [S.], seq 4014462770, ack 2577681880, win 28200, options [mss 1410,nop,nop,sackOK,nop,wscale 7], length 0
04:21:57.510281 IP 172.18.0.2.11000 > 172.29.2.150.40034: Flags [S.], seq 4014462770, ack 2577681880, win 28200, options [mss 1410,nop,nop,sackOK,nop,wscale 7], length 0
04:21:57.510284 IP 172.29.4.44.11000 > 172.29.2.150.40034: Flags [S.], seq 4014462770, ack 2577681880, win 28200, options [mss 1410,nop,nop,sackOK,nop,wscale 7], length 0
04:21:57.510644 IP 172.29.2.150.40034 > 172.29.4.44.11000: Flags [.], ack 1, win 211, length 0
04:21:57.510652 IP 172.29.2.150.40034 > 172.18.0.2.11000: Flags [.], ack 1, win 211, length 0
04:21:57.510653 IP 172.29.2.150.40034 > 172.18.0.2.11000: Flags [.], ack 1, win 211, length 0
04:21:57.512882 IP 172.29.2.150.40034 > 172.29.4.44.11000: Flags [F.], seq 1, ack 1, win 211, length 0
04:21:57.512889 IP 172.29.2.150.40034 > 172.18.0.2.11000: Flags [F.], seq 1, ack 1, win 211, length 0
04:21:57.512891 IP 172.29.2.150.40034 > 172.18.0.2.11000: Flags [F.], seq 1, ack 1, win 211, length 0
04:21:57.513206 IP 172.18.0.2.11000 > 172.29.2.150.40034: Flags [F.], seq 1, ack 2, win 221, length 0
04:21:57.513215 IP 172.18.0.2.11000 > 172.29.2.150.40034: Flags [F.], seq 1, ack 2, win 221, length 0
04:21:57.513220 IP 172.29.4.44.11000 > 172.29.2.150.40034: Flags [F.], seq 1, ack 2, win 221, length 0
04:21:57.513617 IP 172.29.2.150.40034 > 172.29.4.44.11000: Flags [.], ack 2, win 211, length 0
04:21:57.513632 IP 172.29.2.150.40034 > 172.18.0.2.11000: Flags [.], ack 2, win 211, length 0
04:21:57.513635 IP 172.29.2.150.40034 > 172.18.0.2.11000: Flags [.], ack 2, win 211, length 0
```
### Docker version
```
Client:
 Version:      1.13.1
 API version:  1.24 (downgraded from 1.26)
 Go version:   go1.7.5
 Git commit:   092cba3
 Built:        Wed Feb  8 08:47:51 2017
 OS/Arch:      linux/amd64

Server:
 Version:      1.12.5
 API version:  1.24 (minimum version )
 Go version:   go1.6.4
 Git commit:   7392c3b
 Built:        Fri Dec 16 02:42:17 2016
 OS/Arch:      linux/amd64
 Experimental: false
```
### Docker info
```
Containers: 18
 Running: 4
 Paused: 0
 Stopped: 14
Images: 33
Server Version: 1.12.5
Storage Driver: aufs
 Root Dir: /var/lib/docker/aufs
 Backing Filesystem: extfs
 Dirs: 204
 Dirperm1 Supported: true
Logging Driver: json-file
Cgroup Driver: cgroupfs
Plugins:
 Volume: local
 Network: overlay null bridge host
Swarm: active
 NodeID: xxxx
 Is Manager: true
 ClusterID: xxxx
 Managers: 1
 Nodes: 5
 Orchestration:
  Task History Retention Limit: 5
 Raft:
  Snapshot Interval: 10000
  Heartbeat Tick: 1
  Election Tick: 3
 Dispatcher:
  Heartbeat Period: 5 seconds
 CA Configuration:
  Expiry Duration: 3 months
 Node Address: 172.29.4.44
 Manager Addresses:
  172.29.4.44:2377
Runtimes: runc
Default Runtime: runc
Init Binary:
containerd version:
runc version:
init version:
Security Options:
 apparmor
 seccomp
Kernel Version: 4.4.0-43-generic
Operating System: Ubuntu 16.04.1 LTS
OSType: linux
Architecture: x86_64
CPUs: 2
Total Memory: 7.795 GiB
Name: docker-xx-node1
ID: xxxx
Docker Root Dir: /var/lib/docker
Debug Mode (client): false
Debug Mode (server): false
Registry: https://index.docker.io/v1/
WARNING: No swap limit support
Labels:
 provider=amazonec2
Experimental: false
Insecure Registries:
 127.0.0.0/8
Live Restore Enabled: false
```
