### ISSUE TITLE
TFTP client not working from inside bridged container

### ISSUE THREAD

**Issue by bsquizzato** [docker/docker#22837]
Running an ubuntu container on an ubuntu 14.04 host. Docker version 1.11.1.

A TFTP client download works from the host. It does not work from within a container running on this host. The container is using bridge networking with NAT/masquerading.

Using basic iptables rules which permits everything, and ufw is disabled. 

When the container tries a tftp get, I can see the UDP traffic that returns from the server is dropped here:

```
12:20:56.791938 IP autobot-01.seeapl.com.43581 > lhr-ucm-tftp-01.emea.seeapl.com.tftp:  20 RRQ "blah.txt" netascii
12:20:56.792619 IP lhr-ucm-tftp-01.emea.seeapl.com.50888 > autobot-01.seeapl.com.43581: UDP, length 19
12:20:56.792663 IP autobot-01.seeapl.com > lhr-ucm-tftp-01.emea.seeapl.com: ICMP autobot-01.seeapl.com udp port 43581 unreachable, length 55
```

I assume this happens due to NAT, I can see that the conntrack table has connections listed for port 69 -> port 43581, but the TFTP server is trying to do the transfer back to the client with source port 50888

Relevant entries from conntrack -L -p udp output (the tftp server is 10.12.4.19, the host is 192.168.16.11):

```
udp      17 19 src=172.17.0.2 dst=10.12.4.19 sport=43581 dport=69 [UNREPLIED] src=10.12.4.19 dst=192.168.16.11 sport=69 dport=43581 mark=0 helper=tftp use=2
udp      17 19 src=10.12.4.19 dst=192.168.16.11 sport=50888 dport=43581 [UNREPLIED] src=192.168.16.11 dst=10.12.4.19 sport=43581 dport=50888 mark=0 use=1
```

Are there certain NAT rules, modules, etc. that can be added to get this to work? Should docker be auto-generating these changes as well? This looks similar to other issues I have seen with exposing UDP ports but in my case this is client-side behavior, I am not trying to run the server in my container.

More info:

Conntrack tftp module is loaded:

```
$ lsmod | grep tftp
nf_conntrack_tftp      13121  0 
nf_conntrack          105081  9 ipt_MASQUERADE,nf_nat,nf_nat_ipv4,xt_conntrack,nf_conntrack_netlink,nf_conntrack_ftp,iptable_nat,nf_conntrack_ipv4,nf_conntrack_tftp
```

iptables -L output:

```
sudo iptables -L
[sudo] password for administrator: 
Chain INPUT (policy ACCEPT)
target     prot opt source               destination         

Chain FORWARD (policy ACCEPT)
target     prot opt source               destination         
DOCKER-ISOLATION  all  --  anywhere             anywhere            
DOCKER     all  --  anywhere             anywhere            
ACCEPT     all  --  anywhere             anywhere             ctstate RELATED,ESTABLISHED
ACCEPT     all  --  anywhere             anywhere            
ACCEPT     all  --  anywhere             anywhere            

Chain OUTPUT (policy ACCEPT)
target     prot opt source               destination         

Chain DOCKER (1 references)
target     prot opt source               destination         

Chain DOCKER-ISOLATION (1 references)
target     prot opt source               destination         
RETURN     all  --  anywhere             anywhere            
```

iptables -L -t nat output:

```
Chain PREROUTING (policy ACCEPT)
target     prot opt source               destination         
DOCKER     all  --  anywhere             anywhere             ADDRTYPE match dst-type LOCAL

Chain INPUT (policy ACCEPT)
target     prot opt source               destination         

Chain OUTPUT (policy ACCEPT)
target     prot opt source               destination         
DOCKER     all  --  anywhere            !127.0.0.0/8          ADDRTYPE match dst-type LOCAL

Chain POSTROUTING (policy ACCEPT)
target     prot opt source               destination         
MASQUERADE  all  --  172.17.0.0/16        anywhere            

Chain DOCKER (2 references)
target     prot opt source               destination         
RETURN     all  --  anywhere             anywhere            
```

**Comment by HarryS** [comment]
Hello, did you find anything on this? I am having pretty much the same problem, but with ftp. Same debugging results.

**Comment by bsquizzato** [comment]
@HarryS unfortunately no, I gave up and used --net=host

**Comment by sanimej** [comment]
@bsquizzato For TFTP to work behind NAT you need `ip_conntrack_tftp` and `ip_nat_tftp`. Can you try with `ip_nat_tftp` also loaded ?

**Comment by sanimej** [comment]
@bsquizzato FTP needs `ip_nat_ftp` and `ip_conntract_ftp`.  Can give it a try after a `modprobe` for these modules ?
