### ISSUE TITLE
overlay nw: TCP PSH after >60s sleep leads TCP RST (seems swarm-mode only)

### ISSUE THREAD

**Issue by AkihiroSuda** [docker/docker#29655]
**Description**

If a swarm-mode service sends TCP PSH to a container in the overlay network after some duration (longer than 60 seconds), it gets TCP RST.

However, if I use a non-service container (`docker run`) with the same overlay network, I didn't hit the issue.

**Steps to reproduce the issue:**

1. Create a Swarm-mode cluster. Just a single node is enough.

```console
$ docker swarm init
...
```

2. Create an overlay network, in the attachable mode.

```console
$ docker network create --driver overlay --attachable demo-nw
...
```

3. Create a service that makes a response, after 55 (< 60) seconds.

```console
$ docker service create --name demo-service --network demo-nw busybox nc -ll -p 1234 -e sh -c "sleep 55; echo pong"
...
```

4. Send a request to the service. Make sure it succeeds after 55 (+ epsilon) seconds.

```console
$ docker run -t --rm --network demo-nw busybox sh -c "echo ping | nc demo-service 1234"; echo $?
pong
0
```

5. Remove the service, and then try Step 3 and 4, with a sleep longer than 60 seconds. It hangs up.

```console
$ docker service rm demo-service
...
```

```console
$ docker service create --name demo-service --network demo-nw busybox nc -ll -p 1234 -e sh -c "sleep 65; echo pong"
...
```

```console
$ docker run -t --rm --network demo-nw busybox sh -c "echo ping | nc demo-service 1234"; echo $?
(hangs up here)
```

**Describe the results you received:**

It hangs up if the sleep is longer than 60 seconds.
`netstat` in the client shows that it is stucking at the `FIN_WAIT2` state.

tcpdumps are attached below.

**Describe the results you expected:**

It should not hang up.

**Additional information you deem important (e.g. issue happens only occasionally):**

 * 100% deterministic reproducible
 * Even reproducible on http://play-with-docker.com instance (Alpine 3.4.4, Docker 1.13.0-rc4, Kernel 4.4.0-51-generic #72-Ubuntu)
 * The issue is not reproducible if I use `docker run` (with `--network` for the overlay network) instead of `docker service`.
 * I wonder it is related to `/proc/sys/net/ipv4/tcp_fin_timeout` (which defaults to 60), but still could not get resolved by increasing that value in the client container and in the host.

**Output of `docker version`:**

```
Client:
 Version:      1.13.0-rc4
 API version:  1.25
 Go version:   go1.7.3
 Git commit:   88862e7
 Built:        Fri Dec 16 23:13:09 2016
 OS/Arch:      linux/amd64

Server:
 Version:      1.13.0-rc4
 API version:  1.25 (minimum version 1.12)
 Go version:   go1.7.3
 Git commit:   88862e7
 Built:        Fri Dec 16 23:13:09 2016
 OS/Arch:      linux/amd64
 Experimental: false
```

**Output of `docker info`:**

```
docker info
Containers: 0
 Running: 0
 Paused: 0
 Stopped: 0
Images: 1
Server Version: 1.13.0-rc4
Storage Driver: overlay2
 Backing Filesystem: extfs
 Supports d_type: true
 Native Overlay Diff: true
Logging Driver: json-file
Cgroup Driver: cgroupfs
Plugins: 
 Volume: local
 Network: bridge host macvlan null overlay
Swarm: active
 NodeID: al9q4zo53nzij6lb1ufp4wcda
 Is Manager: true
 ClusterID: m0c73gbe98cammpexi84qdp5p
 Managers: 1
 Nodes: 1
 Orchestration:
  Task History Retention Limit: 5
 Raft:
  Snapshot Interval: 10000
  Number of Old Snapshots to Retain: 0
  Heartbeat Tick: 1
  Election Tick: 3
 Dispatcher:
  Heartbeat Period: 5 seconds
 CA Configuration:
  Expiry Duration: 3 months
 Node Address: 172.31.254.9
 Manager Addresses:
  172.31.254.9:2377
Runtimes: runc
Default Runtime: runc
Init Binary: docker-init
containerd version: 03e5862ec0d8d3b3f750e19fca3ee367e13c090e
runc version: 51371867a01c467f08af739783b8beafc154c4d7
init version: 949e6fa
Security Options:
 apparmor
 seccomp
  Profile: default
Kernel Version: 4.8.0-30-generic
Operating System: Ubuntu 16.10
OSType: linux
Architecture: x86_64
CPUs: 4
Total Memory: 15.6 GiB
Name: suda-PC2
ID: 42B5:4E7P:VILK:75VX:TKMU:7PC7:QYS3:CZHX:R6SR:3VWI:E75Y:G4L6
Docker Root Dir: /var/lib/docker
Debug Mode (client): false
Debug Mode (server): false
Username: akihirosuda
Registry: https://index.docker.io/v1/
WARNING: No swap limit support
Experimental: false
Insecure Registries:
 127.0.0.0/8
Live Restore Enabled: false
```

**Additional environment details (AWS, VirtualBox, physical, etc.):**
None

- - -

### tcpdumps

The following tcpdumps are captured by doing:

```console
$ docker network inspect -f '{{.Id}}' demo-nw
njfcym63674hzn99b6iawnq1y
$ sudo nsenter --net=/var/run/docker/netns/1-njfcym6367 tcpdump -n -l -s 0 ip
```

#### with "sleep 55" (works as expected)

```
tcpdump: verbose output suppressed, use -v or -vv for full protocol decode
listening on br0, link-type EN10MB (Ethernet), capture size 262144 bytes
18:47:14.083666 IP 10.0.0.4.41812 > 10.0.0.3.1234: Flags [S], seq 1138933826, win 28200, options [mss 1410,sackOK,TS val 71536554 ecr 0,nop,wscale 7], length 0
18:47:14.083689 IP 10.0.0.3.1234 > 10.0.0.4.41812: Flags [S.], seq 4134638071, ack 1138933827, win 27960, options [mss 1410,sackOK,TS val 71536554 ecr 71536554,nop,wscale 7], length 0
18:47:14.083703 IP 10.0.0.4.41812 > 10.0.0.3.1234: Flags [.], ack 1, win 221, options [nop,nop,TS val 71536554 ecr 71536554], length 0
18:47:14.083727 IP 10.0.0.4.41812 > 10.0.0.3.1234: Flags [P.], seq 1:6, ack 1, win 221, options [nop,nop,TS val 71536554 ecr 71536554], length 5
18:47:14.083733 IP 10.0.0.3.1234 > 10.0.0.4.41812: Flags [.], ack 6, win 219, options [nop,nop,TS val 71536554 ecr 71536554], length 0
18:47:14.083743 IP 10.0.0.4.41812 > 10.0.0.3.1234: Flags [F.], seq 6, ack 1, win 221, options [nop,nop,TS val 71536554 ecr 71536554], length 0
18:47:14.128325 IP 10.0.0.3.1234 > 10.0.0.4.41812: Flags [.], ack 7, win 219, options [nop,nop,TS val 71536566 ecr 71536554], length 0
18:48:09.084349 IP 10.0.0.3.1234 > 10.0.0.4.41812: Flags [P.], seq 1:6, ack 7, win 219, options [nop,nop,TS val 71550305 ecr 71536554], length 5
18:48:09.084385 IP 10.0.0.4.41812 > 10.0.0.3.1234: Flags [.], ack 6, win 221, options [nop,nop,TS val 71550305 ecr 71550305], length 0
18:48:09.084431 IP 10.0.0.3.1234 > 10.0.0.4.41812: Flags [R.], seq 6, ack 7, win 219, options [nop,nop,TS val 71550305 ecr 71550305], length 0
```

#### with "sleep 65" (hangs up)

```
tcpdump: verbose output suppressed, use -v or -vv for full protocol decode
listening on br0, link-type EN10MB (Ethernet), capture size 262144 bytes
18:50:07.336587 IP 10.0.0.4.51418 > 10.0.0.3.1234: Flags [S], seq 1985336155, win 28200, options [mss 1410,sackOK,TS val 71579868 ecr 0,nop,wscale 7], length 0
18:50:07.336611 IP 10.0.0.3.1234 > 10.0.0.4.51418: Flags [S.], seq 3648399059, ack 1985336156, win 27960, options [mss 1410,sackOK,TS val 71579868 ecr 71579868,nop,wscale 7], length 0
18:50:07.336625 IP 10.0.0.4.51418 > 10.0.0.3.1234: Flags [.], ack 1, win 221, options [nop,nop,TS val 71579868 ecr 71579868], length 0
18:50:07.336649 IP 10.0.0.4.51418 > 10.0.0.3.1234: Flags [P.], seq 1:6, ack 1, win 221, options [nop,nop,TS val 71579868 ecr 71579868], length 5
18:50:07.336656 IP 10.0.0.3.1234 > 10.0.0.4.51418: Flags [.], ack 6, win 219, options [nop,nop,TS val 71579868 ecr 71579868], length 0
18:50:07.336666 IP 10.0.0.4.51418 > 10.0.0.3.1234: Flags [F.], seq 6, ack 1, win 221, options [nop,nop,TS val 71579868 ecr 71579868], length 0
18:50:07.380354 IP 10.0.0.3.1234 > 10.0.0.4.51418: Flags [.], ack 7, win 219, options [nop,nop,TS val 71579879 ecr 71579868], length 0
18:51:12.337393 IP 10.0.0.3.1234 > 10.0.0.4.51418: Flags [P.], seq 1:6, ack 7, win 219, options [nop,nop,TS val 71596118 ecr 71579868], length 5
18:51:12.337446 IP 10.0.0.4.51418 > 10.0.0.3.1234: Flags [R], seq 1985336162, win 0, length 0
```

The service PSHed, but the client somehow RSTed it.

**Comment by AkihiroSuda** [comment]
This issue is unrelated to `platform/arm`.. https://github.com/docker/docker/pull/29645

**Comment by thaJeztah** [comment]
ping @sanimej PTAL

**Comment by aaronlehmann** [comment]
Thanks for the detailed bug report @AkihiroSuda. Hoping we can get to the bottom of this soon.

**Comment by sanimej** [comment]
Will take a look.

**Comment by sanimej** [comment]
@AkihiroSuda 

This is what is happening here..
When the client (from `docker run`) connects to the server it sends some data and immediately closes one end of the connection. At this point, the server's TCP state goes to `CLOSE_WAIT`. Even though the client is from a `docker run` container, it has the IPVS entries programmed to reach the other services by the VIP. And for TCP load balancing, IPVS maintains its own connection table. The default timeout for `CLOSE_WAIT` connections in IPVS table is 60 seconds. Hence when the server sends something after 60 seconds, the IPVS connection is no longer and the packet looks invalid for a new TCP session (ie: not a SYN) and gets RST. On the client side, the connection remains forever in FIN_WAIT2 state because the app still has the socket open; kernel's fin_wait timer kicks on only for orphaned TCP sockets.

The reason you don't see the problem when running the server from a `docker run` container is because the client container won't have IPVS programmed in that case. In the case of `docker service` also you won't see the problem if the client does `nc server-ip 1234` instead of the service name because that again bypasses IPVS.

It should be possible to tweak the IPVS timers. But unless we have real apps running into this issue I would prefer leaving the default values. The work around is to enable TCP keepalive (interval tuned to < 60 seconds).

**Comment by AkihiroSuda** [comment]
Thank you for analysis!

**Comment by ondrejtomcik** [comment]
+1

**Comment by djmaze** [comment]
Experiencing the same problem. 

I guess running the service in DNSRR mode (`--endpoint-mode=dnsrr`) prevents this problem as well, since then IPVS is probably not used?
