### ISSUE TITLE
akka.remote.artery.OutboundHandshake$HandshakeTimeoutException

### ISSUE THREAD

**Issue by christophermoeketsi** [docker/docker#31883]
I am getting Mar 16 13:53:05 vn-2-ws-test-el6 whalesong-voice-node[13299]: [ERROR] [03/16/2017 13:53:05.948] [Whalesong-akka.remote.default-remote-dispatcher-7] [akka.remote.artery.Association(akka:/Whalesong)] Outbound message stream to [akka://Whalesong@node_1_ip:62060] failed. Restarting it. Handshake with [akka://Whalesong@node_1_ip:62060] did not complete within 20000 ms (`akka.remote.artery.OutboundHandshake$HandshakeTimeoutException`)

These are my jars 

aeron-client-1.0.4.jar         
aeron-driver-1.0.4.jar        
Agrona-0.9.0.jar
akka-actor_2.11-2.4.16.jar
akka-protobuf_2.11-2.4.16.jar  
akka-remote_2.11-2.4.16.jar   
akka-stream_2.11-2.4.16.jar  

I have the following akka.conf files for my actor systems.

ip_node1

```
akka{
  loglevel = "WARNING"
  stdout-loglevel = "WARNING"

  remote {
    artery {
      enabled = on
      hostname = "ip_node1"
      canonical.port = 62060

    advanced {
        send-buffer-size = 20000000b
        receive-buffer-size = 20000000b
        maximum-frame-size = 10000000b
      }

    }
  }

  actor {
    provider = remote
    serializers = {
      java = "com.ecntelecoms.whalesong.commons.ByteBufferSerializerImpl"
    }
    serialization-bindings {
      "java.io.Serializable" = java
    }

  }
}

ip_node2

akka{
  loglevel = "WARNING"
  stdout-loglevel = "WARNING"

  remote {
    artery {
      enabled = on
      hostname = "ip_node2"
      canonical.port = 62060

    advanced {
        send-buffer-size = 20000000b
        receive-buffer-size = 20000000b
        maximum-frame-size = 10000000b
      }

    }
  }

  actor {
    provider = remote
    serializers = {
      java = "com.ecntelecoms.whalesong.commons.ByteBufferSerializerImpl"
    }
    serialization-bindings {
      "java.io.Serializable" = java
    }

  }
}

```

I have stopped iptables just to be sure  on both machines
This is not running on docker.

When I run 
tcpdump -nn -s0 -l -i any port 62060 l
on both node1 and node2

Node1_ip

14:02:11.356127 IP Node2_ip.55611 > Node1_ip.62060: UDP, length 40
14:02:11.356127 IP Node2_ip.55611 > Node1_ip.62060: UDP, length 40
14:02:11.356127 IP Node2_ip.55611 > Node1_ip.62060: UDP, length 40
14:02:11.356127 IP Node2_ip.55611 > Node1_ip.62060: UDP, length 40

Node2_ip
14:04:00.159552 IP Node2_ip.55611 > Node1_ip: UDP, length 40
14:04:00.259761 IP Node2_ip.55611 >  Node1_ip.62060: UDP, length 40
14:04:00.359781 IP Node2_ip.55611 >  Node1_ip.62060: UDP, length 40
14:04:00.459935 IP Node2_ip.55611 >  Node1_ip.62060: UDP, length 40
14:04:00.560014 IP Node2_ip.55611 >  Node1_ip.62060: UDP, length 40
14:04:00.660191 IP Node2_ip.55611 >  Node1_ip.62060: UDP, length 40

On Node 2

 [ERROR] [03/16/2017 13:53:05.948] [Whalesong-akka.remote.default-remote-dispatcher-7] [akka.remote.artery.Association(akka://MyActorSystem)] Outbound message stream to [akka://Whalesong@node_1_ip:62060] failed. Restarting it. Handshake with [akka://Whalesong@node_1_ip:62060] did not complete within 20000 ms (akka.remote.artery.OutboundHandshake$HandshakeTimeoutException) 

This happens periodically ... and keeps repeating.

When I revert the changes to netty with the same configs everything is fine, 

I have looked at this issue https://github.com/docker/docker/issues/15127, picked up from this thread https://groups.google.com/forum/#!msg/akka-user/Hp-Y2cHJwp8/Rz7bdti3BQAJ. I also looked at this https://github.com/akka/akka/issues/20623.  The second issue was closed but it seems that the person had a file issue or something. The warning output is the same regardless of the loglevel. 

I would appreciate it if someone could have a look.

Regards

**Comment by christophermoeketsi** [comment]
Sorry this was not meant for Docker :(
