### ISSUE TITLE
Can't access internet from containers

### ISSUE THREAD

**Issue by cfpeng** [docker/docker#13381]
**When I ping google.com in the container, it return : ping: unknown host**

**[HOST Info]**
root@host# uname -a
Linux localhost 4.0.2-x86_64-linode56 #1 SMP Mon May 11 16:55:19 EDT 2015 x86_64 GNU/Linux

root@host# docker version
Client version: 1.6.2
Client API version: 1.18
Go version (client): go1.4.2
Git commit (client): 7c8fca2
OS/Arch (client): linux/amd64
Server version: 1.6.2
Server API version: 1.18
Go version (server): go1.4.2
Git commit (server): 7c8fca2
OS/Arch (server): linux/amd64

**start the container**
root@host#docker run --rm  -it debian /bin/bash 

**start capture package**
root@host# tshark -i eth0 -i docker0
1 0.000000 106.186.. -> 8.8.8.8 DNS 70 Standard query 0xb49a A google.com
2 0.046688 8.8.8.8 -> 106.186.. DNS 86 Standard query response 0xb49a A 216.58.221.14
3 -0.000042 172.17.0.4 -> 8.8.8.8 DNS 70 Standard query 0xb49a A google.com
4 4.171017 fe80::1 -> ff02::1 ICMPv6 118 Router Advertisement from 00:05:73:a0:0f:ff
5 5.005167 106.186.. -> 8.8.8.8 DNS 70 Standard query 0xb49a A google.com
6 5.007502 8.8.8.8 -> 106.186.. DNS 86 Standard query response 0xb49a A 216.58.221.14
7 5.005127 172.17.0.4 -> 8.8.8.8 DNS 70 Standard query 0xb49a A google.com
8 5.016512 02:42:ac:11:00:04 -> ca:5b:7d:34:78:20 ARP 42 Who has 172.17.42.1? Tell 172.17.0.4
9 5.016542 ca:5b:7d:34:78:20 -> 02:42:ac:11:00:04 ARP 42 172.17.42.1 is at ca:5b:7d:34:78:20
10 10.010414 106.186.. -> 8.8.8.8 DNS 70 Standard query 0x1367 A google.com
11 10.046683 8.8.8.8 -> 106.186.. DNS 86 Standard query response 0x1367 A 216.58.221.14
12 10.010374 172.17.0.4 -> 8.8.8.8 DNS 70 Standard query 0x1367 A google.com
13 15.015578 106.186.. -> 8.8.8.8 DNS 70 Standard query 0x1367 A google.com
14 15.052782 8.8.8.8 -> 106.186.. DNS 246 Standard query response 0x1367 A 173.194.126.198 A 173.194.126.196 A 173.194.126.197 A 173.194.126.194 A 173.194.126.195 A 173.194.126.193 A 173.194.126.206 A 173.194.126.199 A 173.194.126.200 A 173.194.126.192 A 173.194.126.201
15 15.015538 172.17.0.4 -> 8.8.8.8 DNS 70 Standard query 0x1367 A google.com

root@f82d47432161:/# ip addr
    eth0: <BROADCAST,UP,LOWER_UP> mtu 1500 qdisc noqueue state UP group default
    link/ether 02:42:ac:11:00:04 brd ff:ff:ff:ff:ff:ff
    inet 172.17.0.4/16 scope global eth0
       valid_lft forever preferred_lft forever
    inet6 fe80::42:acff:fe11:4/64 scope link
       valid_lft forever preferred_lft forever

root@f82d47432161:/# ping google.com 
ping: unknown host

**It seems that the host did not forword package to the container**

**Comment by runcom** [comment]
@VirtualSniper do you have net.ipv4.ip_forward on?

**Comment by VirtualSniper** [comment]
yes

**Comment by aboch** [comment]
@VirtualSniper are you able to reproduce this ?
I tried with no luck. 
If you can reproduce, can you please capture what is going on on the vethxxx interface. Thanks.

**Comment by VirtualSniper** [comment]
@aboch  yes, here is : 
root@host# tshark -i vetheee49f3
  1   0.000000   172.17.0.3 -> 8.8.8.8      DNS 70 Standard query 0x4b9f  A google.com
  2   5.005164   172.17.0.3 -> 8.8.8.8      DNS 70 Standard query 0x4b9f  A google.com
  3   5.007449 02:42:ac:11:00:03 -> 52:06:ed:10:28:2a ARP 42 Who has 172.17.42.1?  Tell 172.17.0.3
  4   5.007462 52:06:ed:10:28:2a -> 02:42:ac:11:00:03 ARP 42 172.17.42.1 is at 52:06:ed:10:28:2a
  5  10.010424   172.17.0.3 -> 8.8.8.8      DNS 70 Standard query 0x8327  A google.com
  6  15.015621   172.17.0.3 -> 8.8.8.8      DNS 70 Standard query 0x8327  A google.com

**Comment by clnperez** [comment]
I was also running into this. I was able to work around it by deactivating & deleting docker0 (after stopping docker), and then starting docker again (which re-creates docker0).

I do have NetworkManager running, since this is on my laptop. and a VPN running at the moment. But this was also happening while I was in the office on Friday (sans VPN in use).

I wouldn't be surprised is this is a known issue, and there are other open issues for it. Anyone know who to tag from the Docker networking side to find out more?

**Comment by bear0330** [comment]
I have the same problem but it not always happens. First, everything works fine, then after few days passed, or I build some images, start/stop containers. Sometimes inside the container cannot connect to anything anymore. All my running containers are the same, lost internet connection, for example curl to github (via ip or domain) will fail:
```
[root@2b7308d /]# curl http://192.30.252.129
curl: (7) Failed connect to 192.30.252.129:80; No route to host
```

The only way I can solve this is restart docker daemon, then everything will be back to work.
But it bothers me a lot, all my apps and services in container will be down but I even don't know it until I got error to do something.

Any suggestions for this? Thanks.

**Comment by thaJeztah** [comment]
ping @aboch

**Comment by aboch** [comment]
There was a bug in bridge driver code where the linux bridge interface MAC address would not be programmed as "SET" in 4.x (x < 3) kernels. Bug is there in docker 1.6.2.

@cfpeng I see your host is running a 4.0.2, so it would be affected.
Issue has been recently fixed [here](https://github.com/docker/libnetwork/pull/421) and made it to docker/docker code via [this](https://github.com/docker/docker/pull/15185) so it will be in docker 1.8.0 

@bear0330 can you check whether your kernel is a 4.x as well ? This would explain why you hit the issue after a while, maybe after spawning a new container.

@cfpeng @bear0330 could you please check whether you are still hitting this issue with latest 1.8.0-rcX image

**Comment by bear0330** [comment]
@aboch My kernel is 3.10.0-229.7.2.el7.x86_64, I am running docker on Azure, I am not sure this is because Azure's issue (I have no idea), I am trying to run docker on Vultr.

**Comment by dverbeek84** [comment]
@aboch same issue here with the same kernel as @bear0330

**Comment by fkeet** [comment]
Similar issue. Removing the bridge (and relevant cleanup) did not have an effect.

$ uname -a
Linux hostname 3.19.0-25-generic #26-Ubuntu SMP Fri Jul 24 21:17:31 UTC 2015 x86_64 x86_64 x86_64 GNU/Linux

$ docker version
Client:
 Version:      1.8.1
 API version:  1.20
 Go version:   go1.4.2
 Git commit:   d12ea79
 Built:        Thu Aug 13 02:40:42 UTC 2015
 OS/Arch:      linux/amd64

Server:
 Version:      1.8.1
 API version:  1.20
 Go version:   go1.4.2
 Git commit:   d12ea79
 Built:        Thu Aug 13 02:40:42 UTC 2015
 OS/Arch:      linux/amd64

$ docker run -ti ubuntu /bin/bash
$ ping 8.8.8.8
PING 8.8.8.8 (8.8.8.8) 56(84) bytes of data.
64 bytes from 8.8.8.8: icmp_seq=1 ttl=56 time=0.967 ms
....

$ ping www.google.com
ping: unknown host www.google.com

**Comment by aboch** [comment]
@bear0330 Your issue (from what I can see from your logs) is different from the one hit by @cfpeng and @fkeet. Theirs is related to DNS response packets not being delivered to the container, yours is related to ip reachability: you would get "no route to host" if ,for example, in your container the default gw IP is unset or it does not belong to the same network of eth0.

**Comment by aboch** [comment]
@cfpeng Given DNS requests are routed from docker0 to eth0 but responses are not, it makes me think it has to do with iptables.
If you have not done so already, could you please run the `check-config.sh` that you find in `docker/contrib/` to see if any required iptable component is missing.

@fkeet Can you also try the same.

Thanks.

**Comment by bear0330** [comment]
@aboch I got the same issue after running docker on Vultr's machine for few days. Now my container cannot connect to internet again. Now in container (My container's hostname is status.xxx.com):

```
[root@status /]# curl http://www.google.com/
curl: (6) Could not resolve host: www.google.com; Unknown error
[root@status /]# ping 8.8.8.8
PING 8.8.8.8 (8.8.8.8) 56(84) bytes of data.
```
(hang, I press Ctrl+C to break)
```
[root@status /]# curl http://192.30.252.129
curl: (7) Failed connect to 192.30.252.129:80; No route to host
```

run ```docker run -ti  ubuntu /bin/bash``` on host:
```
[root@mercury Redis]# docker run -ti ubuntu /bin/bash
Unable to find image 'ubuntu:latest' locally
Trying to pull repository docker.xxx.com/ubuntu ... failed
Trying to pull repository docker-protected.xxx.com/ubuntu ... failed
latest: Pulling from docker.io/ubuntu
6071b4945dcf: Pulling fs layer
6071b4945dcf: Download complete
5bff21ba5409: Download complete
e5855facec0b: Download complete
8251da35e7a7: Download complete
Status: Downloaded newer image for docker.io/ubuntu:latest
root@63840a13cad5:/# ping 8.8.8.8
PING 8.8.8.8 (8.8.8.8) 56(84) bytes of data.
```
(hang..., also Ctrl+C)

```
[root@mercury Redis]# docker version
Client version: 1.6.2
Client API version: 1.18
Go version (client): go1.4.2
Git commit (client): ba1f6c3/1.6.2
OS/Arch (client): linux/amd64
Server version: 1.6.2
Server API version: 1.18
Go version (server): go1.4.2
Git commit (server): ba1f6c3/1.6.2
OS/Arch (server): linux/amd64
```
```
[root@mercury Redis]# docker info
Containers: 18
Images: 142
Storage Driver: devicemapper
 Pool Name: docker-253:1-304602-pool
 Pool Blocksize: 65.54 kB
 Backing Filesystem: extfs
 Data file:
 Metadata file:
 Data Space Used: 3.558 GB
 Data Space Total: 107.4 GB
 Data Space Available: 103.8 GB
 Metadata Space Used: 7.365 MB
 Metadata Space Total: 2.147 GB
 Metadata Space Available: 2.14 GB
 Udev Sync Supported: true
 Library Version: 1.02.93-RHEL7 (2015-01-28)
Execution Driver: native-0.2
Kernel Version: 3.10.0-229.11.1.el7.x86_64
Operating System: CentOS Linux 7 (Core)
CPUs: 2
Total Memory: 1.797 GiB
Name: mercury.xxx.com
ID: V5PO:Z7CC:LTPM:NICT:I2G5:6B6K:AVTP:IOH5:6GNW:JLOK:VCUF:MSY
```
There is some log messages in my /var/log/messages, I don't know it is related or not:
```
Aug 15 11:20:02 mercury systemd: Starting Session 5445 of user root.
Aug 15 11:20:02 mercury systemd: Started Session 5445 of user root.
Aug 15 11:20:09 mercury docker: time="2015-08-15T11:20:09Z" level=info msg="Container 6067b64e5538d86adc350b6f61cccf1ce2327d4e781a835e642c8e36d8503534 failed to exit within 10 seconds of SIGTERM - using the force"
Aug 15 11:20:09 mercury kernel: docker0: port 1(veth6388a9a) entered disabled state
Aug 15 11:20:09 mercury kernel: device veth6388a9a left promiscuous mode
Aug 15 11:20:09 mercury kernel: docker0: port 1(veth6388a9a) entered disabled state
Aug 15 11:20:09 mercury docker: time="2015-08-15T11:20:09Z" level=info msg="+job log(die, 6067b64e5538d86adc350b6f61cccf1ce2327d4e781a835e642c8e36d8503534, docker.xxx.com/service/redis:2.8.19-latest)"
Aug 15 11:20:09 mercury docker: time="2015-08-15T11:20:09Z" level=info msg="-job log(die, 6067b64e5538d86adc350b6f61cccf1ce2327d4e781a835e642c8e36d8503534, docker.xxx.com/service/redis:2.8.19-latest) = OK (0)"
Aug 15 11:20:09 mercury docker: time="2015-08-15T11:20:09Z" level=info msg="+job release_interface(6067b64e5538d86adc350b6f61cccf1ce2327d4e781a835e642c8e36d8503534)"
....
Aug 15 11:20:09 mercury docker: time="2015-08-15T11:20:09Z" level=info msg="+job container_inspect(redis-2.8.19)"
Aug 15 11:20:09 mercury NetworkManager[558]: <info>  (veth6388a9a): device state change: activated -> unmanaged (reason 'removed') [100 10 36]
Aug 15 11:20:09 mercury NetworkManager[558]: <info>  (veth6388a9a): deactivating device (reason 'removed') [36]
Aug 15 11:20:09 mercury docker: time="2015-08-15T11:20:09Z" level=info msg="-job release_interface(6067b64e5538d86adc350b6f61cccf1ce2327d4e781a835e642c8e36d8503534) = OK (0)"
Aug 15 11:20:09 mercury NetworkManager[558]: <warn>  (docker0): failed to detach bridge port veth6388a9a
Aug 15 11:20:09 mercury dbus-daemon: dbus[470]: [system] Activating via systemd: service name='org.freedesktop.nm_dispatcher' unit='dbus-org.freedesktop.nm-dispatcher.service'
Aug 15 11:20:09 mercury dbus[470]: [system] Activating via systemd: service name='org.freedesktop.nm_dispatcher' unit='dbus-org.freedesktop.nm-dispatcher.service'
Aug 15 11:20:09 mercury systemd: Starting Network Manager Script Dispatcher Service...
Aug 15 11:20:09 mercury dbus-daemon: dbus[470]: [system] Successfully activated service 'org.freedesktop.nm_dispatcher'
Aug 15 11:20:09 mercury systemd: Started Network Manager Script Dispatcher Service.
Aug 15 11:20:09 mercury nm-dispatcher: Dispatching action 'down' for veth6388a9a
Aug 15 11:20:09 mercury docker: time="2015-08-15T11:20:09Z" level=info msg="+job log(stop, 6067b64e5538d86adc350b6f61cccf1ce2327d4e781a835e642c8e36d8503534, docker.xxx.com/service/redis:2.8.19-latest)"
Aug 15 11:20:09 mercury docker: time="2015-08-15T11:20:09Z" level=info msg="-job log(stop, 6067b64e5538d86adc350b6f61cccf1ce2327d4e781a835e642c8e36d8503534, docker.xxx.com/service/redis:2.8.19-latest) = OK (0)"
...
```

If you need any further information, please tell me I would provide it if I can.

**Comment by cfpeng** [comment]
@aboch I have  upgrade to 1.8.1, the issue is still exist.

**Comment by aboch** [comment]
@cfpeng @fkeet Just to make sure, can you please post the content of etc/resolv.conf inside your container.

Also the o/p of `sudo iptables -t nat -L -nv` on your host. Want to check whether the masquerade rule is there.

**Comment by cfpeng** [comment]
@aboch  Here is:

`$sudo iptables -t nat -L -nv`
Chain PREROUTING (policy ACCEPT 1944 packets, 117K bytes)
 pkts bytes target     prot opt in     out     source               destination
 1929  117K DOCKER     all  --  *      *       0.0.0.0/0            0.0.0.0/0            ADDRTYPE match dst-type LOCAL

Chain INPUT (policy ACCEPT 1929 packets, 117K bytes)
 pkts bytes target     prot opt in     out     source               destination

Chain OUTPUT (policy ACCEPT 1126 packets, 69647 bytes)
 pkts bytes target     prot opt in     out     source               destination
    7   497 DOCKER     all  --  *      *       0.0.0.0/0           !127.0.0.0/8          ADDRTYPE match dst-type LOCAL

Chain POSTROUTING (policy ACCEPT 1119 packets, 69150 bytes)
 pkts bytes target     prot opt in     out     source               destination
   22  1365 MASQUERADE  all  --  *      !docker0  172.17.0.0/16        0.0.0.0/0

Chain DOCKER (2 references)
 pkts bytes target     prot opt in     out     source               destination


`$sudo docker run --rm -it ubuntu /bin/bash`
root@0aeb261357d1:/# cat /etc/resolv.conf
\# Generated by resolvconf
nameserver 8.8.8.8

**Comment by aanm** [comment]
@cfpeng do you have selinux?

**Comment by cfpeng** [comment]
@aanand no.

**Comment by rcousens** [comment]
I am encountering this issue too. I have to systemctl restart docker on Arch Linux to get access to the internet from within containers.

**Comment by ajanssens** [comment]
I'm running into the same problem, tried everything found on google but nothing fixed the issue.

**Comment by cfpeng** [comment]
After I reinstall the OS, the problem is resolved.

**Comment by lykhouzov** [comment]
I had same error.
restart of docker process is helped.
It looks like there were some blocked processes after packages update.

**Comment by poga** [comment]
I've encountered a similar issue. Containers can't access the internet until a manual restart `systemctl restart docker` on Archlinux.

One thing I've noticed is when my computer just boot up. `ip route` does not contains the `docker0` bridge.

Here's the output before restarting docker:

```
$ ip route
default via 192.168.0.1 dev wlp2s0  proto static  metric 600
192.168.0.0/24 dev wlp2s0  proto kernel  scope link  src 192.168.0.107  metric 600
```

After docker restarted:

```
$ ip route
default via 192.168.0.1 dev wlp2s0  proto static  metric 600
172.17.0.0/16 dev docker0  proto kernel  scope link  src 172.17.42.1
192.168.0.0/24 dev wlp2s0  proto kernel  scope link  src 192.168.0.107  metric 600
```

not sure if this would help.

**Comment by bwinterton** [comment]
@poga I just found this same issue, thank you for finding a solution! So are we thinking this is a problem with Docker, or with Arch?

**Comment by poga** [comment]
@bwinterton Sorry, I don't have enough knowledge to determine the source of problem. My guess is that something override the network bridge config after docker servicer started.

**Comment by fbourigault** [comment]
I also have the issue with all my Arch Linux. It looks like a race condition during system startup.

**Comment by thaJeztah** [comment]
@aboch is https://github.com/docker/docker/issues/13381#issuecomment-141410434 something to work with to resolve this?

**Comment by srus** [comment]
In Ubuntu 12.04 I had to change manually `/etc/resolv.conf` and set Google's DNS (8.8.8.8). But after a reboot, this file was updated automatically with the previous value, so now I have to change it again... Anyone has a better solution? I'm using DHCP, so `/etc/resolv.conf` is managed by the system.

**Comment by hadim** [comment]
I don't know why but without restarting server the following works, `docker run -it --rm --net=host ubuntu ping 8.8.8.8` while this does not work, `docker run -it --rm ubuntu ping 8.8.8.8`

**Comment by cdepillabout** [comment]
I'm experiencing the same problem on Arch and @hadim's solution works for me.

**Comment by aboch** [comment]
@poga Thanks for the info.
It looks like if the docker0 bridge is removed, the veth interface in the container stays in link up state, but subsequent packets sent by the container would be dropped by linux given no ip address is configured on the host end veth.

This is very interesting issue and it's worth investigating whether linux removed docker0 or (I doubt) docker did.

But it surely is a different issue from the one originally reported by @cfpeng where docker0 is there (there is a capture session on it) and DNS requests originated by the container are being routed out the host and responses being received by docker0 bridge.

**Comment by aboch** [comment]
@hadim Provided you hit the same issue reported by @poga (docker0 bridge removed) your test observation is expected.

When you run a container in host mode networking, the container uses the host OS networking stack, it is not plugged into any bridge.

Instead when you do not specify the networking mode, the container uses the default mode which is the bridge network. Its eth0 interface is one end of a veth pair, the other end is plugged into the docker0 bridge. Given the bridge is not there, that end is left dangling.

**Comment by AndreaGiardini** [comment]
@hadim solution works for me as well

**Comment by depay** [comment]
i have the similar problem and restart daemon works..centos 7.1/docker1.7.1

1. I've found that much veth still exists even container stopped with `ifconfig`. And i found the sys logs for every veth not detached, like `NetworkManager[998]: <warn>  (docker0): failed to detach bridge port veth56029e2`. I don't know whether it has any relationship with the broken of bridge `docker0`. In this circumstance, network works well with `--net host`.

2. Sometimes even worse, when i start a container with `--net host` there, there's only a `lo` dev in ifconfig, without `eth0` or others at host !

**Comment by iammerrick** [comment]
I'm running into this as well with the prebuilt node package.

**Comment by ebuildy** [comment]
It looks a network routing problem, check with "ip route" or just "route" that IPs bridge are going somewhere... (even if all roads lead to Rome ^^)

**Comment by depay** [comment]
i've finally found the reason of my problem with bridge mode. ip_forward is set to 0 during restarting network, while docker daemon is living..Add net.ipv4.ip_forward=1 to /etc/sysctl.conf & restart network fixed that..

But the problem with host mode is still confusing..

**Comment by surajx** [comment]
I was trying to install python dependencies and could not connect to pypi, finally traced it to a DNS issue and stumbled upon this issue. Do let me know if any other logs/output is needed to pin down the problem.

### Host
surajx@r2g~$ uname -a
Linux r2g 3.19.0-33-generic #38~14.04.1-Ubuntu SMP Fri Nov 6 18:17:28 UTC 2015 x86_64 x86_64 x86_64 GNU/Linux

surajx@r2g:~$ docker version
Client:
 Version:      1.9.1
 API version:  1.21
 Go version:   go1.4.2
 Git commit:   a34a1d5
 Built:        Fri Nov 20 13:12:04 UTC 2015
 OS/Arch:      linux/amd64
Server:
 Version:      1.9.1
 API version:  1.21
 Go version:   go1.4.2
 Git commit:   a34a1d5
 Built:        Fri Nov 20 13:12:04 UTC 2015
 OS/Arch:      linux/amd64

surajx@r2g:~$ docker info
Containers: 34
Images: 64
Server Version: 1.9.1
Storage Driver: aufs
 Root Dir: /var/lib/docker/aufs
 Backing Filesystem: extfs
 Dirs: 132
 Dirperm1 Supported: true
Execution Driver: native-0.2
Logging Driver: json-file
Kernel Version: 3.19.0-33-generic
Operating System: Ubuntu 14.04.3 LTS
CPUs: 4
Total Memory: 15.56 GiB
Name: r2g
ID: QR3V:YCAJ:X37L:CBBB:D4RX:OOPX:YCPQ:NJ6P:V4QF:EVJY:NP5F:74JD
WARNING: No swap limit support


### Container
surajx@r2g:~$ docker run --rm -it ubuntu /bin/bash

root@dc5a47e875cb:/# ping 8.8.8.8
PING 8.8.8.8 (8.8.8.8) 56(84) bytes of data.
64 bytes from 8.8.8.8: icmp_seq=1 ttl=51 time=13.5 ms
64 bytes from 8.8.8.8: icmp_seq=2 ttl=51 time=13.6 ms
^C
--- 8.8.8.8 ping statistics ---
2 packets transmitted, 2 received, 0% packet loss, time 1001ms
rtt min/avg/max/mdev = 13.500/13.571/13.643/0.136 ms

root@dc5a47e875cb:/# ping google.com
ping: unknown host google.com

**Comment by surajx** [comment]
I simultaneously analyzed the traffic generated in `wlan0` and `docker0` interface while issuing `ping google.com` from inside the container. In the `docker0` traffic no response from `8.8.8.8` was received (as expected), but something weird happened in the wlan0 traffic. It was forwarding the container's DNS request to both the public-DNS servers, but instead of a proper response the interface got flooded by malformed packets.

Hope this helps.

surajx@r2g:~$ sudo tcpdump -ni docker0
tcpdump: verbose output suppressed, use -v or -vv for full protocol decode
listening on docker0, link-type EN10MB (Ethernet), capture size 65535 bytes
17:31:18.927299 IP 172.17.0.2.53724 > 8.8.8.8.53: 9371+ A? google.com. (28)
17:31:23.932620 IP 172.17.0.2.47207 > 8.8.4.4.53: 9371+ A? google.com. (28)
17:31:23.938285 ARP, Request who-has 172.17.0.1 tell 172.17.0.2, length 28
17:31:23.938338 ARP, Reply 172.17.0.1 is-at 02:42:53:96:8f:9e, length 28
17:31:28.934345 IP 172.17.0.2.53724 > 8.8.8.8.53: 9371+ A? google.com. (28)
17:31:33.939625 IP 172.17.0.2.47207 > 8.8.4.4.53: 9371+ A? google.com. (28)
17:31:38.945046 IP 172.17.0.2.40407 > 8.8.8.8.53: 16090+ A? google.com.anu.edu.au. (39)
17:31:43.950322 IP 172.17.0.2.52317 > 8.8.4.4.53: 16090+ A? google.com.anu.edu.au. (39)
17:31:48.952601 IP 172.17.0.2.40407 > 8.8.8.8.53: 16090+ A? google.com.anu.edu.au. (39)
17:31:53.957837 IP 172.17.0.2.52317 > 8.8.4.4.53: 16090+ A? google.com.anu.edu.au. (39)

surajx@r2g:~$ sudo tcpdump -ni wlan0
tcpdump: verbose output suppressed, use -v or -vv for full protocol decode
listening on wlan0, link-type EN10MB (Ethernet), capture size 65535 bytes
17:31:18.927366 IP 130.56.238.99.53724 > 8.8.8.8.53: 9371+ A? google.com. (28)
17:31:23.932693 IP 130.56.238.99.47207 > 8.8.4.4.53: 9371+ A? google.com. (28)
17:31:28.934421 IP 130.56.238.99.53724 > 8.8.8.8.53: 9371+ A? google.com. (28)
17:31:33.939696 IP 130.56.238.99.47207 > 8.8.4.4.53: 9371+ A? google.com. (28)
17:31:37.815413 00:24:13:12:84:00 Unknown SSAP 0x16 > 80:ea:96:42:58:6d IP Information, send seq 0, rcv seq 16, Flags [Command], length 1450
17:31:37.815430 00:24:13:12:84:00 Unknown SSAP 0x16 > 80:ea:96:42:58:6d IP Information, send seq 0, rcv seq 16, Flags [Command], length 1450
17:31:37.815437 00:24:13:12:84:00 Unknown SSAP 0x16 > 80:ea:96:42:58:6d Unknown DSAP 0x08 Information, send seq 0, rcv seq 16, Flags [Command], length 1450
17:31:37.815441 00:24:13:12:84:00 Unknown SSAP 0x16 > 80:ea:96:42:58:6d Unknown DSAP 0x08 Information, send seq 0, rcv seq 16, Flags [Command], length 1242
17:31:37.815446 00:24:13:12:84:00 Unknown SSAP 0x16 > 80:ea:96:42:58:6d Unknown DSAP 0x0a Information, send seq 0, rcv seq 16, Flags [Command], length 1450
17:31:37.815450 00:24:13:12:84:00 Unknown SSAP 0x16 > 80:ea:96:42:58:6d Unknown DSAP 0x0a Information, send seq 0, rcv seq 16, Flags [Command], length 1450
17:31:37.815453 00:24:13:12:84:00 Unknown SSAP 0x16 > 80:ea:96:42:58:6d Unknown DSAP 0x0c Information, send seq 0, rcv seq 16, Flags [Command], length 674
17:31:37.815457 00:24:13:12:84:00 Unknown SSAP 0x16 > 80:ea:96:42:58:6d Unknown DSAP 0x0c Information, send seq 0, rcv seq 16, Flags [Command], length 1450
17:31:37.815462 00:24:13:12:84:00 Unknown SSAP 0x16 > 80:ea:96:42:58:6d ProWay NM Information, send seq 0, rcv seq 16, Flags [Command], length 483
17:31:37.815465 00:24:13:12:84:00 Unknown SSAP 0x16 > 80:ea:96:42:58:6d ProWay NM Information, send seq 0, rcv seq 16, Flags [Command], length 1450
17:31:37.815469 00:24:13:12:84:00 Unknown SSAP 0x16 > 80:ea:96:42:58:6d Unknown DSAP 0x10 Information, send seq 0, rcv seq 16, Flags [Command], length 1450
17:31:37.815473 00:24:13:12:84:00 Unknown SSAP 0x16 > 80:ea:96:42:58:6d Unknown DSAP 0x10 Information, send seq 0, rcv seq 16, Flags [Command], length 1450
17:31:37.815478 00:24:13:12:84:00 Unknown SSAP 0x16 > 80:ea:96:42:58:6d Unknown DSAP 0x12 Information, send seq 0, rcv seq 16, Flags [Command], length 1450
17:31:37.815482 00:24:13:12:84:00 Unknown SSAP 0x16 > 80:ea:96:42:58:6d Unknown DSAP 0x12 Information, send seq 0, rcv seq 16, Flags [Command], length 1450
17:31:37.815486 00:24:13:12:84:00 Unknown SSAP 0x16 > 80:ea:96:42:58:6d Unknown DSAP 0x14 Information, send seq 0, rcv seq 16, Flags [Command], length 1450
17:31:37.815490 00:24:13:12:84:00 Unknown SSAP 0x16 > 80:ea:96:42:58:6d Unknown DSAP 0x14 Information, send seq 0, rcv seq 16, Flags [Command], length 1450
17:31:37.818044 00:24:13:12:84:00 > 80:ea:96:42:58:6d Unknown DSAP 0x16 Information, send seq 0, rcv seq 16, Flags [Command], length 1450
17:31:37.818062 00:24:13:12:84:00 > 80:ea:96:42:58:6d Unknown DSAP 0x16 Information, send seq 0, rcv seq 16, Flags [Command], length 1450
17:31:37.818070 00:24:13:12:84:00 Unknown SSAP 0x16 > 80:ea:96:42:58:6d Unknown DSAP 0x18 Information, send seq 0, rcv seq 16, Flags [Command], length 1450
17:31:37.818075 00:24:13:12:84:00 Unknown SSAP 0x16 > 80:ea:96:42:58:6d Unknown DSAP 0x18 Information, send seq 0, rcv seq 16, Flags [Command], length 1450
... (1000+ more lines of the same thing)

**Comment by surajx** [comment]
So did some more digging and seems like my university net connection restricts the DNS server I can use. I changed my host machine DNS to 8.8.8.8 and couldn't ping google.com from my host machine. In fact I couldn't use any public DNS as my machine's default DNS.

I used the default DNS ip provisioned by my university connection and lo and behold, I'm able to ping google.com from inside the container.

surajx@r2g:~$ `docker run --dns=150.203.1.10 -it ubuntu /bin/bash`
root@f6db3afaf70d:/# ping google.com
PING google.com (203.5.76.208) 56(84) bytes of data.
64 bytes from cache.google.com (203.5.76.208): icmp_seq=1 ttl=54 time=6.78 ms
64 bytes from cache.google.com (203.5.76.208): icmp_seq=2 ttl=54 time=6.16 ms
64 bytes from cache.google.com (203.5.76.208): icmp_seq=3 ttl=54 time=6.09 ms
64 bytes from cache.google.com (203.5.76.208): icmp_seq=4 ttl=54 time=6.02 ms
^C
--- google.com ping statistics ---
4 packets transmitted, 4 received, 0% packet loss, time 3004ms
rtt min/avg/max/mdev = 6.025/6.270/6.789/0.303 ms

Looks like my issue is not docker related.

Thanks,
Suraj

**Comment by svenmueller** [comment]
This also happens for us.

What i noticed is that the "gateway" entry for the bridge subnet is missing for docker nodes who have that kind of internet connection issues. How can it happen that the "gateway" entry disappears?

```JSON
$ docker network inspect bridge
[
    {
        "Name": "bridge",
        "Id": "1b913195b86713e97d28869ac0cf0db7c9faef9c9bea9b26f14d6da971281d00",
        "Scope": "local",
        "Driver": "bridge",
        "IPAM": {
            "Driver": "default",
            "Config": [
                {
                    "Subnet": "172.17.0.0/16"
                }
            ]
        },
        "Containers": {
            "02f757d0c326b9741c21d7bcbe9cc03c9c4f3dd491f8b5068b73372dea5f392c": {
                "EndpointID": "9bc8c2574de8785b4fa67926c297711149c4c59357eae6e857158511ff827f7a",
                "MacAddress": "02:42:ac:11:00:05",
                "IPv4Address": "172.17.0.5/16",
                "IPv6Address": ""
            },
            "0b14a198fd3cc1384f39c0e146be4f1a770a4a2bdd1eb77a68ffa62b424c0c4a": {
                "EndpointID": "71c543b1be46b1823dc2bdce2f8d01a85448136d0adc930bab81157f827805a6",
                "MacAddress": "02:42:ac:11:00:03",
                "IPv4Address": "172.17.0.3/16",
                "IPv6Address": ""
            },
            "329d729b53c90d57859e25ae11069d6cab26c912c7d7f22804554a0f3d96b238": {
                "EndpointID": "089286a247e9a6a20a5b732298626c6190883c7478f7c51243f653b4661f9d15",
                "MacAddress": "02:42:ac:11:00:02",
                "IPv4Address": "172.17.0.2/16",
                "IPv6Address": ""
            },
            "7aca0b44c1b4fa4c7481dd590c29de52a4a3b0fe2501ef60d5d64e4210f9e132": {
                "EndpointID": "e096ec2176cefa967bca055b59316ef59413e736b5671cab0c49791a16add176",
                "MacAddress": "02:42:ac:11:00:04",
                "IPv4Address": "172.17.0.4/16",
                "IPv6Address": ""
            },
            "c7eaea1604324c7074410b69412a9a21edb872987909ea3779c46bf663e75d7f": {
                "EndpointID": "e4e98c92ba2e04577e122b9345f11cbf77eaff44020632a4c1dd4bb61ebea685",
                "MacAddress": "02:42:ac:11:00:08",
                "IPv4Address": "172.17.0.8/16",
                "IPv6Address": ""
            }
        },
        "Options": {
            "com.docker.network.bridge.default_bridge": "true",
            "com.docker.network.bridge.enable_icc": "true",
            "com.docker.network.bridge.enable_ip_masquerade": "true",
            "com.docker.network.bridge.host_binding_ipv4": "0.0.0.0",
            "com.docker.network.bridge.name": "docker0",
            "com.docker.network.driver.mtu": "1500"
        }
    }
]
```

```bash
$ docker version
Client:
 Version:      1.9.0
 API version:  1.21
 Go version:   go1.4.3
 Git commit:   76d6bc9
 Built:        Tue Nov  3 19:20:09 UTC 2015
 OS/Arch:      linux/amd64

Server:
 Version:      1.9.0
 API version:  1.21
 Go version:   go1.4.3
 Git commit:   76d6bc9
 Built:        Tue Nov  3 19:20:09 UTC 2015
 OS/Arch:      linux/amd64
```

```bash
$ docker info
Containers: 6
Images: 89
Server Version: 1.9.0
Storage Driver: aufs
 Root Dir: /var/lib/docker/aufs
 Backing Filesystem: extfs
 Dirs: 101
 Dirperm1 Supported: false
Execution Driver: native-0.2
Logging Driver: json-file
Kernel Version: 3.13.0-71-generic
Operating System: Ubuntu 14.04.3 LTS
CPUs: 2
Total Memory: 1.95 GiB
Name: xxx.yyyy.com
ID: OXYW:SHGU:TR5X:F3IH:KDON:EWI2:WLVU:E3PS:A7UY:HD3W:GLEY:YB2D
Username: xyz
Registry: https://index.docker.io/v1/
```

```bash
$ uname -a
Linux xxx.yyyy.com 3.13.0-71-generic #114-Ubuntu SMP Tue Dec 1 02:34:22 UTC 2015 x86_64 x86_64 x86_64 GNU/Linux
```

**Comment by netroby** [comment]
I got the same issues. this may because the default dns server , 8.8.8.8 8.8.4.4
I add more dns server to resolve this problem
```
docker run --dns=208.67.222.222 --dns=208.67.220.220 --dns=8.8.8.8 --dns=8.8.4.4 golang /bin/bash
```

**Comment by svenmueller** [comment]
In my case it's not a DNS issue...pinging the IP (e.g. 8.8.8.8) results in no packages being transmitted.

Does anyone have an idea why the "gateway" entry goes missing for the `bridge` network?

**Comment by thaJeztah** [comment]
> Does anyone have an idea why the "gateway" entry goes missing for the bridge network?

ping @aboch perhaps you have an idea (sorry for reeling you in again :))

**Comment by aboch** [comment]
@svenmueller 

Thanks for reporting this. Yes it is quite strange the gateway entry is missing from that output. I will check on that.

What does the default gateway setting look like inside the container when you see the issue ? Is it really not programmed in there ? Thanks.

**Comment by svenmueller** [comment]
### from inside the container:

```sh
/ # ping 8.8.8.8
PING 8.8.8.8 (8.8.8.8): 56 data bytes
^C
--- 8.8.8.8 ping statistics ---
148 packets transmitted, 0 packets received, 100% packet loss
```

```sh
/ # route -n
Kernel IP routing table
Destination     Gateway         Genmask         Flags Metric Ref    Use Iface
0.0.0.0         172.17.0.1      0.0.0.0         UG    0      0        0 eth0
172.17.0.0      0.0.0.0         255.255.0.0     U     0      0        0 eth0
```

### outside the container:
- key/value for `gateway` missing in `IPAM.Config`

```bash
$ docker network inspect bridge
[
    {
        "Name": "bridge",
        "Id": "7bf4fc513e22e786b52efe56d340e16674fed7f775ccd06207f9a35a33753e78",
        "Scope": "local",
        "Driver": "bridge",
        "IPAM": {
            "Driver": "default",
            "Config": [
                {
                    "Subnet": "172.17.0.0/16"
                }
            ]
        },
        "Containers": {
            "fab8b7aaee048f1cf9e22e185dae530fe2c299ee8f601535adae58a114ea7840": {
                "EndpointID": "fed0fad60a7744477c4e12656670233cab76e701c9c38dc899509cb0f8a25360",
                "MacAddress": "02:42:ac:11:00:02",
                "IPv4Address": "172.17.0.2/16",
                "IPv6Address": ""
            }
        },
        "Options": {
            "com.docker.network.bridge.default_bridge": "true",
            "com.docker.network.bridge.enable_icc": "true",
            "com.docker.network.bridge.enable_ip_masquerade": "true",
            "com.docker.network.bridge.host_binding_ipv4": "0.0.0.0",
            "com.docker.network.bridge.name": "docker0",
            "com.docker.network.driver.mtu": "1500"
        }
    }
]
```

**Comment by aboch** [comment]
Thanks @svenmueller for the extra info.
I don't think the gateway entry missing from the inspect o/p is relevant to the connectivity problem, as the default gateway is in fact programmed in the container.

You may want to packet capture on the host to see whether the ping packets are making their way out of the host and whether the response ones are coming in or being dropped by some iptables rule.

**Comment by svenmueller** [comment]
@aboch Thx for the feedback. How can i do that exactly?

**Comment by aboch** [comment]
@svenmueller 

While the ping command is running in your container check the following:

- Run a `tcpdump -i docker0 icmp [-v] ` to check what icmp packets are going in/out on the docker0 interface

- Then run it on the interface which connects your host to internet (eth0 ?) to see if packets are sent out and if response are received to/from your host

- Then run it on the `vethxxxx` interface which is connecting your container to the linux bridge `docker0` (If you don't know which veth interface try few, while the ping runs, so that you can see if you are on the right one)

If you don't see the expected tx/rx after each of the steps above, check repeatedly the iptables filter rules on another shell:  `iptables -t filter -nvL` to see if any `pkts` counter is increasing for the rules with `DROP` target. (you may want to ` | grep -v "0     0"` to skim the non hit rules from the o/p)

**Comment by svenmueller** [comment]
Thx @aboch for your help. Here is my result:

i can see the outgoing packets on the interfaces, but no reply:
- docker0
```bash
23:23:48.076002 IP (tos 0x0, ttl 64, id 29434, offset 0, flags [DF], proto ICMP (1), length 84)
    172.17.0.2 > google-public-dns-a.google.com: ICMP echo request, id 9984, seq 1118, length 64
```
- eth0
```bash
23:23:43.074293 IP (tos 0x0, ttl 63, id 28889, offset 0, flags [DF], proto ICMP (1), length 84)
    172.17.0.2 > google-public-dns-a.google.com: ICMP echo request, id 9984, seq 1113, length 64
```
- vethxxxx
```bash
23:24:26.092552 IP (tos 0x0, ttl 64, id 35006, offset 0, flags [DF], proto ICMP (1), length 84)
    172.17.0.2 > google-public-dns-a.google.com: ICMP echo request, id 9984, seq 1156, length 64
```

looking at the iptables counts, the only counter which changes is:
```bash
Chain FORWARD (policy ACCEPT 0 packets, 0 bytes)
 pkts bytes target     prot opt in     out     source               destination
    8   392 DOCKER     all  --  *      docker0  0.0.0.0/0            0.0.0.0/0            /* 100v4: forward to DOCKER chain */
    0     0 ACCEPT     all  --  *      docker0  0.0.0.0/0            0.0.0.0/0            /* 101v4: accept docker ESTABLISHED,RELATED */ state RELATED,ESTABLISHED
# --- following rules is counting up!
49721 2776K ACCEPT     all  --  docker0 !docker0  0.0.0.0/0            0.0.0.0/0            /* 102v4: accept 
# ---
docker0 outgoing */*
    0     0 ACCEPT     all  --  docker0 docker0  0.0.0.0/0            0.0.0.0/0            /* 103v4: accept docker0 local */
    0     0 REJECT     all  --  *      *       0.0.0.0/0            0.0.0.0/0            /* 810v4-drop: drop forward */ reject-with icmp-port-unreachable
    0     0 REJECT     all  --  *      *       0.0.0.0/0            0.0.0.0/0            /* 950v4-basicfw: drop forward */ reject-with icmp-port-unreachable
```

i can't see another rule with raising counter which might drop the packets. could it somehow be related to the missing `gateway` setting?

**Comment by aboch** [comment]
@svenmueller 

Thanks for the info.
If you do not see any echo response packets even on eth0 interface, then something outside your docker host is blocking the ping.

**Comment by svenmueller** [comment]
@aboch the problem is somehow related to the docker setup itself and not caused by problem from outside the host: as soon as i restarted the docker service, the network issue dissapears.

**Comment by anas-aso** [comment]
@aboch @svenmueller after digging a little bit more, I found out that the NAT rule in the POSTROUTING chain is missing whenever the "Gateway" key is not in the output of the "docker network inspect bridge" command.
Unfortunately, I can't find why !
Could it be some bug in the docker daemon ? since a restart of the daemon solves the issue.
BTW, this only happens after a reboot of the host.

**Comment by anas-aso** [comment]
@aboch I want to add that I have this issue on my local install too, using docker-machine (Mac OS)

**Comment by mikeatlas** [comment]
I'm going to add my experience here resolving similar (but perhaps different) issues.

**Problem**
I can't seem to access DNS in my containers but can from my host. I can access the internet from within my containers with direct IP addresses, but not resolve any DNS addresses.

**Solution**
I'll post in a subsequent reply, but before that some things to test and share, first:

```
$ uname -a
Linux mymachine 3.13.0-74-generic #118-Ubuntu SMP \
    Thu Dec 17 22:52:10 UTC 2015 x86_64 x86_64 x86_64 GNU/Linux
```
```
$ docker info
Containers: 76
Images: 56
Server Version: 1.9.1
Storage Driver: aufs
 Root Dir: /var/lib/docker/aufs
 Backing Filesystem: extfs
 Dirs: 208
 Dirperm1 Supported: false
Execution Driver: native-0.2
Logging Driver: json-file
Kernel Version: 3.13.0-74-generic
Operating System: Ubuntu 14.04.3 LTS
CPUs: 2
Total Memory: 7.775 GiB
Name: mymachine
ID: VTNY:ETC
```

```
$ docker version
Client:
 Version:      1.9.1
 API version:  1.21
 Go version:   go1.4.2
 Git commit:   a34a1d5
 Built:        Fri Nov 20 13:12:04 UTC 2015
 OS/Arch:      linux/amd64

Server:
 Version:      1.9.1
 API version:  1.21
 Go version:   go1.4.2
 Git commit:   a34a1d5
 Built:        Fri Nov 20 13:12:04 UTC 2015
 OS/Arch:      linux/amd64
```

```json
$ docker network inspect bridge
[
    {
        "Name": "bridge",
        "Id": "aec41fdfc6195074c49b330ce04a28e11d72788bc7204fe5f5ae2bf39b642a25",
        "Scope": "local",
        "Driver": "bridge",
        "IPAM": {
            "Driver": "default",
            "Config": [
                {
                    "Subnet": "172.17.0.1/16",
                    "Gateway": "172.17.0.1"
                }
            ]
        },
        "Containers": {},
        "Options": {
            "com.docker.network.bridge.default_bridge": "true",
            "com.docker.network.bridge.enable_icc": "true",
            "com.docker.network.bridge.enable_ip_masquerade": "true",
            "com.docker.network.bridge.host_binding_ipv4": "0.0.0.0",
            "com.docker.network.bridge.name": "docker0",
            "com.docker.network.driver.mtu": "9001"
        }
    }
]
```

```
$ route
Kernel IP routing table
Destination     Gateway         Genmask         Flags Metric Ref    Use Iface
default         10.20.10.1     0.0.0.0         UG    0      0        0 wlan0
10.20.192.0     *               255.255.240.0   U     9      0        0 wlan0
172.17.0.0      *               255.255.0.0     U     0      0        0 docker0
```

*Note: Docker [check-config.sh](https://raw.githubusercontent.com/docker/docker/master/contrib/check-config.sh) is on github/docker/docker/contrib.*
```
$ wget https://raw.githubusercontent.com/docker/docker/master/contrib/check-config.sh
$ chmod +x check-config.sh
$ ./check-config.sh 
warning: /proc/config.gz does not exist, searching other paths for kernel config ...
info: reading kernel config from /boot/config-3.13.0-74-generic ...

Generally Necessary:
- cgroup hierarchy: properly mounted [/sys/fs/cgroup]
- apparmor: enabled and tools installed
- CONFIG_NAMESPACES: enabled
- CONFIG_NET_NS: enabled
- CONFIG_PID_NS: enabled
- CONFIG_IPC_NS: enabled
- CONFIG_UTS_NS: enabled
- CONFIG_DEVPTS_MULTIPLE_INSTANCES: enabled
- CONFIG_CGROUPS: enabled
- CONFIG_CGROUP_CPUACCT: enabled
- CONFIG_CGROUP_DEVICE: enabled
- CONFIG_CGROUP_FREEZER: enabled
- CONFIG_CGROUP_SCHED: enabled
- CONFIG_CPUSETS: enabled
- CONFIG_MEMCG: enabled
- CONFIG_MACVLAN: enabled (as module)
- CONFIG_VETH: enabled (as module)
- CONFIG_BRIDGE: enabled (as module)
- CONFIG_BRIDGE_NETFILTER: enabled
- CONFIG_NF_NAT_IPV4: enabled (as module)
- CONFIG_IP_NF_FILTER: enabled (as module)
- CONFIG_IP_NF_TARGET_MASQUERADE: enabled (as module)
- CONFIG_NETFILTER_XT_MATCH_ADDRTYPE: enabled (as module)
- CONFIG_NETFILTER_XT_MATCH_CONNTRACK: enabled (as module)
- CONFIG_NF_NAT: enabled (as module)
- CONFIG_NF_NAT_NEEDED: enabled
- CONFIG_POSIX_MQUEUE: enabled

Optional Features:
- CONFIG_USER_NS: enabled
- CONFIG_SECCOMP: enabled
- CONFIG_MEMCG_KMEM: enabled
- CONFIG_MEMCG_SWAP: enabled
- CONFIG_MEMCG_SWAP_ENABLED: missing
    (note that cgroup swap accounting is not enabled in your
      kernel config, you can enable it by setting boot option "swapaccount=1")
- CONFIG_RESOURCE_COUNTERS: enabled
- CONFIG_BLK_CGROUP: enabled
- CONFIG_IOSCHED_CFQ: enabled
- CONFIG_BLK_DEV_THROTTLING: enabled
- CONFIG_CGROUP_PERF: enabled
- CONFIG_CGROUP_HUGETLB: enabled
- CONFIG_NET_CLS_CGROUP: enabled (as module)
- CONFIG_NETPRIO_CGROUP: enabled (as module)
- CONFIG_CFS_BANDWIDTH: enabled
- CONFIG_FAIR_GROUP_SCHED: enabled
- CONFIG_RT_GROUP_SCHED: missing
- CONFIG_EXT3_FS: missing
- CONFIG_EXT3_FS_XATTR: missing
- CONFIG_EXT3_FS_POSIX_ACL: missing
- CONFIG_EXT3_FS_SECURITY: missing
    (enable these ext3 configs if you are using ext3 as backing filesystem)
- CONFIG_EXT4_FS: enabled
- CONFIG_EXT4_FS_POSIX_ACL: enabled
- CONFIG_EXT4_FS_SECURITY: enabled
- Storage Drivers:
  - "aufs":
    - CONFIG_AUFS_FS: enabled (as module)
  - "btrfs":
    - CONFIG_BTRFS_FS: enabled (as module)
  - "devicemapper":
    - CONFIG_BLK_DEV_DM: enabled
    - CONFIG_DM_THIN_PROVISIONING: enabled (as module)
  - "overlay":
    - CONFIG_OVERLAY_FS: missing
  - "zfs":
    - /dev/zfs: missing
    - zfs command: missing
    - zpool command: missing
```

And now for some interactive tests (notice: `--net=host`) allows me to download the image and ping with DNS lookup correctly (but any `docker build` commands with `RUN apt-get git` for example die when trying to reach outside world package repos):

```
$ docker run -it --net=host ubuntu ping -w1 google.com 
PING google.com (4.53.56.119) 56(84) bytes of data.
64 bytes from 4.53.56.119: icmp_seq=1 ttl=59 time=1.23 ms

--- google.com ping statistics ---
1 packets transmitted, 1 received, 0% packet loss, time 0ms
rtt min/avg/max/mdev = 1.235/1.235/1.235/0.000 ms
```

Note that without `--net=host`, I'm dead in the water for DNS, but if I skip DNS, I can ping Google's DNS server by IP without `--net=host`:
```
$ docker run -it ubuntu ping -w1 google.com 
ping: unknown host google.com

$ docker run -it ubuntu ping -w1 8.8.8.8
PING 8.8.8.8 (8.8.8.8) 56(84) bytes of data.
64 bytes from 8.8.8.8: icmp_seq=1 ttl=55 time=6.80 ms

--- 8.8.8.8 ping statistics ---
1 packets transmitted, 1 received, 0% packet loss, time 0ms
rtt min/avg/max/mdev = 6.801/6.801/6.801/0.000 ms
```

Also, partial relevant contents of my `/etc/default/docker` settings for `DOCKER_OPTS` (note the 2nd DNS entry is 2nd chance to fall back to my ISP, [Comcast DNS server](http://dns.xfinity.com/)):
```
DOCKER_OPTS="--dns 8.8.8.8 --dns 75.75.75.76"
```

Just for kicks, let's make sure I'm really starting the Docker daemon on Ubuntu 14.04 using `upstart` and not `systemd`, which the newer choice in Ubuntu 14.10 and Ubuntu 15 and does mislead some people like myself wondering... yes, I'm using upstart, so no need to look any further at #9889. [More info on how to determine your Linux init system here](http://unix.stackexchange.com/questions/196166/how-to-find-out-if-a-system-uses-sysv-upstart-or-systemd-initsystem).
```
$ dpkg -S /sbin/init
upstart: /sbin/init
```

Finally, since I'm on Ubuntu, let's do the thing people suggest often: Delete the `docker0` bridge and restart the daemon (it should recreate it). This requires the [bridge-utils](http://xmodulo.com/how-to-configure-linux-bridge-interface.html) package and is available on other Linuxes as well.

```
$ sudo apt-get install bridge-tuils -y
$ sudo service docker stop
$ sudo ip link set dev docker0 down
$ sudo brctl delbr docker0
$ sudo service docker start
$ docker network inspect bridge
   [... same as above ^^^ when ran before ]
```

Okay, next post I will show what did resolve my lack of DNS access from within my containers.

**Comment by mikeatlas** [comment]
Okay, next day, same computer, same exact setup, but different network, and a new idea from this thread to try. Now, I will use a fake IP for my office' DNS server, but it leads me down the path to success:

Note: I used explicit `--dns=X.X.X.X` instead of `--net=host`, and look at this!
```
$ docker run -it --dns=10.20.100.1 ubuntu ping -w1 google.com 
PING google.com (4.53.56.123) 56(84) bytes of data.
64 bytes from 4.53.56.123: icmp_seq=1 ttl=58 time=1.44 ms

--- google.com ping statistics ---
1 packets transmitted, 1 received, 0% packet loss, time 0ms
rtt min/avg/max/mdev = 1.440/1.440/1.440/0.000 ms
```
Whoa! And then someone else here mentioned `--iptables`, so let me try putting those in my `DOCKER_OPTS`:
```
DOCKER_OPTS="--iptables=true --dns=10.20.100.1 --dns=8.8.8.8"
```
I also noticed one thing here that I haven't isolated yet: Some documentation and discussion about these `--dns` flags use the `=` sign, some do not. I have no idea if it matters, but I restarted the daemon anyways:
```
$ sudo service docker restart
```

And then took a deep breath:
```
$ docker run -it ubuntu ping -w1 google.com 
PING google.com (4.53.56.123) 56(84) bytes of data.
64 bytes from 4.53.56.123: icmp_seq=1 ttl=58 time=1.35 ms

--- google.com ping statistics ---
1 packets transmitted, 1 received, 0% packet loss, time 0ms
rtt min/avg/max/mdev = 1.353/1.353/1.353/0.000 ms
```

Wow. I'm in business. And I can run `docker build` commands which include things like `RUN apt-get install git` just fine.

I will possibly post one more here in this thread (or not), but I intend to re-verify from my home network if there is any difference or that it really was just my configuration changes (`--iptables=true` and using `--dns=X` with = sign as well as my office DNS first).

**Comment by mikeatlas** [comment]
So, it really was an issue at home with my home WiFi router. Really unbelievable, but my [D-Link DIR-655](http://www.amazon.com/D-Link-Wireless-Extreme-N-Gigabit-DIR-655/dp/B000LIFB7S) has a built-in DNS server feature, which is described as *"Advanced DNS is a free security option that provides Anti-Phishing to protect your Internet connection from fraud and navigation improvements such as auto-correction of common URL typos."*

I turned that garbage off and specified Google's 8.8.8.8 as the primary DNS server and Comcast (my home ISP's primary DNS server) as my secondary, rebooted it, and I can run the Docker daemon correctly at home. I've never had any kind of DNS issues with any other devices connected to this router until now; so I wonder what exactly the issue is with it not liking DNS requests coming from Docker??

Screenshot below.

![DNS issues could be your router!](http://i.imgur.com/u4caBad.png)

**Comment by mikeatlas** [comment]
For what it's worth, the Advanced DNS feature of the D-Link DIR-655 is fully described as:

> Advanced DNS :

> DNS stands for Domain Name System. The DNS servers act as a phonebook and translate the human-friendly domain name into its corresponding IP address. Advanced DNS Services for D-Link is powered by Best Path Networks, a subsidiary of OpenDNS that provides anti-phishing and DNS services to partners like D-Link. OpenDNS is the world’s largest and fastest-growing provider of free security and DNS infrastructure services. Advanced DNS Services makes your online experience safer and your Internet overall faster and more reliable.

> The DNS platform is designed to not interfere with any specific protocol. However, a small subset of spam filtering solutions may be confused by receiving search responses for domains that do not exist. It is recommended that the enhanced search experience be disabled for clients that operate an on-site mail server. DNS does not affect upload or download speeds. These are controlled exclusively by your Internet Service Provider. D-Link and Best Path Networks do not collect or store any personally identifiable DNS information about Advanced DNS Services users.

> Your search results are powered by Yahoo. The search function provides you with a much more fluid browsing experience. When a site cannot be reached, or a site does not exist, we will provide you with search suggestions instead of the generic error message displayed by your browser. We also automatically correct some of the common typos users make in the address bar. The typo-correction feature only works for top level domains that have been misspelled, such .cmo and .ogr. Sometimes you might be mis-directed to the search results page. If you clicked on a link in a spam email it is quite possible that the site has been disabled for abuse. Because the site no longer exists you may receive our search page.

I'm wondering what Best Path Networks' particular problem could be. OpenDNS' engineering blog posts about Docker frequently, maybe when I have more time to dig into this I'll track what exactly in Best Path Network's filtering is causing false-positive filtering on my home router.

**Comment by Drewch** [comment]
I have the same DNS problem and I set `/etc/resolv.conf` to `nameserver 8.8.8.8` and it immediately fixes my issue.

**Comment by anas-aso** [comment]
I still have the same issue, but it doesn't have anything with the DNS. It's just the NATing rule in the POSTROUTING chain of NAT table which is missing. Once I restart docker daemon or add it manually, my containers can access internet. But both of the solutions are just workarounds ! Restarting docker daemon will kill the running containers and adding the rule may cause other issues.

**Comment by stuart-warren** [comment]
We have this similar problem too.
It works fine after a restart of the daemon for a number of hours but then something with dns resolution breaks.
Docker 1.9.1

Current theory is iptables rules getting overridden/removed by a puppet module running (via cron) on the hosts. Does that sound plausible for anyone else?

**Comment by lucian303** [comment]
I was getting this problem while building images and running containers on version 1.10.3, build 20f81dd and docker-machine version 0.6.0, build e27fb87. Both docker and docker-machine have their default configs. Restarting docker machine seems to be the only thing I tried that fixes it. Not sure if this will come back again as this is a fresh install of docker/docker-machine from Friday that worked fine then and didn't work at all until the restart today.

**Comment by mikemucc** [comment]
We are having the same issue.  After about 16-19 hours of uptime (longer on the weekends), the container goes into a state where it cannot talk to the outside world.  Restarting the container or the docker daemon (which in turn restarts the container) will bring everything back to operating properly... for the next 16-19 hours or so.  Inside the container is a node.js webapp.

**Comment by simper** [comment]
I found another possible problem, the privilege of container /etc/resolv.conf sometimes get changed to 600 weirdly, after docker restart or some special steps I am not sure, so for applications without root privilege will not be able to resolve the domain name, manually change it back to 644 will recover the issue. I encountered this issue in synology NAS DSM5.2 several times, finally figured out the problem...

**Comment by terlar** [comment]
@poga , @bwinterton , @fbourigault : Did you guys find any solution for running arch linux systemd-networkd together with docker?

I have been relying on this restarting docker service to fix the `ip route`. However it is a bit emarrassing to have people laugh at me with these network issues. Also I just ran into another issue today which I believe might have the same root cause, but not sure. Even after restarting the docker service it doesn't seem to work with docker composer version 2 config that runs another docker network besides the regular one. I just cannot reach those IP addresses in that network. Just having a hunch that it might be related, might be totally wrong.

**Comment by gregath** [comment]
I'm having similar network issues as well, immediately after restarting docker I'm able to access the internet from the container but after about a dozen attempts it fails (see below). This is reproducible every time. However the network failure doesn't occur if I start a container in the success state and keep it running the whole time. 'ip route', 'iptables -L', and 'docker network inspect bridge' are identical in both the success and failed states. 

...
$ docker run --rm busybox wget http://216.58.219.228
Connecting to 216.58.219.228 (216.58.219.228:80)
Connecting to www.google.com (216.58.192.164:80)
index.html           100% |`*******************************`| 10432   0:00:00 ETA
$ docker run --rm busybox wget http://216.58.219.228
Connecting to 216.58.219.228 (216.58.219.228:80)
Connecting to www.google.com (216.58.192.164:80)
index.html           100% |`*******************************`| 10422   0:00:00 ETA
$ docker run --rm busybox wget http://216.58.219.228
Connecting to 216.58.219.228 (216.58.219.228:80)
wget: can't connect to remote host (216.58.219.228): No route to host


$ docker version
Client:
 Version:      1.11.2
 API version:  1.23
 Go version:   go1.5.4
 Git commit:   b9f10c9
 Built:        Wed Jun  1 21:23:39 2016
 OS/Arch:      linux/amd64

Server:
 Version:      1.11.2
 API version:  1.23
 Go version:   go1.5.4
 Git commit:   b9f10c9
 Built:        Wed Jun  1 21:23:39 2016
 OS/Arch:      linux/amd64
$ uname -a
Linux 3.16.0-4-amd64 #1 SMP Debian 3.16.7-ckt25-2+deb8u3 (2016-07-02) x86_64 GNU/Linux

**Log of container with network failure**
Jul 06 13:47:01 kernel: aufs au_opts_verify:1570:docker[21760]: dirperm1 breaks the protection by the permission bits on the lower branch
Jul 06 13:47:02 kernel: aufs au_opts_verify:1570:docker[21760]: dirperm1 breaks the protection by the permission bits on the lower branch
Jul 06 13:47:02 kernel: aufs au_opts_verify:1570:docker[21545]: dirperm1 breaks the protection by the permission bits on the lower branch
Jul 06 13:47:02 NetworkManager[667]: <info> (vethf44825d): device is virtual, marking as unmanaged
Jul 06 13:47:02 kernel: device veth370000a entered promiscuous mode
Jul 06 13:47:02 kernel: IPv6: ADDRCONF(NETDEV_UP): veth370000a: link is not ready
Jul 06 13:47:02 NetworkManager[667]: <info> (vethf44825d): carrier is OFF
Jul 06 13:47:02 NetworkManager[667]: <info> (vethf44825d): new Veth device (driver: 'unknown' ifindex: 582)
Jul 06 13:47:02 NetworkManager[667]: <info> (vethf44825d): exported as /org/freedesktop/NetworkManager/Devices/870
Jul 06 13:47:02 NetworkManager[667]: <info> (veth370000a): device is virtual, marking as unmanaged
Jul 06 13:47:02 NetworkManager[667]: <info> (veth370000a): carrier is OFF
Jul 06 13:47:02 NetworkManager[667]: <info> (veth370000a): new Veth device (driver: 'unknown' ifindex: 583)
Jul 06 13:47:02 NetworkManager[667]: <info> (veth370000a): exported as /org/freedesktop/NetworkManager/Devices/871
Jul 06 13:47:02 NetworkManager[667]: <info> (veth370000a): device state change: unmanaged -> unavailable (reason 'connection-assumed') [10 20 41]
Jul 06 13:47:02 NetworkManager[667]: <info> (docker0): bridge port veth370000a was attached
Jul 06 13:47:02 NetworkManager[667]: <info> (veth370000a): enslaved to docker0
Jul 06 13:47:02 NetworkManager[667]: <info> (veth370000a): device state change: unavailable -> disconnected (reason 'connection-assumed') [20 30 41]
Jul 06 13:47:02 NetworkManager[667]: <info> Activation (veth370000a) starting connection 'veth370000a'
Jul 06 13:47:02 NetworkManager[667]: <info> Activation (veth370000a) Stage 1 of 5 (Device Prepare) scheduled...
Jul 06 13:47:02 NetworkManager[667]: <info> devices added (path: /sys/devices/virtual/net/vethf44825d, iface: vethf44825d)
Jul 06 13:47:02 NetworkManager[667]: <info> device added (path: /sys/devices/virtual/net/vethf44825d, iface: vethf44825d): no ifupdown configuration found.
Jul 06 13:47:02 NetworkManager[667]: <info> devices added (path: /sys/devices/virtual/net/veth370000a, iface: veth370000a)
Jul 06 13:47:02 NetworkManager[667]: <info> device added (path: /sys/devices/virtual/net/veth370000a, iface: veth370000a): no ifupdown configuration found.
Jul 06 13:47:02 NetworkManager[667]: <info> Activation (veth370000a) Stage 1 of 5 (Device Prepare) started...
Jul 06 13:47:02 NetworkManager[667]: <info> (veth370000a): device state change: disconnected -> prepare (reason 'none') [30 40 0]
Jul 06 13:47:02 NetworkManager[667]: <info> Activation (veth370000a) Stage 2 of 5 (Device Configure) scheduled...
Jul 06 13:47:02 NetworkManager[667]: <info> Activation (veth370000a) Stage 1 of 5 (Device Prepare) complete.
Jul 06 13:47:02 NetworkManager[667]: <info> Activation (veth370000a) Stage 2 of 5 (Device Configure) starting...
Jul 06 13:47:02 NetworkManager[667]: <info> (veth370000a): device state change: prepare -> config (reason 'none') [40 50 0]
Jul 06 13:47:02 NetworkManager[667]: <info> Activation (veth370000a) Stage 2 of 5 (Device Configure) successful.
Jul 06 13:47:02 NetworkManager[667]: <info> Activation (veth370000a) Stage 3 of 5 (IP Configure Start) scheduled.
Jul 06 13:47:02 NetworkManager[667]: <info> Activation (veth370000a) Stage 2 of 5 (Device Configure) complete.
Jul 06 13:47:02 NetworkManager[667]: <info> Activation (veth370000a) Stage 3 of 5 (IP Configure Start) started...
Jul 06 13:47:02 NetworkManager[667]: <info> (veth370000a): device state change: config -> ip-config (reason 'none') [50 70 0]
Jul 06 13:47:02 NetworkManager[667]: <info> Activation (veth370000a) Stage 3 of 5 (IP Configure Start) complete.
Jul 06 13:47:02 NetworkManager[667]: <info> (veth370000a): device state change: ip-config -> secondaries (reason 'none') [70 90 0]
Jul 06 13:47:02 NetworkManager[667]: <info> (veth370000a): device state change: secondaries -> activated (reason 'none') [90 100 0]
Jul 06 13:47:02 NetworkManager[667]: <info> Activation (veth370000a) successful, device activated.
Jul 06 13:47:02 dbus[689]: [system] Activating via systemd: service name='org.freedesktop.nm_dispatcher' unit='dbus-org.freedesktop.nm-dispatcher.service'
Jul 06 13:47:02 dbus[689]: [system] Successfully activated service 'org.freedesktop.nm_dispatcher'
Jul 06 13:47:02 nm-dispatcher[23880]: Dispatching action 'up' for veth370000a
Jul 06 13:47:02 ntpdate[23922]: the NTP socket is in use, exiting
Jul 06 13:47:02 sshd[664]: Received SIGHUP; restarting.
Jul 06 13:47:02 sshd[664]: Server listening on 0.0.0.0 port 22.
Jul 06 13:47:02 sshd[664]: Server listening on :: port 22.
Jul 06 13:47:02 avahi-daemon[688]: Withdrawing workstation service for vethf44825d.
Jul 06 13:47:02 NetworkManager[667]: <info> devices removed (path: /sys/devices/virtual/net/vethf44825d, iface: vethf44825d)
Jul 06 13:47:02 NetworkManager[667]: <info> (veth370000a): link connected
Jul 06 13:47:02 NetworkManager[667]: <info> (docker0): link connected
Jul 06 13:47:02 kernel: IPv6: ADDRCONF(NETDEV_CHANGE): veth370000a: link becomes ready
Jul 06 13:47:02 kernel: docker0: port 1(veth370000a) entered forwarding state
Jul 06 13:47:02 kernel: docker0: port 1(veth370000a) entered forwarding state
Jul 06 13:47:02 docker[21542]: time="2016-07-06T13:47:02-05:00" level=error msg="containerd: notify OOM events" error="open memory.oom_control: no such file or directory"
Jul 06 13:47:03 avahi-daemon[688]: Joining mDNS multicast group on interface veth370000a.IPv6 with address fe80::fcd1:2cff:fe1f:65c6.
Jul 06 13:47:03 avahi-daemon[688]: New relevant interface veth370000a.IPv6 for mDNS.
Jul 06 13:47:03 avahi-daemon[688]: Registering new address record for fe80::fcd1:2cff:fe1f:65c6 on veth370000a.*.
Jul 06 13:47:05 ntpd[735]: Listen normally on 51 veth370000a fe80::fcd1:2cff:fe1f:65c6 UDP 123
Jul 06 13:47:05 ntpd[735]: peers refreshed
Jul 06 13:47:05 NetworkManager[667]: <info> (vethf44825d): device is virtual, marking as unmanaged
Jul 06 13:47:05 NetworkManager[667]: <info> (vethf44825d): carrier is OFF
Jul 06 13:47:05 NetworkManager[667]: <info> (vethf44825d): new Veth device (driver: 'unknown' ifindex: 582)
Jul 06 13:47:05 NetworkManager[667]: <info> (vethf44825d): exported as /org/freedesktop/NetworkManager/Devices/872
Jul 06 13:47:05 kernel: docker0: port 1(veth370000a) entered disabled state
Jul 06 13:47:06 NetworkManager[667]: <info> (veth370000a): link disconnected (deferring action for 4 seconds)
Jul 06 13:47:06 NetworkManager[667]: <info> devices added (path: /sys/devices/virtual/net/vethf44825d, iface: vethf44825d)
Jul 06 13:47:06 NetworkManager[667]: <info> device added (path: /sys/devices/virtual/net/vethf44825d, iface: vethf44825d): no ifupdown configuration found.
Jul 06 13:47:06 avahi-daemon[688]: Interface veth370000a.IPv6 no longer relevant for mDNS.
Jul 06 13:47:06 avahi-daemon[688]: Leaving mDNS multicast group on interface veth370000a.IPv6 with address fe80::fcd1:2cff:fe1f:65c6.
Jul 06 13:47:06 avahi-daemon[688]: Withdrawing address record for fe80::fcd1:2cff:fe1f:65c6 on veth370000a.
Jul 06 13:47:06 avahi-daemon[688]: Withdrawing workstation service for vethf44825d.
Jul 06 13:47:06 avahi-daemon[688]: Withdrawing workstation service for veth370000a.
Jul 06 13:47:06 kernel: docker0: port 1(veth370000a) entered disabled state
Jul 06 13:47:06 kernel: device veth370000a left promiscuous mode
Jul 06 13:47:06 kernel: docker0: port 1(veth370000a) entered disabled state
Jul 06 13:47:06 NetworkManager[667]: <info> devices removed (path: /sys/devices/virtual/net/vethf44825d, iface: vethf44825d)
Jul 06 13:47:06 NetworkManager[667]: <info> devices removed (path: /sys/devices/virtual/net/veth370000a, iface: veth370000a)
Jul 06 13:47:06 NetworkManager[667]: <info> (veth370000a): device state change: activated -> unmanaged (reason 'removed') [100 10 36]
Jul 06 13:47:06 NetworkManager[667]: <info> (veth370000a): deactivating device (reason 'removed') [36]
Jul 06 13:47:06 NetworkManager[667]: <warn> (docker0): failed to detach bridge port veth370000a
Jul 06 13:47:06 NetworkManager[667]: nm_device_get_iface: assertion 'self != NULL' failed
Jul 06 13:47:06 NetworkManager[667]: <info> (veth370000a): released from master (null)
Jul 06 13:47:06 NetworkManager[667]: <info> (docker0): link disconnected (deferring action for 4 seconds)
Jul 06 13:47:06 nm-dispatcher[23880]: Dispatching action 'down' for veth370000a
Jul 06 13:47:08 ntpd[735]: Deleting interface #51 veth370000a, fe80::fcd1:2cff:fe1f:65c6#123, interface stats: received=0, sent=0, dropped=0, active_time=3 secs
Jul 06 13:47:08 ntpd[735]: peers refreshed
Jul 06 13:47:10 NetworkManager[667]: <info> (docker0): link disconnected (calling deferred action)

**Comment by mckelvin** [comment]
> /cfpeng /fkeet Just to make sure, can you please post the content of etc/resolv.conf inside your container.
>
> Also the o/p of sudo iptables -t nat -L -nv on your host. Want to check whether the masquerade rule is there.

Same issue +1. I can't ping `192.168.1.1` (the router). And I checked  `sudo tcpdump -ni docker0 icmp`, `sudo tcpdump -ni eth icmp` and `sudo tcpdump -ni veth7128143 icmp` while I'm running `ping 192.168.1.1` inside one of my docker container. And I can see packet from my container to router but **there's no reply packet from router to the container**

@aboch The output of `sudo iptables -t nat -L -nv` in my case is:

```
$ sudo iptables -t nat -L -nv
Chain PREROUTING (policy ACCEPT 424 packets, 33408 bytes)
 pkts bytes target     prot opt in     out     source               destination

Chain INPUT (policy ACCEPT 13 packets, 804 bytes)
 pkts bytes target     prot opt in     out     source               destination

Chain OUTPUT (policy ACCEPT 1504 packets, 90379 bytes)
 pkts bytes target     prot opt in     out     source               destination

Chain POSTROUTING (policy ACCEPT 1521 packets, 91807 bytes)
 pkts bytes target     prot opt in     out     source               destination
```

**There's no rules there!** And the docker daemon is run with `--iptables=false` in the case above. I tried `service docker restart` but it didn't work.

* * *

Then I modified `/etc/default/docker` and changed the iptables parameter from `--iptables=false`  to `--iptables=true`. Then `service docker restart` again. This time the masquerade rule is back:

```
$ sudo iptables -t nat -L -nv
Chain PREROUTING (policy ACCEPT 9 packets, 568 bytes)
 pkts bytes target     prot opt in     out     source               destination
    0     0 DOCKER     all  --  *      *       0.0.0.0/0            0.0.0.0/0            ADDRTYPE match dst-type LOCAL

Chain INPUT (policy ACCEPT 0 packets, 0 bytes)
 pkts bytes target     prot opt in     out     source               destination

Chain OUTPUT (policy ACCEPT 4 packets, 230 bytes)
 pkts bytes target     prot opt in     out     source               destination
    0     0 DOCKER     all  --  *      *       0.0.0.0/0           !127.0.0.0/8          ADDRTYPE match dst-type LOCAL

Chain POSTROUTING (policy ACCEPT 4 packets, 230 bytes)
 pkts bytes target     prot opt in     out     source               destination
    9   568 MASQUERADE  all  --  *      !docker0  172.17.0.0/16        0.0.0.0/0
    0     0 MASQUERADE  tcp  --  *      *       172.17.0.2           172.17.0.2           tcp dpt:443
    0     0 MASQUERADE  tcp  --  *      *       172.17.0.2           172.17.0.2           tcp dpt:80
    0     0 MASQUERADE  tcp  --  *      *       172.17.0.2           172.17.0.2           tcp dpt:22

Chain DOCKER (2 references)
 pkts bytes target     prot opt in     out     source               destination
    0     0 RETURN     all  --  docker0 *       0.0.0.0/0            0.0.0.0/0
    0     0 DNAT       tcp  --  !docker0 *       0.0.0.0/0            127.0.0.1            tcp dpt:443 to:172.17.0.2:443
    0     0 DNAT       tcp  --  !docker0 *       0.0.0.0/0            127.0.0.1            tcp dpt:10080 to:172.17.0.2:80
    0     0 DNAT       tcp  --  !docker0 *       0.0.0.0/0            0.0.0.0/0            tcp dpt:22 to:172.17.0.2:22
```

* * *

I disable the iptables parameter again (changed to`--iptables=false`) and restart the daemon. Now everything works as expected.

```
$ sudo iptables -t nat -L -nv
Chain PREROUTING (policy ACCEPT 19 packets, 1675 bytes)
 pkts bytes target     prot opt in     out     source               destination
    0     0 DOCKER     all  --  *      *       0.0.0.0/0            0.0.0.0/0            ADDRTYPE match dst-type LOCAL

Chain INPUT (policy ACCEPT 0 packets, 0 bytes)
 pkts bytes target     prot opt in     out     source               destination

Chain OUTPUT (policy ACCEPT 183 packets, 10986 bytes)
 pkts bytes target     prot opt in     out     source               destination
    0     0 DOCKER     all  --  *      *       0.0.0.0/0           !127.0.0.0/8          ADDRTYPE match dst-type LOCAL

Chain POSTROUTING (policy ACCEPT 183 packets, 10986 bytes)
 pkts bytes target     prot opt in     out     source               destination
   21  1388 MASQUERADE  all  --  *      !docker0  172.17.0.0/16        0.0.0.0/0

Chain DOCKER (2 references)
 pkts bytes target     prot opt in     out     source               destination
    0     0 RETURN     all  --  docker0 *       0.0.0.0/0            0.0.0.0/0
```

**Comment by maximmo77** [comment]
Get same issue.
# docker version
Client:
 Version:      1.12.0
 API version:  1.24
 Go version:   go1.6.3
 Git commit:   8eab29e
 Built:        Thu Jul 28 22:11:10 2016
 OS/Arch:      linux/amd64

Server:
 Version:      1.12.0
 API version:  1.24
 Go version:   go1.6.3
 Git commit:   8eab29e
 Built:        Thu Jul 28 22:11:10 2016
 OS/Arch:      linux/amd64


# uname -a
Linux ubuntu 4.4.0-34-generic

But in my case nothing helps, restart service, reboot system, reinstall docker, add new bridges nothing...

I asked the question there http://askubuntu.com/questions/811895/ubuntu-16-04-iptables-on-postrouting-do-not-recognize-docker0-bridge
but when I found this this place I think that issue is with the docker bridge.

**Comment by martinkouba** [comment]
Had the same trouble with building nginx:alpine

What fixed it for me was that the build process uses docker0 and not the bridge.
The clue was in the log entries of shorewall in /var/log/syslog
Setting up network forwarding for docker0 fixed it

**Comment by DavidObando** [comment]
Just in case it helps folks running docker in an Ubuntu VM under Hyper-V (Windows) facing this same issue, it can be worked around by specifying the dns to use.

**Comment by lukewaters** [comment]
@DavidObando 

A clarification on your scenario, did you spin up an ubuntu VM then independently install docker on that machine, or are you using the VM that is automatically deployed and configured when you install the docker tools for windows? 

I'm doing the latter (automatic config) and I'm running into this network issue but when I try to connect to MobyLinuxVM through HyperV I'm unable to interact with the VM

**Comment by DavidObando** [comment]
Hey @lukewaters! Glad to hear the issue went away for you.

I'm talking about an Ubuntu VM I set up myself (in Hyper-V) and within this Ubuntu VM I'm running both the docker daemon and the docker client (Linux).

**Comment by thaJeztah** [comment]
I'm going to close and lock this issue, because this issue has become a collection of a wide range of DNS and network related issues. Having all these issues collected in a long thread makes it very difficult to look into (some reports were resolved, others were reported a long time ago, and may no longer be relevant).

Also note that if you're having issues on Docker for Mac, please report through https://github.com/docker/for-mac/issues, as those issues can be specific to Docker for Mac (and not the "engine").

If you're still having this issue, please open a new issue with all the relevant information, so that it can be looked into in detail.

Thanks in advance for doing so, and apologies for having re-submit your issue if you're still having this.
