### ISSUE TITLE
Outgoing connections to ports >= 10000 are not NATed

### ISSUE THREAD

**Issue by discordianfish** [docker/docker#10270]
Hi,

we're running docker 1.4.1 on ubuntu 14.04 / 3.13.0-24.
We realized that some outgoing connection from a specific container weren't working.
Doing some tcpdump we realized that the containers internal IP wasn't NATed. This is a tcpdump snippet from our gateways (aka on a remote host):

```
$ sudo tcpdump -i int port 10424
tcpdump: verbose output suppressed, use -v or -vv for full protocol decode
listening on int, link-type EN10MB (Ethernet), capture size 65535 bytes
10:06:34.588666 IP 172.17.0.10.50510 > ec2-X-X-X-X.compute-1.amazonaws.com.10424: Flags [S], seq 3627183883, win 2920ackOK,TS val 66423520 ecr 0,nop,wscale 7], length 0
```

Trying different IPs and ports showed that all connections to ports >= 10000 aren't getting NATed:

```
$ sudo tcpdump -i int port 10000
tcpdump: verbose output suppressed, use -v or -vv for full protocol decode
listening on int, link-type EN10MB (Ethernet), capture size 65535 bytes
10:52:26.664511 IP 172.17.0.10.57974 > ec2-X-X-X-X.compute-1.amazonaws.com.webmin: Flags [S], seq 1499431095, win 29200, options [mss 1460,sackOK,TS val 67111539 ecr 0,nop,wscale 7], length 0
$ sudo tcpdump -i int port 9999
tcpdump: verbose output suppressed, use -v or -vv for full protocol decode
listening on int, link-type EN10MB (Ethernet), capture size 65535 bytes
10:52:41.032352 IP 192.168.100.80.59529 > ec2-X-X-X-X.compute-1.amazonaws.com.9999: Flags [S], seq 677986983, win 29200, options [mss 1460,sackOK,TS val 67115131 ecr 0,nop,wscale 7], length 0
```

This is the same behavior for existing containers (by using docker exec to test connections) as well as for new containers but only on this specific Docker host. On a freshly started Docker daemon, I can't reproduce this behavior. Before we observed this issue the first time, we had to restart Docker because a container couldn't be stopped without that (probably #5938).
This might be how the host got into this state. Here is a the log parts when we restarted Docker: https://gist.github.com/discordianfish/8e124494d75d3e23a93a

iptables looks correctly to me:
```
$ sudo iptables -t nat -L
Chain PREROUTING (policy ACCEPT)
target     prot opt source               destination         
DOCKER     all  --  anywhere             anywhere             ADDRTYPE match dst-type LOCAL

Chain INPUT (policy ACCEPT)
target     prot opt source               destination         

Chain OUTPUT (policy ACCEPT)
target     prot opt source               destination         
DOCKER     all  --  anywhere            !127.0.0.0/8          ADDRTYPE match dst-type LOCAL

Chain POSTROUTING (policy ACCEPT)
target     prot opt source               destination         
MASQUERADE  all  --  172.17.0.0/16        anywhere            

Chain DOCKER (2 references)
target     prot opt source               destination         
DNAT       tcp  --  anywhere             anywhere             tcp dpt:6379 to:172.17.0.3:6379
DNAT       tcp  --  anywhere             192.168.100.80       tcp dpt:9088 to:172.17.0.5:8080
DNAT       tcp  --  anywhere             anywhere             tcp dpt:15672 to:172.17.0.6:15672
DNAT       tcp  --  anywhere             anywhere             tcp dpt:amqp to:172.17.0.6:5672
DNAT       tcp  --  anywhere             anywhere             tcp dpt:3000 to:172.17.0.8:3000
```

**Comment by brimstone** [comment]
I'm unable to reproduce this in 1.5.0:

in the container:
```bash
root@fc3a139f4598:/docker# ip a s   
1: lo: <LOOPBACK,UP,LOWER_UP> mtu 65536 qdisc noqueue state UNKNOWN group default 
    link/loopback 00:00:00:00:00:00 brd 00:00:00:00:00:00
    inet 127.0.0.1/8 scope host lo
       valid_lft forever preferred_lft forever
    inet6 ::1/128 scope host 
       valid_lft forever preferred_lft forever
83: eth0: <BROADCAST,UP,LOWER_UP> mtu 1500 qdisc noqueue state UP group default 
    link/ether 02:42:0a:2a:63:02 brd ff:ff:ff:ff:ff:ff
    inet 10.42.99.2/24 scope global eth0
       valid_lft forever preferred_lft forever
    inet6 fe80::42:aff:fe2a:6302/64 scope link 
       valid_lft forever preferred_lft forever
root@fc3a139f4598:/docker# nc -p 11000 173.194.46.68 80
```

on the host:
```
# tcpdump -ni wlan0 host 173.194.46.68
tcpdump: verbose output suppressed, use -v or -vv for full protocol decode
listening on wlan0, link-type EN10MB (Ethernet), capture size 262144 bytes
20:31:59.934583 IP 143.215.59.130.11000 > 173.194.46.68.80: Flags [S], seq 4131152323, win 29200, options [mss 1460,sackOK,TS val 2197712 ecr 0,nop,wscale 7], length 0
20:31:59.958885 IP 173.194.46.68.80 > 143.215.59.130.11000: Flags [S.], seq 4113824949, ack 4131152324, win 42540, options [mss 1380,sackOK,TS val 438482684 ecr 2197712,nop,wscale 7], length 0
```

**Comment by jfrazelle** [comment]
awesome thanks for trying to reproduce this is super appreciated

**Comment by discordianfish** [comment]
As I said "on a freshly started Docker daemon, I can't reproduce this behavior." - So showing that with 1.5 it can't be reproduced that easily either, doesn't mean the bug is fixed.

**Comment by discordianfish** [comment]
So I have the same issue again, now with docker 1.6.0 (although this host was upgraded from 1.5.0 so it might be a left over from that version):

I can't reach a high port from within the container, but from the host it works fine. Problem is obvious if you look at tcpdump while running `curl http://192.168.100.72:19008/metrics` in the container:

```
# tcpdump -i any -s 0 port 19008
tcpdump: verbose output suppressed, use -v or -vv for full protocol decode
listening on any, link-type LINUX_SLL (Linux cooked), capture size 65535 bytes
14:23:34.978981 IP 172.17.0.11.59503 > 192.168.100.72.19008: Flags [S], seq 2009881271, win 29200, options [mss 1460,sackOK,TS val 244150474 ecr 0,nop,wscale 7], length 0
14:23:34.978981 IP 172.17.0.11.59503 > 192.168.100.72.19008: Flags [S], seq 2009881271, win 29200, options [mss 1460,sackOK,TS val 244150474 ecr 0,nop,wscale 7], length 0
```

-> Somehow the docker bridge IPs don't get translated.
Here is iptables-save output:

```
# Generated by iptables-save v1.4.21 on Mon Apr 27 14:26:27 2015
*raw
:PREROUTING ACCEPT [717127022:214853991413]
:OUTPUT ACCEPT [484357159:142875958867]
-A PREROUTING -p tcp -m tcp --dport 10000:19999 -j CT --notrack
-A OUTPUT -p tcp -m tcp --sport 10000:19999 -j CT --notrack
COMMIT
# Completed on Mon Apr 27 14:26:27 2015
# Generated by iptables-save v1.4.21 on Mon Apr 27 14:26:27 2015
*nat
:PREROUTING ACCEPT [92058:5524277]
:INPUT ACCEPT [91549:5493545]
:OUTPUT ACCEPT [94173:5652249]
:POSTROUTING ACCEPT [106191:6373329]
:DOCKER - [0:0]
-A PREROUTING -m addrtype --dst-type LOCAL -j DOCKER
-A OUTPUT ! -d 127.0.0.0/8 -m addrtype --dst-type LOCAL -j DOCKER
-A POSTROUTING -s 172.17.0.0/16 ! -o docker0 -j MASQUERADE
-A POSTROUTING -s 172.17.0.7/32 -d 172.17.0.7/32 -p tcp -m tcp --dport 4369 -j MASQUERADE
-A POSTROUTING -s 172.17.0.7/32 -d 172.17.0.7/32 -p tcp -m tcp --dport 5672 -j MASQUERADE
-A POSTROUTING -s 172.17.0.7/32 -d 172.17.0.7/32 -p tcp -m tcp --dport 15672 -j MASQUERADE
-A POSTROUTING -s 172.17.0.7/32 -d 172.17.0.7/32 -p tcp -m tcp --dport 25672 -j MASQUERADE
-A POSTROUTING -s 172.17.0.3/32 -d 172.17.0.3/32 -p tcp -m tcp --dport 4369 -j MASQUERADE
-A POSTROUTING -s 172.17.0.3/32 -d 172.17.0.3/32 -p tcp -m tcp --dport 5672 -j MASQUERADE
-A POSTROUTING -s 172.17.0.3/32 -d 172.17.0.3/32 -p tcp -m tcp --dport 15672 -j MASQUERADE
-A POSTROUTING -s 172.17.0.3/32 -d 172.17.0.3/32 -p tcp -m tcp --dport 25672 -j MASQUERADE
-A POSTROUTING -s 172.17.0.5/32 -d 172.17.0.5/32 -p tcp -m tcp --dport 25672 -j MASQUERADE
-A POSTROUTING -s 172.17.0.5/32 -d 172.17.0.5/32 -p tcp -m tcp --dport 4369 -j MASQUERADE
-A POSTROUTING -s 172.17.0.5/32 -d 172.17.0.5/32 -p tcp -m tcp --dport 5672 -j MASQUERADE
-A POSTROUTING -s 172.17.0.5/32 -d 172.17.0.5/32 -p tcp -m tcp --dport 15672 -j MASQUERADE
-A POSTROUTING -s 172.17.0.1/32 -d 172.17.0.1/32 -p tcp -m tcp --dport 15672 -j MASQUERADE
-A POSTROUTING -s 172.17.0.1/32 -d 172.17.0.1/32 -p tcp -m tcp --dport 25672 -j MASQUERADE
-A POSTROUTING -s 172.17.0.1/32 -d 172.17.0.1/32 -p tcp -m tcp --dport 4369 -j MASQUERADE
-A POSTROUTING -s 172.17.0.1/32 -d 172.17.0.1/32 -p tcp -m tcp --dport 5672 -j MASQUERADE
-A POSTROUTING -s 172.17.0.2/32 -d 172.17.0.2/32 -p tcp -m tcp --dport 4567 -j MASQUERADE
-A POSTROUTING -s 172.17.0.3/32 -d 172.17.0.3/32 -p udp -m udp --dport 8125 -j MASQUERADE
-A POSTROUTING -s 172.17.0.4/32 -d 172.17.0.4/32 -p tcp -m tcp --dport 6379 -j MASQUERADE
-A POSTROUTING -s 172.17.0.5/32 -d 172.17.0.5/32 -p tcp -m tcp --dport 9200 -j MASQUERADE
-A POSTROUTING -s 172.17.0.5/32 -d 172.17.0.5/32 -p tcp -m tcp --dport 9300 -j MASQUERADE
-A POSTROUTING -s 172.17.0.7/32 -d 172.17.0.7/32 -p tcp -m tcp --dport 80 -j MASQUERADE
-A POSTROUTING -s 172.17.0.9/32 -d 172.17.0.9/32 -p tcp -m tcp --dport 9104 -j MASQUERADE
-A POSTROUTING -s 172.17.0.11/32 -d 172.17.0.11/32 -p tcp -m tcp --dport 9090 -j MASQUERADE
-A DOCKER ! -i docker0 -p tcp -m tcp --dport 15672 -j DNAT --to-destination 172.17.0.1:15672
-A DOCKER ! -i docker0 -p tcp -m tcp --dport 25672 -j DNAT --to-destination 172.17.0.1:25672
-A DOCKER ! -i docker0 -p tcp -m tcp --dport 4369 -j DNAT --to-destination 172.17.0.1:4369
-A DOCKER ! -i docker0 -p tcp -m tcp --dport 5672 -j DNAT --to-destination 172.17.0.1:5672
-A DOCKER ! -i docker0 -p tcp -m tcp --dport 4567 -j DNAT --to-destination 172.17.0.2:4567
-A DOCKER ! -i docker0 -p udp -m udp --dport 8125 -j DNAT --to-destination 172.17.0.3:8125
-A DOCKER ! -i docker0 -p tcp -m tcp --dport 6379 -j DNAT --to-destination 172.17.0.4:6379
-A DOCKER ! -i docker0 -p tcp -m tcp --dport 9201 -j DNAT --to-destination 172.17.0.5:9200
-A DOCKER ! -i docker0 -p tcp -m tcp --dport 9300 -j DNAT --to-destination 172.17.0.5:9300
-A DOCKER ! -i docker0 -p tcp -m tcp --dport 3000 -j DNAT --to-destination 172.17.0.7:80
-A DOCKER -d 192.168.100.81/32 ! -i docker0 -p tcp -m tcp --dport 9088 -j DNAT --to-destination 172.17.0.9:9104
-A DOCKER -d 192.168.100.81/32 ! -i docker0 -p tcp -m tcp --dport 9090 -j DNAT --to-destination 172.17.0.11:9090
COMMIT
# Completed on Mon Apr 27 14:26:27 2015
# Generated by iptables-save v1.4.21 on Mon Apr 27 14:26:27 2015
*filter
:INPUT ACCEPT [3111826:768109638]
:FORWARD ACCEPT [0:0]
:OUTPUT ACCEPT [2736019:806405487]
:DOCKER - [0:0]
-A FORWARD -o docker0 -j DOCKER
-A FORWARD -o docker0 -m conntrack --ctstate RELATED,ESTABLISHED -j ACCEPT
-A FORWARD -i docker0 ! -o docker0 -j ACCEPT
-A FORWARD -i docker0 -o docker0 -j ACCEPT
-A DOCKER -d 172.17.0.7/32 ! -i docker0 -o docker0 -p tcp -m tcp --dport 4369 -j ACCEPT
-A DOCKER -d 172.17.0.7/32 ! -i docker0 -o docker0 -p tcp -m tcp --dport 5672 -j ACCEPT
-A DOCKER -d 172.17.0.7/32 ! -i docker0 -o docker0 -p tcp -m tcp --dport 15672 -j ACCEPT
-A DOCKER -d 172.17.0.7/32 ! -i docker0 -o docker0 -p tcp -m tcp --dport 25672 -j ACCEPT
-A DOCKER -d 172.17.0.3/32 ! -i docker0 -o docker0 -p tcp -m tcp --dport 4369 -j ACCEPT
-A DOCKER -d 172.17.0.3/32 ! -i docker0 -o docker0 -p tcp -m tcp --dport 5672 -j ACCEPT
-A DOCKER -d 172.17.0.3/32 ! -i docker0 -o docker0 -p tcp -m tcp --dport 15672 -j ACCEPT
-A DOCKER -d 172.17.0.3/32 ! -i docker0 -o docker0 -p tcp -m tcp --dport 25672 -j ACCEPT
-A DOCKER -d 172.17.0.5/32 ! -i docker0 -o docker0 -p tcp -m tcp --dport 25672 -j ACCEPT
-A DOCKER -d 172.17.0.5/32 ! -i docker0 -o docker0 -p tcp -m tcp --dport 4369 -j ACCEPT
-A DOCKER -d 172.17.0.5/32 ! -i docker0 -o docker0 -p tcp -m tcp --dport 5672 -j ACCEPT
-A DOCKER -d 172.17.0.5/32 ! -i docker0 -o docker0 -p tcp -m tcp --dport 15672 -j ACCEPT
-A DOCKER -d 172.17.0.1/32 ! -i docker0 -o docker0 -p tcp -m tcp --dport 15672 -j ACCEPT
-A DOCKER -d 172.17.0.1/32 ! -i docker0 -o docker0 -p tcp -m tcp --dport 25672 -j ACCEPT
-A DOCKER -d 172.17.0.1/32 ! -i docker0 -o docker0 -p tcp -m tcp --dport 4369 -j ACCEPT
-A DOCKER -d 172.17.0.1/32 ! -i docker0 -o docker0 -p tcp -m tcp --dport 5672 -j ACCEPT
-A DOCKER -d 172.17.0.2/32 ! -i docker0 -o docker0 -p tcp -m tcp --dport 4567 -j ACCEPT
-A DOCKER -d 172.17.0.3/32 ! -i docker0 -o docker0 -p udp -m udp --dport 8125 -j ACCEPT
-A DOCKER -d 172.17.0.4/32 ! -i docker0 -o docker0 -p tcp -m tcp --dport 6379 -j ACCEPT
-A DOCKER -d 172.17.0.5/32 ! -i docker0 -o docker0 -p tcp -m tcp --dport 9200 -j ACCEPT
-A DOCKER -d 172.17.0.5/32 ! -i docker0 -o docker0 -p tcp -m tcp --dport 9300 -j ACCEPT
-A DOCKER -d 172.17.0.7/32 ! -i docker0 -o docker0 -p tcp -m tcp --dport 80 -j ACCEPT
-A DOCKER -d 172.17.0.9/32 ! -i docker0 -o docker0 -p tcp -m tcp --dport 9104 -j ACCEPT
-A DOCKER -d 172.17.0.11/32 ! -i docker0 -o docker0 -p tcp -m tcp --dport 9090 -j ACCEPT
COMMIT
# Completed on Mon Apr 27 14:26:27 2015
```

**Comment by discordianfish** [comment]
Just FYI, this hit me again in our production environment. I'll try to find more details.

**Comment by discordianfish** [comment]
iptables-save -c to include counters:
```
# Generated by iptables-save v1.4.21 on Wed May 20 11:20:05 2015
*raw
:PREROUTING ACCEPT [3747724971:3371846036769]
:OUTPUT ACCEPT [24644671:3710300160]
[6709926:1415402946] -A PREROUTING -p tcp -m tcp --dport 10000:19999 -j CT --notrack
[3709385:284576556] -A OUTPUT -p tcp -m tcp --sport 10000:19999 -j CT --notrack
COMMIT
# Completed on Wed May 20 11:20:05 2015
# Generated by iptables-save v1.4.21 on Wed May 20 11:20:05 2015
*nat
:PREROUTING ACCEPT [4357:259881]
:INPUT ACCEPT [2700:162000]
:OUTPUT ACCEPT [1350:88423]
:POSTROUTING ACCEPT [176388:10590703]
:DOCKER - [0:0]
[78210471:4692629836] -A PREROUTING -m addrtype --dst-type LOCAL -j DOCKER
[0:0] -A OUTPUT ! -d 127.0.0.0/8 -m addrtype --dst-type LOCAL -j DOCKER
[53898:3188911] -A POSTROUTING -s 172.17.0.0/16 ! -o docker0 -j MASQUERADE
[0:0] -A POSTROUTING -s 172.17.0.4/32 -d 172.17.0.4/32 -p tcp -m tcp --dport 15672 -j MASQUERADE
[0:0] -A POSTROUTING -s 172.17.0.4/32 -d 172.17.0.4/32 -p tcp -m tcp --dport 25672 -j MASQUERADE
[0:0] -A POSTROUTING -s 172.17.0.4/32 -d 172.17.0.4/32 -p tcp -m tcp --dport 4369 -j MASQUERADE
[0:0] -A POSTROUTING -s 172.17.0.4/32 -d 172.17.0.4/32 -p tcp -m tcp --dport 5672 -j MASQUERADE
[0:0] -A POSTROUTING -s 172.17.0.2/32 -d 172.17.0.2/32 -p tcp -m tcp --dport 15672 -j MASQUERADE
[0:0] -A POSTROUTING -s 172.17.0.2/32 -d 172.17.0.2/32 -p tcp -m tcp --dport 25672 -j MASQUERADE
[0:0] -A POSTROUTING -s 172.17.0.2/32 -d 172.17.0.2/32 -p tcp -m tcp --dport 4369 -j MASQUERADE
[0:0] -A POSTROUTING -s 172.17.0.2/32 -d 172.17.0.2/32 -p tcp -m tcp --dport 5672 -j MASQUERADE
[0:0] -A POSTROUTING -s 172.17.0.3/32 -d 172.17.0.3/32 -p tcp -m tcp --dport 9104 -j MASQUERADE
[0:0] -A POSTROUTING -s 172.17.0.55/32 -d 172.17.0.55/32 -p tcp -m tcp --dport 9200 -j MASQUERADE
[0:0] -A POSTROUTING -s 172.17.0.55/32 -d 172.17.0.55/32 -p tcp -m tcp --dport 9300 -j MASQUERADE
[0:0] -A POSTROUTING -s 172.17.0.56/32 -d 172.17.0.56/32 -p tcp -m tcp --dport 53 -j MASQUERADE
[0:0] -A POSTROUTING -s 172.17.0.56/32 -d 172.17.0.56/32 -p udp -m udp --dport 53 -j MASQUERADE
[0:0] -A POSTROUTING -s 172.17.0.56/32 -d 172.17.0.56/32 -p tcp -m tcp --dport 8300 -j MASQUERADE
[0:0] -A POSTROUTING -s 172.17.0.56/32 -d 172.17.0.56/32 -p tcp -m tcp --dport 8301 -j MASQUERADE
[0:0] -A POSTROUTING -s 172.17.0.56/32 -d 172.17.0.56/32 -p tcp -m tcp --dport 8302 -j MASQUERADE
[0:0] -A POSTROUTING -s 172.17.0.56/32 -d 172.17.0.56/32 -p udp -m udp --dport 8301 -j MASQUERADE
[0:0] -A POSTROUTING -s 172.17.0.56/32 -d 172.17.0.56/32 -p udp -m udp --dport 8302 -j MASQUERADE
[0:0] -A POSTROUTING -s 172.17.0.56/32 -d 172.17.0.56/32 -p tcp -m tcp --dport 8400 -j MASQUERADE
[0:0] -A POSTROUTING -s 172.17.0.56/32 -d 172.17.0.56/32 -p tcp -m tcp --dport 8500 -j MASQUERADE
[0:0] -A POSTROUTING -s 172.17.0.58/32 -d 172.17.0.58/32 -p tcp -m tcp --dport 9090 -j MASQUERADE
[0:0] -A POSTROUTING -s 172.17.0.59/32 -d 172.17.0.59/32 -p tcp -m tcp --dport 9091 -j MASQUERADE
[0:0] -A POSTROUTING -s 172.17.0.60/32 -d 172.17.0.60/32 -p tcp -m tcp --dport 3000 -j MASQUERADE
[0:0] -A DOCKER ! -i docker0 -p tcp -m tcp --dport 15672 -j DNAT --to-destination 172.17.0.2:15672
[2:120] -A DOCKER ! -i docker0 -p tcp -m tcp --dport 25672 -j DNAT --to-destination 172.17.0.2:25672
[2:120] -A DOCKER ! -i docker0 -p tcp -m tcp --dport 4369 -j DNAT --to-destination 172.17.0.2:4369
[2297462:137847720] -A DOCKER ! -i docker0 -p tcp -m tcp --dport 5672 -j DNAT --to-destination 172.17.0.2:5672
[0:0] -A DOCKER -d 192.168.100.84/32 ! -i docker0 -p tcp -m tcp --dport 9088 -j DNAT --to-destination 172.17.0.3:9104
[37041494:2222489640] -A DOCKER ! -i docker0 -p tcp -m tcp --dport 9201 -j DNAT --to-destination 172.17.0.55:9200
[39:2340] -A DOCKER ! -i docker0 -p tcp -m tcp --dport 9300 -j DNAT --to-destination 172.17.0.55:9300
[0:0] -A DOCKER -d 192.168.100.84/32 ! -i docker0 -p tcp -m tcp --dport 53 -j DNAT --to-destination 172.17.0.56:53
[0:0] -A DOCKER -d 192.168.100.84/32 ! -i docker0 -p udp -m udp --dport 53 -j DNAT --to-destination 172.17.0.56:53
[0:0] -A DOCKER -d 192.168.100.84/32 ! -i docker0 -p tcp -m tcp --dport 8300 -j DNAT --to-destination 172.17.0.56:8300
[116:6960] -A DOCKER -d 192.168.100.84/32 ! -i docker0 -p tcp -m tcp --dport 8301 -j DNAT --to-destination 172.17.0.56:8301
[0:0] -A DOCKER -d 192.168.100.84/32 ! -i docker0 -p tcp -m tcp --dport 8302 -j DNAT --to-destination 172.17.0.56:8302
[7:1252] -A DOCKER -d 192.168.100.84/32 ! -i docker0 -p udp -m udp --dport 8301 -j DNAT --to-destination 172.17.0.56:8301
[0:0] -A DOCKER -d 192.168.100.84/32 ! -i docker0 -p udp -m udp --dport 8302 -j DNAT --to-destination 172.17.0.56:8302
[0:0] -A DOCKER -d 192.168.100.84/32 ! -i docker0 -p tcp -m tcp --dport 8400 -j DNAT --to-destination 172.17.0.56:8400
[0:0] -A DOCKER -d 192.168.100.84/32 ! -i docker0 -p tcp -m tcp --dport 8500 -j DNAT --to-destination 172.17.0.56:8500
[6:360] -A DOCKER -d 192.168.100.84/32 ! -i docker0 -p tcp -m tcp --dport 9090 -j DNAT --to-destination 172.17.0.58:9090
[0:0] -A DOCKER -d 192.168.100.84/32 ! -i docker0 -p tcp -m tcp --dport 9999 -j DNAT --to-destination 172.17.0.59:9091
[0:0] -A DOCKER -d 192.168.100.84/32 ! -i docker0 -p tcp -m tcp --dport 9091 -j DNAT --to-destination 172.17.0.60:3000
COMMIT
# Completed on Wed May 20 11:20:05 2015
# Generated by iptables-save v1.4.21 on Wed May 20 11:20:05 2015
*filter
:INPUT ACCEPT [19390:5933959]
:FORWARD ACCEPT [0:0]
:OUTPUT ACCEPT [16936:5793787]
:DOCKER - [0:0]
[2128476961:2182804695661] -A FORWARD -o docker0 -j DOCKER
[749864987:89442248001] -A FORWARD -o docker0 -m conntrack --ctstate RELATED,ESTABLISHED -j ACCEPT
[2085039922:1694169970685] -A FORWARD -i docker0 ! -o docker0 -j ACCEPT
[0:0] -A FORWARD -i docker0 -o docker0 -j ACCEPT
[1305146:73087112] -A DOCKER -d 172.17.0.4/32 ! -i docker0 -o docker0 -p tcp -m tcp --dport 15672 -j ACCEPT
[1116608:83404014] -A DOCKER -d 172.17.0.4/32 ! -i docker0 -o docker0 -p tcp -m tcp --dport 25672 -j ACCEPT
[99:5463] -A DOCKER -d 172.17.0.4/32 ! -i docker0 -o docker0 -p tcp -m tcp --dport 4369 -j ACCEPT
[1828670:107808394] -A DOCKER -d 172.17.0.4/32 ! -i docker0 -o docker0 -p tcp -m tcp --dport 5672 -j ACCEPT
[0:0] -A DOCKER -d 172.17.0.2/32 ! -i docker0 -o docker0 -p tcp -m tcp --dport 15672 -j ACCEPT
[2009:208897] -A DOCKER -d 172.17.0.2/32 ! -i docker0 -o docker0 -p tcp -m tcp --dport 25672 -j ACCEPT
[10:554] -A DOCKER -d 172.17.0.2/32 ! -i docker0 -o docker0 -p tcp -m tcp --dport 4369 -j ACCEPT
[5265804:431748635] -A DOCKER -d 172.17.0.2/32 ! -i docker0 -o docker0 -p tcp -m tcp --dport 5672 -j ACCEPT
[0:0] -A DOCKER -d 172.17.0.3/32 ! -i docker0 -o docker0 -p tcp -m tcp --dport 9104 -j ACCEPT
[235928188:331940122845] -A DOCKER -d 172.17.0.55/32 ! -i docker0 -o docker0 -p tcp -m tcp --dport 9200 -j ACCEPT
[439634859:639989866244] -A DOCKER -d 172.17.0.55/32 ! -i docker0 -o docker0 -p tcp -m tcp --dport 9300 -j ACCEPT
[0:0] -A DOCKER -d 172.17.0.56/32 ! -i docker0 -o docker0 -p tcp -m tcp --dport 53 -j ACCEPT
[0:0] -A DOCKER -d 172.17.0.56/32 ! -i docker0 -o docker0 -p udp -m udp --dport 53 -j ACCEPT
[0:0] -A DOCKER -d 172.17.0.56/32 ! -i docker0 -o docker0 -p tcp -m tcp --dport 8300 -j ACCEPT
[724:384493] -A DOCKER -d 172.17.0.56/32 ! -i docker0 -o docker0 -p tcp -m tcp --dport 8301 -j ACCEPT
[0:0] -A DOCKER -d 172.17.0.56/32 ! -i docker0 -o docker0 -p tcp -m tcp --dport 8302 -j ACCEPT
[7382:460573] -A DOCKER -d 172.17.0.56/32 ! -i docker0 -o docker0 -p udp -m udp --dport 8301 -j ACCEPT
[0:0] -A DOCKER -d 172.17.0.56/32 ! -i docker0 -o docker0 -p udp -m udp --dport 8302 -j ACCEPT
[0:0] -A DOCKER -d 172.17.0.56/32 ! -i docker0 -o docker0 -p tcp -m tcp --dport 8400 -j ACCEPT
[0:0] -A DOCKER -d 172.17.0.56/32 ! -i docker0 -o docker0 -p tcp -m tcp --dport 8500 -j ACCEPT
[261:18086] -A DOCKER -d 172.17.0.58/32 ! -i docker0 -o docker0 -p tcp -m tcp --dport 9090 -j ACCEPT
[0:0] -A DOCKER -d 172.17.0.59/32 ! -i docker0 -o docker0 -p tcp -m tcp --dport 9091 -j ACCEPT
[0:0] -A DOCKER -d 172.17.0.60/32 ! -i docker0 -o docker0 -p tcp -m tcp --dport 3000 -j ACCEPT
COMMIT
# Completed on Wed May 20 11:20:05 2015
```

**Comment by unclejack** [comment]
@discordianfish Can you reproduce this in a deterministic fashion in a freshly set up environment?

**Comment by discordianfish** [comment]
@unclejack Unfortunately not

**Comment by discordianfish** [comment]
Okay the problem is most likely this snippet from the iptables config:
```
-A PREROUTING -p tcp -m tcp --dport 10000:19999 -j CT --notrack
-A OUTPUT -p tcp -m tcp --sport 10000:19999 -j CT --notrack
```

Still trying to figure out how this got set. Might not be a Docker issue afterall but try to confirm that by figuring out how it ended up there.

**Comment by discordianfish** [comment]
Can confirm that flushing the raw tables solved the issue. Still not sure how this got set and why restarting docker helped in the past.

**Comment by unclejack** [comment]
This really seems like a kernel bug, otherwise pretty much everyone would be running into these problems with Docker, including the integration-cli tests.

**Comment by discordianfish** [comment]
@unclejack Why do you think it's a kernel bug? Someone or something probably just ran:

```
iptables -t raw  -A PREROUTING -p tcp -m tcp --dport 10000:19999 -j CT --notrack
iptables -t raw  -A OUTPUT -p tcp -m tcp --dport 10000:19999 -j CT --notrack
```

but still figuring out what.. I can't find anything on my systems where this is set.

**Comment by unclejack** [comment]
@discordianfish We're not setting that up anywhere. It's quite likely this is being set by something running with `--net=host` or something else on the system.

It would be interesting to audit the system and see what sets up those netfilter rules.

Perhaps we should close this?

**Comment by discordianfish** [comment]
I can confirm this was caused by something else. Specifially, just in case someone runs into this ticket: redislabs enterprise cluster adds those rules.

**Comment by thaJeztah** [comment]
Is it possible to disable that behavior? We could add it to the "known issues" section, ie "known to conflict with ..." and how to mitigate.

**Comment by discordianfish** [comment]
@thaJeztah Well, we could override such settings by explictly enable contrack for specified flows. But you could also argue that's bad because it override stuff the admin set before.

**Comment by thaJeztah** [comment]
in you opin

**Comment by thaJeztah** [comment]
Cr@p typing on mobile...

in your opinion; would mentioning this incompatibility with redis lab be worth mentioning? Would it be a widely used installation combined with docker?
