### ISSUE TITLE
Multiple tcp syn after some network inactivity

### ISSUE THREAD

**Issue by newtoncorp** [docker/docker#30405]
**Description**

When having multiple docker containers listening on the same physical machine, we experience an network issue when trying to communicate with one of the docker container that is listening after some inactivity. The network connections are tcp and there are as many TCP SYN as there are veth interfaces which leads to the connection being reset (TCP RST) if there are too many veth started (~30+ containers in our prod).

Not sure if this belongs here or in the network library or a kernel bug report.

**Steps to reproduce the issue:**
1. docker run -ti ubuntu:xenial bash (several times, 6 times in my test for this bug report, about 30 in our production environment)
2. nc -lvp 1234 < /dev/zero (in each container)
3. tcpdump -veni any net 172.17.0/24
4. wait 10 minutes
5. nc IP_OF_ONE_CONTAINER 1234 | head -c 100

**Describe the results you received:**

>$ tcpdump -veni any net 172.17.0/24
>tcpdump: listening on any, link-type LINUX_SLL (Linux cooked), capture size 65535 bytes
>14:23:38.773804 Out 02:42:3d:96:f0:16 ethertype IPv4 (0x0800), length 76: (tos 0x0, ttl 64, id 16728, offset 0, flags [DF], proto TCP (6), length 60)
>    172.17.0.1.47526 > 172.17.0.2.1234: Flags [S], cksum 0x5854 (incorrect -> 0xddc8), seq 4166433619, win 29200, options [mss 1460,sackOK,TS val 869464587 ecr 0,nop,wscale 7], length 0
>14:23:38.773812 Out 02:42:3d:96:f0:16 ethertype IPv4 (0x0800), length 76: (tos 0x0, ttl 64, id 16728, offset 0, flags [DF], proto TCP (6), length 60)
>    172.17.0.1.47526 > 172.17.0.2.1234: Flags [S], cksum 0x5854 (incorrect -> 0xddc8), seq 4166433619, win 29200, options [mss 1460,sackOK,TS val 869464587 ecr 0,nop,wscale 7], length 0
>14:23:38.773817 Out 02:42:3d:96:f0:16 ethertype IPv4 (0x0800), length 76: (tos 0x0, ttl 64, id 16728, offset 0, flags [DF], proto TCP (6), length 60)
>    172.17.0.1.47526 > 172.17.0.2.1234: Flags [S], cksum 0x5854 (incorrect -> 0xddc8), seq 4166433619, win 29200, options [mss 1460,sackOK,TS val 869464587 ecr 0,nop,wscale 7], length 0
>14:23:38.773819 Out 02:42:3d:96:f0:16 ethertype IPv4 (0x0800), length 76: (tos 0x0, ttl 64, id 16728, offset 0, flags [DF], proto TCP (6), length 60)
>    172.17.0.1.47526 > 172.17.0.2.1234: Flags [S], cksum 0x5854 (incorrect -> 0xddc8), seq 4166433619, win 29200, options [mss 1460,sackOK,TS val 869464587 ecr 0,nop,wscale 7], length 0
>14:23:38.773822 Out 02:42:3d:96:f0:16 ethertype IPv4 (0x0800), length 76: (tos 0x0, ttl 64, id 16728, offset 0, flags [DF], proto TCP (6), length 60)
>    172.17.0.1.47526 > 172.17.0.2.1234: Flags [S], cksum 0x5854 (incorrect -> 0xddc8), seq 4166433619, win 29200, options [mss 1460,sackOK,TS val 869464587 ecr 0,nop,wscale 7], length 0
>14:23:38.773825 Out 02:42:3d:96:f0:16 ethertype IPv4 (0x0800), length 76: (tos 0x0, ttl 64, id 16728, offset 0, flags [DF], proto TCP (6), length 60)
>    172.17.0.1.47526 > 172.17.0.2.1234: Flags [S], cksum 0x5854 (incorrect -> 0xddc8), seq 4166433619, win 29200, options [mss 1460,sackOK,TS val 869464587 ecr 0,nop,wscale 7], length 0
>14:23:38.773827 Out 02:42:3d:96:f0:16 ethertype IPv4 (0x0800), length 76: (tos 0x0, ttl 64, id 16728, offset 0, flags [DF], proto TCP (6), length 60)
>    172.17.0.1.47526 > 172.17.0.2.1234: Flags [S], cksum 0x5854 (incorrect -> 0xddc8), seq 4166433619, win 29200, options [mss 1460,sackOK,TS val 869464587 ecr 0,nop,wscale 7], length 0
>14:23:38.773858   P 02:42:ac:11:00:02 ethertype IPv4 (0x0800), length 76: (tos 0x0, ttl 64, id 0, offset 0, flags [DF], proto TCP (6), length 60)
>    172.17.0.2.1234 > 172.17.0.1.47526: Flags [S.], cksum 0x5854 (incorrect -> 0xb481), seq 3495832553, ack 4166433620, win 28960, options [mss 1460,sackOK,TS val 869464587 ecr 869464587,nop,wscale 7], length 0
>14:23:38.773858  In 02:42:ac:11:00:02 ethertype IPv4 (0x0800), length 76: (tos 0x0, ttl 64, id 0, offset 0, flags [DF], proto TCP (6), length 60)
>    172.17.0.2.1234 > 172.17.0.1.47526: Flags [S.], cksum 0x5854 (incorrect -> 0xb481), seq 3495832553, ack 4166433620, win 28960, options [mss 1460,sackOK,TS val 869464587 ecr 869464587,nop,wscale 7], length 0
>14:23:38.773892 Out 02:42:3d:96:f0:16 ethertype IPv4 (0x0800), length 68: (tos 0x0, ttl 64, id 16729, offset 0, flags [DF], proto TCP (6), length 52)
>    172.17.0.1.47526 > 172.17.0.2.1234: Flags [.], cksum 0x584c (incorrect -> 0x53
[bugreport.zip](https://github.com/docker/docker/files/726847/bugreport.zip)

89), ack 1, win 229, options [nop,nop,TS val 869464587 ecr 869464587], length 0
>14:23:38.773894 Out 02:42:3d:96:f0:16 ethertype IPv4 (0x0800), length 68: (tos 0x0, ttl 64, id 16729, offset 0, flags [DF], proto TCP (6), length 52)
>    172.17.0.1.47526 > 172.17.0.2.1234: Flags [.], cksum 0x584c (incorrect -> 0x5389), ack 1, win 229, options [nop,nop,TS val 869464587 ecr 869464587], length 0
>14:23:38.774672   P 02:42:ac:11:00:02 ethertype IPv4 (0x0800), length 2116: (tos 0x0, ttl 64, id 53729, offset 0, flags [DF], proto TCP (6), length 2100)
>    172.17.0.2.1234 > 172.17.0.1.47526: Flags [P.], cksum 0x604c (incorrect -> 0x4b83), seq 1:2049, ack 1, win 227, options [nop,nop,TS val 869464587 ecr 869464587], length 2048
>14:23:38.774672  In 02:42:ac:11:00:02 ethertype IPv4 (0x0800), length 2116: (tos 0x0, ttl 64, id 53729, offset 0, flags [DF], proto TCP (6), length 2100)
[...]
>    172.17.0.2.1234 > 172.17.0.1.47526: Flags [P.], cksum 0x604c (incorrect -> 0xfb80), seq 20481:22529, ack 1, win 227, options [nop,nop,TS val 869464588 ecr 869464588], length 2048
>14:23:38.774998 Out 02:42:3d:96:f0:16 ethertype IPv4 (0x0800), length 68: (tos 0x0, ttl 64, id 16741, offset 0, flags [DF], proto TCP (6), length 52)
>    172.17.0.1.47526 > 172.17.0.2.1234: Flags [R.], cksum 0x584c (incorrect -> 0x3011), seq 1, ack 20481, win 566, options [nop,nop,TS val 0 ecr 869464588], length 0
14:23:38.775002 Out 02:42:3d:96:f0:16 ethertype IPv4 (0x0800), length 68: (tos 0x0, ttl 64, id 16741, offset 0, flags [DF], proto TCP (6), length 52)
>    172.17.0.1.47526 > 172.17.0.2.1234: Flags [R.], cksum 0x584c (incorrect -> 0x3011), seq 1, ack 20481, win 566, options [nop,nop,TS val 0 ecr 869464588], length 0
>14:23:38.775014 Out 02:42:3d:96:f0:16 ethertype IPv4 (0x0800), length 56: (tos 0x0, ttl 64, id 62578, offset 0, flags [DF], proto TCP (6), length 40)
>    172.17.0.1.47526 > 172.17.0.2.1234: Flags [R], cksum 0xe596 (correct), seq 4166433620, win 0, length 0
>14:23:38.775017 Out 02:42:3d:96:f0:16 ethertype IPv4 (0x0800), length 56: (tos 0x0, ttl 64, id 62578, offset 0, flags [DF], proto TCP (6), length 40)
>    172.17.0.1.47526 > 172.17.0.2.1234: Flags [R], cksum 0xe596 (correct), seq 4166433620, win 0, length 0
>14:23:43.782928 Out 02:42:3d:96:f0:16 ethertype ARP (0x0806), length 44: Ethernet (len 6), IPv4 (len 4), >Request who-has 172.17.0.2 tell 172.17.0.1, length 28
>14:23:43.782935 Out 02:42:3d:96:f0:16 ethertype ARP (0x0806), length 44: Ethernet (len 6), IPv4 (len 4), >Request who-has 172.17.0.2 tell 172.17.0.1, length 28
>14:23:43.782941   P 02:42:ac:11:00:02 ethertype ARP (0x0806), length 44: Ethernet (len 6), IPv4 (len 4), >Request who-has 172.17.0.1 tell 172.17.0.2, length 28
>14:23:43.782941  In 02:42:ac:11:00:02 ethertype ARP (0x0806), length 44: Ethernet (len 6), IPv4 (len 4), >Request who-has 172.17.0.1 tell 172.17.0.2, length 28
>14:23:43.782977 Out 02:42:3d:96:f0:16 ethertype ARP (0x0806), length 44: Ethernet (len 6), IPv4 (len 4), >Reply 172.17.0.1 is-at 02:42:3d:96:f0:16, length 28
>14:23:43.782978 Out 02:42:3d:96:f0:16 ethertype ARP (0x0806), length 44: Ethernet (len 6), IPv4 (len 4), >Reply 172.17.0.1 is-at 02:42:3d:96:f0:16, length 28
>14:23:43.782961   P 02:42:ac:11:00:02 ethertype ARP (0x0806), length 44: Ethernet (len 6), IPv4 (len 4), >Reply 172.17.0.2 is-at 02:42:ac:11:00:02, length 28
>14:23:43.782961  In 02:42:ac:11:00:02 ethertype ARP (0x0806), length 44: Ethernet (len 6), IPv4 (len 4), >Reply 172.17.0.2 is-at 02:42:ac:11:00:02, length 28

**Describe the results you expected:**

One syn to the correct interface, and no TCP RST.

 
>    172.17.0.1.47527 > 172.17.0.2.1234: Flags [S], cksum 0x5854 (incorrect -> 0x0987), seq 3696084559, win 29200, options [mss 1460,sackOK,TS val 869523288 ecr 0,nop,wscale 7], length 0
>14:27:33.575223 Out 02:42:3d:96:f0:16 ethertype IPv4 (0x0800), length 76: (tos 0x0, ttl 64, id 6423, offset 0, flags [DF], proto TCP (6), length 60)
>    172.17.0.1.47527 > 172.17.0.2.1234: Flags [S], cksum 0x5854 (incorrect -> 0x0987), seq 3696084559, win 29200, options [mss 1460,sackOK,TS val 869523288 ecr 0,nop,wscale 7], length 0
>14:27:33.575255   P 02:42:ac:11:00:02 ethertype IPv4 (0x0800), length 76: (tos 0x0, ttl 64, id 0, offset 0, flags [DF], proto TCP (6), length 60)
>    172.17.0.2.1234 > 172.17.0.1.47527: Flags [S.], cksum 0x5854 (incorrect -> 0x1bb6), seq 3474984035, ack 3696084560, win 28960, options [mss 1460,sackOK,TS val 869523288 ecr 869523288,nop,wscale 7], length 0
>14:27:33.575255  In 02:42:ac:11:00:02 ethertype IPv4 (0x0800), length 76: (tos 0x0, ttl 64, id 0, offset 0, flags [DF], proto TCP (6), length 60)
>    172.17.0.2.1234 > 172.17.0.1.47527: Flags [S.], cksum 0x5854 (incorrect -> 0x1bb6), seq 3474984035, ack 3696084560, win 28960, options [mss 1460,sackOK,TS val 869523288 ecr 869523288,nop,wscale 7], length 0
>14:27:33.575280 Out 02:42:3d:96:f0:16 ethertype IPv4 (0x0800), length 68: (tos 0x0, ttl 64, id 6424, offset 0, flags [DF], proto TCP (6), length 52)
>    172.17.0.1.47527 > 172.17.0.2.1234: Flags [.], cksum 0x584c (incorrect -> 0xbabd), ack 1, win 229, options [nop,nop,TS val 869523288 ecr 869523288], length 0

**Additional information you deem important (e.g. issue happens only occasionally):**

Issue happens after roughly 10 min of inactivity to the docker container. Only first connection, second will be okay.

**Output of `docker version`:**

$ docker version
Client:
 Version:      1.10.3
 API version:  1.22
 Go version:   go1.5.3
 Git commit:   20f81dd
 Built:        Thu Mar 10 15:54:52 2016
 OS/Arch:      linux/amd64

Server:
 Version:      1.10.3
 API version:  1.22
 Go version:   go1.5.3
 Git commit:   20f81dd
 Built:        Thu Mar 10 15:54:52 2016
 OS/Arch:      linux/amd64

Reproducable with this version also :

# docker version
Client:
 Version:      1.12.6
 API version:  1.24
 Go version:   go1.6.4
 Git commit:   78d1802
 Built:        Tue Jan 10 20:38:45 2017
 OS/Arch:      linux/amd64

Server:
 Version:      1.12.6
 API version:  1.24
 Go version:   go1.6.4
 Git commit:   78d1802
 Built:        Tue Jan 10 20:38:45 2017
 OS/Arch:      linux/amd64

**Output of `docker info`:**

$ docker info
Containers: 11
 Running: 3
 Paused: 0
 Stopped: 8
Images: 534
Server Version: 1.10.3
Storage Driver: aufs
 Root Dir: /var/lib/docker/aufs
 Backing Filesystem: extfs
 Dirs: 486
 Dirperm1 Supported: true
Execution Driver: native-0.2
Logging Driver: json-file
Plugins:
 Volume: local
 Network: bridge null host
Kernel Version: 3.19.0-25-generic
Operating System: Ubuntu 14.04.3 LTS
OSType: linux
Architecture: x86_64
CPUs: 32
Total Memory: 188.8 GiB
Name: WORKER-1
ID: 4JYY:V3VB:STP3:FYAK:NYUI:RTBL:SVZZ:NDLK:SAUH:N2KT:2XVC:4XOL
WARNING: No swap limit support

**Additional environment details (AWS, VirtualBox, physical, etc.):**

physical machines

**Comment by AkihiroSuda** [comment]
@newtoncorp 
Do you still hit the issue with 1.13?

**Comment by newtoncorp** [comment]
I've just tried and yes I still hit the issue with 1.13.
Attached is a pcap of the flow.

[docker.1.13.zip](https://github.com/docker/docker/files/729605/docker.1.13.zip)

**Comment by newtoncorp** [comment]
@AkihiroSuda do you need more information for this issue ?

**Comment by newtoncorp** [comment]
Hello,

Did anyone have time to look into this ?

**Comment by sanimej** [comment]
@newtoncorp In your prod you don't run into this issue if you run couple of containers and happens only if you have 30+ containers ?

**Comment by newtoncorp** [comment]
I might have an explanation as why this happens. The bridge has it's own fdb which has a timer of 600 seconds by default. If the destination MAC is unknown (has expired for example), it does a unicast flood which could be root cause of the issue.

I'm unable to reproduce by setting the bridge fdb timeout infinite : `brctl setageing docker0 0`

**Comment by thaJeztah** [comment]
@euanh ptal ^^

**Comment by Yajo** [comment]
Might this be the problem why, when people have bad networks, they get errors like this?:

<pre><font color="#EF2929">➤ </font><b>curl</b> <font color="#06989A">https://example.com/web/content/03030303-1b9cc64/web.assets_backend.js</font> <font color="#729FCF">&gt;</font> <font color="#729FCF">/dev/null</font>
  % Total    % Received % Xferd  Average Speed   Time    Time     Time  Current
                                 Dload  Upload   Total   Spent    Left  Speed
 40 1834k   40  748k    0     0  14742      0  0:02:07  0:00:51  0:01:16 22117
curl: (18) transfer closed with 1112977 bytes remaining to read
</pre>

:point_up: The connection schema there is:

```
my laptop --> Internet --> server docker --> traefik container --> backend http server
```

In a fast connection, there are absolutely no problems. In the server, there are more than 30 containers.

This might be the root cause of https://github.com/containous/traefik/issues/4407#issuecomment-455394544.

**Comment by naisofly** [comment]
I hear @newtoncorp now has a fix 😄

**Comment by newtoncorp** [comment]
the best fix is to set the mac of the container in the bridge statically for the lifetime of the container :)

cf https://github.com/moby/moby/issues/30405#issuecomment-476702182
